EAN,EAN_OnPage,ASIN,SupplierTitle,AmazonTitle,SupplierURL,AmazonURL,bought_in_past_month,fba_seller_count,fbm_seller_count,total_offer_count,SupplierPrice_incVAT,SupplierPrice_exVAT,SellingPrice_incVAT,ReferralFee,FBAFee,PrepHouseFee,OutputVAT,InputVAT,NetProceeds,HMRC,NetProfit,ROI,Breakeven,ProfitMargin
5013922069531,,B0D73QC7C4,Artbox Colouring & Sticker Books Assorted,5 Pack Reusable Sticker Book - Childrens Books and Plane Activities for Kids - Toddler Books and Travel Activity Packs for Kids - Dinosaur Sticker Book with Reusable Stickers,https://www.poundwholesale.co.uk/artbox-colouring-sticker-books-assorted,https://www.amazon.co.uk/dp/B0D73QC7C4,500.0,,,,0.56,0.46666666666666673,12.99,1.9485,2.8,0.55,2.1650000000000005,0.09333333333333335,5.516500000000001,2.071666666666667,2.8948333333333336,284.73770491803276,5.858499999999999,22.285091095714655
48256219265,,B0CZJRPXD5,Astonish Fabric Refresher Spray 750ml,"Astonish Specialist Extra Strength Mould & Mildew Stain Blaster Spray, for Fast Mould Removal, 750ml. Paired with Crevice cleaning brush for those hard to reach places",https://www.poundwholesale.co.uk/astonish-fabric-refresher-spray-750ml,https://www.amazon.co.uk/dp/B0CZJRPXD5,,Available (see Keepa data),,1.0,0.6,0.5,12.99,1.69,2.94,0.55,2.1650000000000005,0.1,5.595000000000001,2.0650000000000004,2.9800000000000004,283.8095238095238,5.78,22.940723633564282
48256291063,,B0CZJRPXD5,Astonish Antibacterial Surface Cleanser Spray 750ml,"Astonish Specialist Extra Strength Mould & Mildew Stain Blaster Spray, for Fast Mould Removal, 750ml. Paired with Crevice cleaning brush for those hard to reach places",https://www.poundwholesale.co.uk/astonish-antibacterial-surface-cleanser-spray-750ml,https://www.amazon.co.uk/dp/B0CZJRPXD5,,Available (see Keepa data),,1.0,0.6,0.5,12.99,1.69,2.94,0.55,2.1650000000000005,0.1,5.595000000000001,2.0650000000000004,2.9800000000000004,283.8095238095238,5.78,22.940723633564282
8901030866784,3253581766859,B09D7Z68JN,Axe Sport Blast 3-in-1 Shower Gel 250ml,L'OCCITANE Verbena Shower Gel 250ml | Citrus Scented | Vegan & 99% Readily Biodegradable | Premium & Clean Beauty for All Skin Types,https://www.poundwholesale.co.uk/axe-sport-blast-3-in-1-shower-gel-250ml,https://www.amazon.co.uk/dp/B09D7Z68JN,,,Available (see Keepa data),3.0,1.33,1.1083333333333334,17.5,2.63,2.72,0.55,2.916666666666667,0.22166666666666668,7.903333333333334,2.6950000000000003,4.658333333333334,280.90452261306535,7.2299999999999995,26.619047619047624
5038673220086,,B0F671H1H9,5 Hook Hat & Coat Rack,"Maxzwell Wall Mounted Coat Rack with 5 Hooks – Modern Metal & Wood Hook Rail for Coats, Hats, Towels, Bags & Jackets – Space Saving Organizer for Entryway, Bathroom & Bedroom –Satin Finish (Pack of 2)",https://www.poundwholesale.co.uk/5-hook-hat-coat-rack,https://www.amazon.co.uk/dp/B0F671H1H9,,Available (see Keepa data),,1.0,1.27,1.0583333333333333,16.95,2.2,3.04,0.55,2.825,0.21166666666666667,7.615000000000002,2.6133333333333333,4.451666666666669,276.7875647668395,7.06,26.26352015732548
5060082939464,,B07SS4MK7J,A4 Maths Pad,"SUMMIT A4 Refill Pad, 5 mm Squared, 160 Page, Pack of 5",https://www.poundwholesale.co.uk/a4-maths-pad,https://www.amazon.co.uk/dp/B07SS4MK7J,100.0,,,,0.6,0.5,12.99,1.9485,2.8,0.55,2.1650000000000005,0.1,5.4765000000000015,2.0650000000000004,2.8615000000000013,272.52380952380963,5.898499999999999,22.028483448806785
8720181153617,5702017817620,B0DWF1N45H,Axe Africa 3-in-1 Shower Gel 250ml,"LEGO Star Wars: Ahsoka Death Trooper & Night Trooper Battle Pack, Small Gift for Boys, Girls and Any Fans Aged 6 Years Old and Over, Dropship Building Toy for Kids, 4 Characters with Blasters 75412",https://www.poundwholesale.co.uk/axe-africa-3-in-1-shower-gel-250ml,https://www.amazon.co.uk/dp/B0DWF1N45H,800.0,Available (see Keepa data),Available (see Keepa data),28.0,1.33,1.1083333333333334,17.65,2.65,2.94,0.55,2.9416666666666664,0.22166666666666668,7.788333333333332,2.7199999999999998,4.518333333333333,272.4623115577889,7.47,25.59962228517469
8008990009531,8008990009531,B09STXSDFX,Aqua Kids Hypoallergenic Gentle Massage Bath Mitt,"Aqua Massage Kids Delicate Hypoallergenic Bath Mitt, 1 Piece",https://www.poundwholesale.co.uk/aqua-kids-hypoallergenic-gentle-massage-bath-mitt,https://www.amazon.co.uk/dp/B09STXSDFX,,,Available (see Keepa data),2.0,1.09,0.9083333333333334,13.88,2.08,1.83,0.55,2.3133333333333335,0.1816666666666667,6.566666666666667,2.131666666666667,3.8850000000000007,266.40000000000003,5.55,27.989913544668592
5060082933103,,B0CL287WZ1,5pk Mechanical Pencils Assorted Body Colours,"Four Candies Metal Mechanical Pencil Set, 3PCS Art Drafting Pencils 0.5, 0.7, 0.9MM & 2PCS 2MM Mechanical Drawing Pencils with 420PCS Leads (4B 2B HB 2H Color) for Writing Sketching Drawing (Black)",https://www.poundwholesale.co.uk/5pk-mechanical-pencils-assorted-body-colours,https://www.amazon.co.uk/dp/B0CL287WZ1,50.0,,,,0.58,0.48333333333333334,12.74,1.911,2.8,0.55,2.1233333333333335,0.09666666666666666,5.325666666666667,2.026666666666667,2.7489999999999997,266.03225806451604,5.841,21.57770800627943
5013922069180,,B0DWFPLH5N,Artbox Puffy Sticker Activity Books Assorted,"Elfew 6 Pack Reusable Sticker Books for Kids Ages 2-4 Year Old, 3D Puffy Stickers for Children, Airplane Activities for Kids 4-8 Girls Boys Birthday Gifts",https://www.poundwholesale.co.uk/artbox-puffy-sticker-activity-books-assorted,https://www.amazon.co.uk/dp/B0DWFPLH5N,100.0,,,,0.64,0.5333333333333333,12.99,1.9485,2.8,0.55,2.1650000000000005,0.10666666666666667,5.436500000000001,2.058333333333334,2.828166666666667,261.0615384615385,5.9384999999999994,21.7718758018989
5013922069500,,B07C5LFDC5,Artbox Fun Educational Books Assorted,Coogam Magnetic Travel Tangram Puzzles Book Games IQ Educational Toys Age 3+ for Kids Adults (360 Patterns),https://www.poundwholesale.co.uk/artbox-fun-educational-books-assorted,https://www.amazon.co.uk/dp/B07C5LFDC5,100.0,,,,0.64,0.5333333333333333,12.99,1.9485,2.8,0.55,2.1650000000000005,0.10666666666666667,5.436500000000001,2.058333333333334,2.828166666666667,261.0615384615385,5.9384999999999994,21.7718758018989
5015302423209,,B09H6Y14KH,Bello Bottle Cooler Gel Bag,"Mancro Breastmilk Cooler Bag Fits 6 Baby Bottles with Ice Pack & Shoulder Strap, Baby Bottle Cooler Bag Insulated Small Cooler Lunch Bag for Daycare Nursing Mom Travel Picnic Fruits Drinks, Black",https://www.poundwholesale.co.uk/bello-bottle-cooler-gel-bag,https://www.amazon.co.uk/dp/B09H6Y14KH,,Available (see Keepa data),,1.0,1.83,1.5250000000000001,19.99,3.0,2.87,0.55,3.3316666666666666,0.30500000000000005,8.95833333333333,3.0266666666666664,5.381666666666664,259.3574297188753,8.25,26.921794230448548
5038673190051,0190835894865,B07GF46ZNS,Avante Floral White Side Plate 20cm,Shower Head and 1.5m Chrome Shower Hose High Pressure Shower Head with 3 Spray Modes Water Saving Bathing Turbocharged Design for Universal Handheld Showerhead for Bathroom,https://www.poundwholesale.co.uk/avante-floral-white-side-plate-20cm,https://www.amazon.co.uk/dp/B07GF46ZNS,100.0,Available (see Keepa data),,2.0,0.71,0.5916666666666667,12.99,1.68,2.9,0.55,2.1650000000000005,0.11833333333333333,5.534999999999999,2.0466666666666673,2.9383333333333317,257.37226277372247,5.839999999999999,22.61996407492942
8696601064354,5060984592309,B0BSFN7BK9,Alya Bubble Gum Air Freshener Automatic Spray 250ml,"SOL 12pk Gel Air Fresheners - Pacific Surf & Fresh Berries Scents, Odour Eliminator Room Fresheners, Bathroom Air Fresheners, Toilet Deodorisers, Long-Lasting Room Fragrance for Home & Office",https://www.poundwholesale.co.uk/alya-bubble-gum-air-freshener-automatic-spray-250ml,https://www.amazon.co.uk/dp/B0BSFN7BK9,100.0,,Available (see Keepa data),1.0,0.82,0.6833333333333333,14.99,2.2485,3.36,0.55,2.4983333333333335,0.1366666666666667,6.0631666666666675,2.361666666666667,3.1515000000000004,255.52702702702703,6.9784999999999995,21.024016010673783
8696601040839,5060984592309,B0BSFN7BK9,Alya Marine Waves Air Freshener Automatic Spray 250ml,"SOL 12pk Gel Air Fresheners - Pacific Surf & Fresh Berries Scents, Odour Eliminator Room Fresheners, Bathroom Air Fresheners, Toilet Deodorisers, Long-Lasting Room Fragrance for Home & Office",https://www.poundwholesale.co.uk/alya-marine-waves-air-freshener-automatic-spray-250ml,https://www.amazon.co.uk/dp/B0BSFN7BK9,100.0,,Available (see Keepa data),1.0,0.82,0.6833333333333333,14.99,2.2485,3.36,0.55,2.4983333333333335,0.1366666666666667,6.0631666666666675,2.361666666666667,3.1515000000000004,255.52702702702703,6.9784999999999995,21.024016010673783
8696601070188,,B0B3GHY7Y1,Alya Coffee Latte Reed Diffuser 100ml,Luxury Sandalwood & Vanilla Reed Diffuser | Long-Lasting 100ml Home Fragrance | Includes Extra Rattan Reeds for Optimal Scent Throw | Vegan & Cruelty-Free for Home & Office Décor,https://www.poundwholesale.co.uk/alya-coffee-latte-reed-diffuser-100ml,https://www.amazon.co.uk/dp/B0B3GHY7Y1,,Available (see Keepa data),,1.0,1.62,1.35,18.99,2.85,3.1,0.55,3.165,0.2700000000000001,8.254999999999995,2.895,4.809999999999996,253.15789473684188,8.120000000000001,25.329120589784075
,,B08MY7ZXYF,Aquathree 70% Alcohol Antibacterial Hand Sanitiser Gel 100ml,6 x 500ml Hand Sanitiser 70% Alcohol Gel Anti Bacteria Viral Eliminating Formula Gel Alcohol Anti Bacterial Formula Pack Of 6,https://www.poundwholesale.co.uk/aquathree-70-alcohol-antibacterial-hand-sanitiser-moisturiser-gel-100ml,https://www.amazon.co.uk/dp/B08MY7ZXYF,600.0,,Available (see Keepa data),1.0,1.2,1.0,15.99,2.3985,2.8,0.55,2.6650000000000005,0.2,6.926499999999998,2.4650000000000003,3.9114999999999975,252.35483870967724,6.948499999999999,24.46216385240774
5050837390015,,B0F9PY5V7G,Aqua Shot Water Bombs with Nozzle 75 Pack,"2-Pack Water Balloons – 222 Pieces Quick-Fill Assorted Water Bombs with Hose Nozzle – Fun Summer Toy for Kids, Garden, Pool Parties & Outdoor Games By ASPIRE UK",https://www.poundwholesale.co.uk/aqua-shot-water-bombs-with-nozzle-75-balloons,https://www.amazon.co.uk/dp/B0F9PY5V7G,50.0,,,,0.5,0.4166666666666667,11.99,1.7985,2.8,0.55,1.9983333333333335,0.08333333333333334,4.893166666666666,1.9150000000000003,2.428166666666666,251.18965517241367,5.648499999999999,20.251598554350842
5033849927769,,B0B49N1529,"Baby Doll 10"" Assorted","Toy Choi's Twin Baby Doll Set - 12"" Soft Body Pink & Blue Baby Dolls with Rompers and Hat Pacifier and Doll Bibs, Preschool Toy Gift for Toddler and Kids",https://www.poundwholesale.co.uk/baby-doll-10-assorted,https://www.amazon.co.uk/dp/B0B49N1529,50.0,Available (see Keepa data),,1.0,3.24,2.7,27.99,4.2,3.05,0.55,4.665,0.5400000000000001,12.834999999999999,4.125,8.159999999999998,251.076923076923,11.040000000000001,29.153269024651657
5053249240428,,B09J56XD6J,151 Heavy Duty Rubber Household Gloves Large,151 Products 1511197 Black Heavy Duty Rubber Gloves - Large,https://www.poundwholesale.co.uk/151-heavy-duty-rubber-household-gloves-large-1-pair,https://www.amazon.co.uk/dp/B09J56XD6J,,,,,0.68,0.5666666666666668,12.98,1.947,2.8,0.55,2.1633333333333336,0.11333333333333334,5.389666666666667,2.0500000000000003,2.7896666666666663,249.82089552238799,5.976999999999999,21.49203903441191
5015302423179,0772060015729,B0D14C15JT,Bello Disco Mirrorball Tumbler With Straw,"40 oz Tumbler with Handle, Leakproof Insulated Tumbler with Lid and Straw, Stainless Steel Travel Coffee Mug Cup, Car Cup Holder Friendly, Keep Cold for 30 Hours,Gifts for Women & Men, Light Pink",https://www.poundwholesale.co.uk/bello-disco-mirrorball-tumbler-with-straw,https://www.amazon.co.uk/dp/B0D14C15JT,,Available (see Keepa data),,1.0,2.2,1.8333333333333335,21.99,3.3,3.05,0.55,3.665,0.36666666666666675,9.774999999999999,3.2983333333333333,5.926666666666665,248.67132867132855,9.100000000000001,26.951644686978927
5013922040400,,B0D1Q7J6ZR,Artbox Bumper Activity Book 3 Pack VAT Free,"Elfew 20 Pack Small Activity Books for Kids Ages 4-12 Year Old, Kids Party Bag Fillers, Carnival Prizes, Word Search, Find the Difference, Maze and Search Hidden Object, Goodie Bag Gift Stuffer",https://www.poundwholesale.co.uk/multi-activity-pack-set-of-3,https://www.amazon.co.uk/dp/B0D1Q7J6ZR,100.0,,,,0.71,0.5916666666666667,12.99,1.9485,2.8,0.55,2.1650000000000005,0.11833333333333333,5.366500000000001,2.0466666666666673,2.7698333333333336,242.61313868613144,6.0085,21.322812419810113
5013922069203,5015934896778,B0F21TBHP8,Artbox Carry Activity Pad Assorted,"abeec Colouring & Activity Lap Case Pink | Portable Travel Art Set for Girls | 40 Page Colouring Pad, 6 Felt Tip Pens, Over 100 Stickers | Fun Lap Tray for Holidays, Homework & Road Trips",https://www.poundwholesale.co.uk/artbox-carry-activity-pad-assorted,https://www.amazon.co.uk/dp/B0F21TBHP8,50.0,Available (see Keepa data),Available (see Keepa data),2.0,0.65,0.5416666666666667,12.99,1.95,3.04,0.55,2.1650000000000005,0.10833333333333334,5.184999999999999,2.056666666666667,2.5783333333333314,236.18320610687,6.19,19.848601488324334
5055319556668,9339036997604,B09H7KC5Q2,Auto Extreme Car Upholstery Brush 14cm X 6.5cm,"GreatCool 62"" Car Wash Brush Kit With Super Long Handle, 2 in 1 Chenille Microfiber Car Wash Mop Cleaning Mitt Suitable for Washing Cars Truck SUV RV Caravans and Household, Scratch Free(2 x Mop Head)",https://www.poundwholesale.co.uk/auto-extreme-car-upholstery-brush-14cm-x-6-5cm,https://www.amazon.co.uk/dp/B09H7KC5Q2,400.0,Available (see Keepa data),,1.0,0.97,0.8083333333333333,17.99,2.7,4.73,0.55,2.9983333333333335,0.16166666666666668,6.591666666666666,2.836666666666667,3.204999999999999,235.9509202453987,8.950000000000001,17.81545302946081
5053249231235,0691057588162,B0FKZVPF9R,151 Assorted Colour Plastic Clothes Pegs 30 Pack,"Strong Grip Clothes Pegs 72 Pack – Durable Plastic & Metal Pegs for Secure Hold Washing Line – Assorted Colours, Heavy-Duty Clothespin, Hanger Clip, Windproof, Non-Slip",https://www.poundwholesale.co.uk/151-assorted-colour-plastic-clothes-pegs-30-pack,https://www.amazon.co.uk/dp/B0FKZVPF9R,,,Available (see Keepa data),1.0,0.95,0.7916666666666666,13.99,2.0985,2.8,0.55,2.331666666666667,0.15833333333333335,5.809833333333333,2.173333333333334,3.086499999999999,230.04968944099372,6.398499999999999,22.062187276626155
8696601064187,5060896790794,B0C6FM877Z,Alya Exotic Leaves Home Fragrance Air Freshener 300ml,Valentte Reed Diffuser - White Neroli & Lemon Scent | Essential Oil Aroma for Home | 100 ml,https://www.poundwholesale.co.uk/alya-exotic-leaves-home-fragrance-air-freshener-300ml,https://www.amazon.co.uk/dp/B0C6FM877Z,400.0,,Available (see Keepa data),1.0,0.7,0.5833333333333334,13.1,1.97,3.1,0.55,2.1833333333333336,0.11666666666666665,5.146666666666666,2.066666666666667,2.5299999999999985,223.23529411764693,6.319999999999999,19.31297709923663
48256219456,0633710319829,B0BJK9GFG1,Astonish Multi-Purpose Cleaner With Bleach Spray 750ml,"Bower Collective Natural Limescale Remover Spray Refill, Powerful Bathroom Cleaner & Shower Screen Cleaner, Daily Multi Surface Cleaner for Taps, Sinks & Toilets, 1 Litre",https://www.poundwholesale.co.uk/astonish-multi-purpose-cleaner-with-bleach-spray-750ml,https://www.amazon.co.uk/dp/B0BJK9GFG1,,Available (see Keepa data),,1.0,0.6,0.5,11.99,1.56,3.05,0.55,1.9983333333333335,0.1,4.781666666666666,1.8983333333333334,2.333333333333333,222.2222222222222,5.76,19.460661662496523
5033849022068,,B0D6YM9VG7,Bamboo Neon Fishing Net 110cm X 20cm Assorted Colours,"SF Portable Crab Drop Net with Net Bait Bag & Rope & Line Handle for Crabbing Catch Fish Prawn Crayfish Lobster, Multi Colors(Set of 2/4, W30cm x H25cm)",https://www.poundwholesale.co.uk/bamboo-neon-fishing-net-110cm-x-20cm-assorted-colours,https://www.amazon.co.uk/dp/B0D6YM9VG7,,Available (see Keepa data),,1.0,0.69,0.575,12.99,1.95,3.15,0.55,2.1650000000000005,0.11499999999999999,5.035,2.0500000000000007,2.4349999999999996,216.4444444444444,6.339999999999999,18.745188606620474
5013922069234,,B0B3XG3KXX,Artbox Hunt & Colour Colouring Book Assorted,"Faccito 24 Pcs Bulks Coloring Books for Kids, Animal Mini Coloring Books DIY Art Drawing Set Mini Activity Pages for Summer Animals Birthday Gifts Party Favors Toddlers 1-3(Farmhouse)",https://www.poundwholesale.co.uk/artbox-hunt-colour-colouring-book-assorted,https://www.amazon.co.uk/dp/B0B3XG3KXX,50.0,,,,0.64,0.5333333333333333,11.99,1.7985,2.8,0.55,1.9983333333333335,0.10666666666666667,4.753166666666666,1.8916666666666668,2.3114999999999997,213.3692307692307,5.7885,19.27856547122602
5013922011905,,B08ZHJ9KGV,Artbox Mixed Craft Essentials Pack,"obqo Irichna 1000+ Pcs Kids Craft Box Kit, Toddler Arts and Crafts for Kids includes Pom Poms, Pipe Cleaners, Feather, Folding Craft Box - All in One for Kids Toddler DIY Craft Set (Pink)",https://www.poundwholesale.co.uk/artbox-mixed-craft-essentials-pack,https://www.amazon.co.uk/dp/B08ZHJ9KGV,50.0,Available (see Keepa data),,1.0,2.05,1.7083333333333333,19.99,3.0,3.26,0.55,3.3316666666666666,0.3416666666666667,8.348333333333333,2.9899999999999998,4.808333333333333,212.9151291512915,8.86,24.053693513423376
5013922069210,,B0F21XDH3P,Artbox Sticker Scenes Activity Book Assorted,"D-FantiX 3D Puffy Stickers for Toddlers 2-4 Years, Reusable Sticker Books for Girls Ages 4-8, Dress-Up, Princess, Mermaid, Pet, Car Road Trip Activities for Kids 3-5, Airplane Travel Essentials",https://www.poundwholesale.co.uk/artbox-sticker-scenes-activity-book-assorted,https://www.amazon.co.uk/dp/B0F21XDH3P,,,,,1.25,1.0416666666666667,14.99,2.2485,2.8,0.55,2.4983333333333335,0.20833333333333334,6.193166666666668,2.29,3.3531666666666684,210.6701570680629,6.8485,22.369357349344018
5053249246772,5070000542034,B0BPYXS2SZ,151 Masking Tape 24mm X 40m,Point One Products 120m WIDE MASKING TAPE. 4 ROLLS. Thick Masking Tape for Painting and Decorating - Multi-Use Paper Tape. 4 x 30m rolls of 48mm Low Tack Masking Tape,https://www.poundwholesale.co.uk/151-masking-tape-24mm-x-40m,https://www.amazon.co.uk/dp/B0BPYXS2SZ,600.0,Available (see Keepa data),,2.0,0.77,0.6416666666666667,12.49,1.62,3.04,0.55,2.081666666666667,0.12833333333333335,4.9783333333333335,1.9533333333333336,2.4749999999999996,207.69230769230762,5.9799999999999995,19.815852682145714
5065000925055,,B07C5SKVL7,Beauty Essentials 6pc Cleansing & Exfoliating Pack,CeraVe Foaming Cleanser for Normal to Oily Skin with Niacinamide and 3 Essential Ceramides,https://www.poundwholesale.co.uk/beauty-essentials-6pc-cleansing-exfoliating-pack,https://www.amazon.co.uk/dp/B07C5SKVL7,,Available (see Keepa data),Available (see Keepa data),7.0,0.55,0.45833333333333337,9.36,0.75,2.42,0.55,1.56,0.09166666666666669,4.079999999999999,1.4683333333333333,2.0616666666666656,204.4628099173553,4.27,22.026353276353266
5013922068923,,B0B3XG3KXX,Artbox A4 My Colouring Book With 6 Pencils Assorted,"Faccito 24 Pcs Bulks Coloring Books for Kids, Animal Mini Coloring Books DIY Art Drawing Set Mini Activity Pages for Summer Animals Birthday Gifts Party Favors Toddlers 1-3(Farmhouse)",https://www.poundwholesale.co.uk/artbox-a4-my-colouring-book-with-6-pencils-assorted,https://www.amazon.co.uk/dp/B0B3XG3KXX,50.0,,,,0.68,0.5666666666666668,11.99,1.7985,2.8,0.55,1.9983333333333335,0.11333333333333334,4.713166666666666,1.8850000000000002,2.2781666666666656,204.01492537313422,5.828499999999999,19.000556018904632
,5065005230260,B09J92GRXR,4 Layer Filtration Face Mask,FFP3 Masks Pack of 10 With >99% Filtration Efficiency - Disposable Face Mask UK - Soft And Secure Fit (Packaging may vary),https://www.poundwholesale.co.uk/5-layer-filtration-face-mask,https://www.amazon.co.uk/dp/B09J92GRXR,,Available (see Keepa data),,1.0,0.65,0.5416666666666667,11.99,1.8,2.94,0.55,1.9983333333333335,0.10833333333333334,4.601666666666667,1.8900000000000001,2.161666666666666,198.01526717557246,5.94,18.02891298304142
5033849985035,,B0B68GBL3X,Adults Plastic Frame Sunglasses CDU Assorted Colours,ASTARON 12 Pack Party Sunglasses Bulk Neon Party Favors for Beach Wedding Party Pool Party Supplies,https://www.poundwholesale.co.uk/adults-plastic-frame-sunglasses-cdu-assorted-colours,https://www.amazon.co.uk/dp/B0B68GBL3X,,,,,1.34,1.1166666666666667,14.99,2.2485,2.8,0.55,2.4983333333333335,0.22333333333333336,6.103166666666668,2.2750000000000004,3.2781666666666682,196.69000000000008,6.9384999999999994,21.869023793640217
5013922192802,,B083QV477N,4 Tubs Of 60ml Magic Bubbles,"JOYIN 72 pcs Mini Bubble Wands Age 3+, Bubbles Party Bag Fillers, Bubble Tube, Mini Bubbles for Party Bags, Wedding Engagement Anniversary Classroom Party Favors Gift, Game prizes",https://www.poundwholesale.co.uk/4-tubs-of-60ml-magic-bubbles,https://www.amazon.co.uk/dp/B083QV477N,400.0,,,,0.71,0.5916666666666667,11.89,1.7835,2.8,0.55,1.981666666666667,0.11833333333333333,4.614833333333334,1.8633333333333335,2.201500000000001,192.8321167883213,5.8435,18.515559293523978
5055319514606,,B0CKX1FG7P,Auto Extreme Car Pump Sprayer 2L,"Cliselda Acrylic Display Case with Black Base, Assemble Acrylic Display Box, Acrylic Box Curiosity Cube Plastic Dustproof Showcase for Display Collectible Action Figures Toys (20x20x30 cm)",https://www.poundwholesale.co.uk/auto-extreme-car-pump-sprayer-2l,https://www.amazon.co.uk/dp/B0CKX1FG7P,,Available (see Keepa data),,1.0,3.85,3.2083333333333335,26.99,4.05,3.26,0.55,4.498333333333333,0.6416666666666667,11.331666666666667,3.8566666666666665,6.925000000000001,184.2572062084257,11.71,25.65765098184513
0687368096816,5056243621224,B0DKX4GBTJ,Victsing Wireless Rechargeable Big Size Ergonomic Mouse,"TECKNET Ergonomic Mouse, Bluetooth Rechargeable Vertical Mouse (BT5.0/3.0+USB-A), Wireless Right handed Mouse 6-Button, Optical Mouse 4800 DPI 6 Adjustable Levels,Quiet Clicks,Wide Compatibility-Black",https://www.poundwholesale.co.uk/victsing-wireless-rechargeable-big-size-ergonomic-mouse,https://www.amazon.co.uk/dp/B0DKX4GBTJ,300.0,Available (see Keepa data),,2.0,3.5,2.916666666666667,24.99,3.75,3.1,0.55,4.165,0.5833333333333334,10.474999999999998,3.5816666666666666,6.343333333333331,182.98076923076917,10.9,25.383486728024536
8720181153983,3253581766859,B09D7Z68JN,Axe XL Excite 3-in-1 Shower Gel 400ml,L'OCCITANE Verbena Shower Gel 250ml | Citrus Scented | Vegan & 99% Readily Biodegradable | Premium & Clean Beauty for All Skin Types,https://www.poundwholesale.co.uk/axe-xl-excite-3-in-1-shower-gel-400ml,https://www.amazon.co.uk/dp/B09D7Z68JN,,,Available (see Keepa data),3.0,2.04,1.7000000000000002,17.5,2.63,2.72,0.55,2.916666666666667,0.34,7.193333333333334,2.576666666666667,4.066666666666667,180.7407407407408,7.94,23.23809523809524
5060082935152,,B0DSLRRXBY,8pk Black Ballpoint Pens,"AIBULO Black Biro Ballpoint Pens – Pack of 100 – Smooth & Smudge-Free Writing, Comfortable Grip, Long-Lasting Ink, and Durable Design – Ideal for Bulk Use at School, Office, and Home",https://www.poundwholesale.co.uk/10pk-black-ballpoint-pens,https://www.amazon.co.uk/dp/B0DSLRRXBY,50.0,,,,0.58,0.48333333333333334,10.99,1.6485,2.8,0.55,1.8316666666666668,0.09666666666666666,4.129833333333333,1.735,1.8448333333333327,178.53225806451604,5.578499999999999,16.786472550803754
5060082931130,,B07MKWX51X,"""Congratulations"" Assorted Colours Balloons 12 Pack","Dusico® Balloons Rainbow Set (100 Pack) 12 Inches, Assorted Bright Colors, Made With Strong Multicolored Latex, For Helium Or Air Use. Kids Birthday Party Decoration Accessory",https://www.poundwholesale.co.uk/congratulations-balloons-assorted-colours-12-pack,https://www.amazon.co.uk/dp/B07MKWX51X,100.0,Available (see Keepa data),,1.0,0.54,0.45000000000000007,10.99,1.65,2.94,0.55,1.8316666666666668,0.09000000000000001,4.028333333333333,1.7416666666666667,1.7366666666666666,173.66666666666666,5.68,15.802244464664847
5060082934117,,B07MKWX51X,"""It's Party Time"" Balloons 12 Pack","Dusico® Balloons Rainbow Set (100 Pack) 12 Inches, Assorted Bright Colors, Made With Strong Multicolored Latex, For Helium Or Air Use. Kids Birthday Party Decoration Accessory",https://www.poundwholesale.co.uk/its-party-time-balloons-12-pack,https://www.amazon.co.uk/dp/B07MKWX51X,100.0,Available (see Keepa data),,1.0,0.54,0.45000000000000007,10.99,1.65,2.94,0.55,1.8316666666666668,0.09000000000000001,4.028333333333333,1.7416666666666667,1.7366666666666666,173.66666666666666,5.68,15.802244464664847
5015302423070,5060869445102,B0FFB67C4X,Bello Beer Ice Bucket 33cm X 23cm X 14cm Assorted Colours,"Almineez Set of 2 Premium Plastic Drink Bucket - Beverage Tub with Handles - Perfect for Parties, BBQs, Outdoor Events - Cooling Bottles Cans of Beer or Soft Drinks (12L - 12 Litre)",https://www.poundwholesale.co.uk/bello-beer-ice-bucket-33cm-x-23cm-x-14cm-assorted-colours,https://www.amazon.co.uk/dp/B0FFB67C4X,,,Available (see Keepa data),1.0,0.82,0.6833333333333333,11.95,1.7924999999999998,2.8,0.55,1.991666666666667,0.1366666666666667,4.545833333333332,1.8550000000000002,2.1408333333333314,173.58108108108092,5.9624999999999995,17.914923291492315
5055319530781,0756557000573,B098SKTTVZ,Auto Extreme Tropical Mist In-Car Fragrance Air Freshener Spray 100ml,"Acrylic Display Case for Minifigures & Collectibles - 12-Block Stackable, High-Transparency Storage Box",https://www.poundwholesale.co.uk/auto-extreme-tropical-mist-in-car-fragrance-air-freshener-spray-100ml,https://www.amazon.co.uk/dp/B098SKTTVZ,,Available (see Keepa data),,1.0,0.65,0.5416666666666667,11.99,1.8,3.25,0.55,1.9983333333333335,0.10833333333333334,4.291666666666666,1.8900000000000001,1.851666666666666,169.61832061068694,6.25,15.443425076452593
5050375058668,,B0DX8BHN2B,151 Masonry Brush 13cm X 4cm,13 X 4CM Masonry Wall Stone Brick Paint Brush (Pack of 2),https://www.poundwholesale.co.uk/masonry-paint-brush,https://www.amazon.co.uk/dp/B0DX8BHN2B,,,,1.0,0.97,0.8083333333333333,12.28,1.6,2.94,0.55,2.046666666666667,0.16166666666666668,4.723333333333334,1.8850000000000002,2.288333333333333,168.46625766871165,6.06,18.634636264929423
