EAN,EAN_OnPage,ASIN,SupplierTitle,AmazonTitle,SupplierURL,AmazonURL,bought_in_past_month,fba_seller_count,fbm_seller_count,total_offer_count,SupplierPrice_incVAT,SupplierPrice_exVAT,SellingPrice_incVAT,ReferralFee,FBAFee,PrepHouseFee,OutputVAT,InputVAT,NetProceeds,HMRC,NetProfit,ROI,Breakeven,ProfitMargin
5053249220949,,B0D4N6R7YG,151 White Furniture Touch Up Pen 7ml CDU,"LG OLED48C45LA 48-Inch OLED Evo 4K UHD Smart TV, (α9 AI Processor Gen7, Dolby Atmos, Freeview Play and Amazon Alexa, 120Hz), Umber Brown [Model 2024]",https://www.poundwholesale.co.uk/151-white-furniture-touch-up-pen-7ml-cdu,https://www.amazon.co.uk/dp/B0D4N6R7YG,500.0,,,,0.93,0.775,799.0,119.85,2.8,0.55,133.16666666666669,0.15500000000000003,542.2533333333334,133.01166666666668,408.6916666666668,30844.654088050316,124.13,51.15039632874427
5053249248073,,B0D4N6R7YG,151 White Gloss Non-Drip Paint 300ml,"LG OLED48C45LA 48-Inch OLED Evo 4K UHD Smart TV, (α9 AI Processor Gen7, Dolby Atmos, Freeview Play and Amazon Alexa, 120Hz), Umber Brown [Model 2024]",https://www.poundwholesale.co.uk/151-white-gloss-non-drip-paint-300ml,https://www.amazon.co.uk/dp/B0D4N6R7YG,500.0,,,,1.86,1.55,848.0,127.19999999999999,2.8,0.55,141.33333333333337,0.31000000000000005,574.8066666666666,141.02333333333337,433.23333333333323,20630.158730158724,132.41000000000003,51.08883647798741
5053249246741,,B003ICX6TE,151 Double Sided Tape 24mm X 8m 3 Pack,"HP CE505XD 05X High Yield Original LaserJet Toner Cartridges, Black, Multipack",https://www.poundwholesale.co.uk/151-double-sided-tape-24mm-x-8m-3-pack,https://www.amazon.co.uk/dp/B003ICX6TE,,Available (see Keepa data),Available (see Keepa data),8.0,0.68,0.5666666666666668,262.98,28.03,4.99,0.55,43.830000000000005,0.11333333333333334,185.45,43.71666666666667,141.1833333333333,12643.283582089549,34.25,53.68595837452783
5055319512213,,B0BP25DKB9,Auto Extreme Car Air Freshener Assorted Fragrances Clip Strip,"Ceeniu Smart Car Air Freshener, Waterless Ultrasonic, Auto ON/OFF, Plug-Free, Mint Ice Scent, French Natural Fragrance, 4-Month Supply, F26 Car Aroma Diffuser",https://www.poundwholesale.co.uk/auto-extreme-car-air-freshener-assorted-fragrances-clip-strip,https://www.amazon.co.uk/dp/B0BP25DKB9,,Available (see Keepa data),,1.0,0.27,0.22500000000000003,115.99,13.14,3.07,0.55,19.331666666666667,0.045000000000000005,80.17833333333334,19.286666666666665,60.34166666666668,7786.021505376346,17.03,52.02316291634338
5907625372589,,B0DQD293JL,Aqua Kids Printed Gentle Bath Massage Sponge Assorted,"Nifeliz AM24 Formula 1 Racing Car Building Set Age 16+, 1:8 Scale Collectible Car Model Set for Adults, Home or Office Décor, Gifts for men, Women, Him or Her (2351 PCS, NF10279)",https://www.poundwholesale.co.uk/aqua-kids-printed-gentle-bath-massage-sponge-assorted,https://www.amazon.co.uk/dp/B0DQD293JL,,Available (see Keepa data),,1.0,0.95,0.7916666666666666,109.95,16.49,5.16,0.55,18.325000000000003,0.15833333333333335,69.025,18.166666666666668,50.30833333333334,3749.6894409937886,23.15,45.75564650598757
5038673190044,5012663159372,B0CL9WVPY4,"Avante Floral White Side Plate 7.5""","Cara Electric Shower - 7.5kW White (Perluso, Seville, Enrich, Madrid 2)",https://www.poundwholesale.co.uk/avante-floral-white-side-plate-7-5,https://www.amazon.co.uk/dp/B0CL9WVPY4,,,Available (see Keepa data),1.0,0.71,0.5916666666666667,79.98,11.997,2.8,0.55,13.330000000000002,0.11833333333333333,51.14300000000001,13.211666666666668,37.381333333333345,3274.2773722627744,16.057000000000002,46.7383512544803
5038673190068,8720364102418,B0C3MRGH2F,Avante Floral Dinner Plate 23cm,24 Piece Dinner Sets for 6 People - Beautiful Mediterranean Style Stoneware Dinner Set for 6 - Dishwasher & Microwave Safe Plates and Bowls Set for 6 - Dinnerware Sets by Pure Living in Dark Petrol,https://www.poundwholesale.co.uk/avante-floral-dinner-plate-23cm,https://www.amazon.co.uk/dp/B0C3MRGH2F,,Available (see Keepa data),,1.0,0.92,0.7666666666666667,74.95,11.24,7.62,0.55,12.491666666666669,0.15333333333333335,42.678333333333335,12.338333333333335,29.79,2262.5316455696197,20.330000000000002,39.74649766511007
5053249241272,,B01M6XZIZY,151 Chalky Oriental Pink Furniture Spray Paint 400ml,"WAGNER Fence & Decking Paint Sprayer for Fences, Sheds, decking or Garden Furniture, Covers 5 m² in 9 min, 1400 ml Capacity, 460 W, 1.8 m Hose",https://www.poundwholesale.co.uk/151-chalky-oriental-pink-furniture-spray-paint-400ml,https://www.amazon.co.uk/dp/B01M6XZIZY,,,,,0.71,0.5916666666666667,54.99,8.2485,2.8,0.55,9.165000000000001,0.11833333333333333,34.066500000000005,9.046666666666667,24.469833333333337,2143.343065693431,12.308500000000002,44.49869673273929
5015302423155,,B09QQ932ZH,Bello Crazy Straw Party Tumblers 650ml Assorted,"DEERC Remote Control Car 1:10 Scale RC Cars 48+ KM/H High Speed 40+Min Play, 4WD All Terrains Off Road Radio RC for Adults and Kids Hobby RC Truck Vehicle, 2 Battery Crawler Toy Gift for Boys",https://www.poundwholesale.co.uk/bello-crazy-straw-party-tumblers-650ml-assorted,https://www.amazon.co.uk/dp/B09QQ932ZH,,Available (see Keepa data),,2.0,1.62,1.35,89.97,13.5,5.73,0.55,14.995000000000001,0.2700000000000001,54.12499999999999,14.725000000000001,38.849999999999994,2044.7368421052627,21.400000000000002,43.181060353451144
5055319515184,,B0DDTNGJLJ,USB To USB Adapter 1.5m,"Acrylic Display Case with USB RGB LED Lighting Base, App & Key Controlled, Crystal-Clear Display Box with Ball Stand for Soccer, Volleyball & Football, 25x25x25cm",https://www.poundwholesale.co.uk/usb-to-usb-adapter-1-5m,https://www.amazon.co.uk/dp/B0DDTNGJLJ,,Available (see Keepa data),,1.0,0.6,0.5,49.99,7.5,3.35,0.55,8.331666666666669,0.1,30.20833333333333,8.23166666666667,21.42666666666666,2040.6349206349198,12.0,42.86190571447621
5056175973262,,B0F5B32D8L,Aquavault Slim-Sachet Dehumidifiers 2 Pack,"Dehumidifiers for Home, 2200ml Small Dehumidifiers for Bedroom with Auto Defrost Function, Timer Modes, Ultra Quiet, Auto Shut off & 7 Colorful LED Dehumidifier for Bathroom, Wardrobe, Closet, RV",https://www.poundwholesale.co.uk/aquavault-slim-sachet-dehumidifiers-2-pack,https://www.amazon.co.uk/dp/B0F5B32D8L,100.0,Available (see Keepa data),,1.0,0.68,0.5666666666666668,54.99,8.25,4.73,0.55,9.165000000000001,0.11333333333333334,32.165000000000006,9.051666666666668,22.563333333333336,2020.5970149253733,14.21,41.0317027338304
5038673190075,8720364102418,B0C3MRGH2F,Avante Floral Dinner Plate 26cm,24 Piece Dinner Sets for 6 People - Beautiful Mediterranean Style Stoneware Dinner Set for 6 - Dishwasher & Microwave Safe Plates and Bowls Set for 6 - Dinnerware Sets by Pure Living in Dark Petrol,https://www.poundwholesale.co.uk/avante-floral-dinner-plate-26cm,https://www.amazon.co.uk/dp/B0C3MRGH2F,,Available (see Keepa data),,1.0,1.33,1.1083333333333334,74.95,11.24,7.62,0.55,12.491666666666669,0.22166666666666668,42.26833333333334,12.270000000000003,29.448333333333334,1775.7788944723618,20.740000000000002,39.29063820324661
8696601064286,0604220227003,B096S7YCTH,Alya Cool Linen Air Freshener Automatic Spray 250ml,Exec LCD WALL MOUNTED Automatic Air Freshener Dispenser and 6 Refills auto fresh spray cans,https://www.poundwholesale.co.uk/alya-cool-linen-air-freshener-automatic-spray-250ml,https://www.amazon.co.uk/dp/B096S7YCTH,,,Available (see Keepa data),1.0,0.82,0.6833333333333333,44.99,6.7485,2.8,0.55,7.498333333333335,0.1366666666666667,27.12316666666667,7.361666666666668,19.2115,1557.6891891891892,10.918500000000002,42.701711491442545
5015302422233,0190781107095,B075QDW3BF,Bello Collapsible Drinks Dispenser 3.3l Assorted Colours,"HP CF541A 203A Original LaserJet Toner Cartridge, Cyan, Single Pack",https://www.poundwholesale.co.uk/bello-collapsible-drinks-dispenser-3-3l-assorted-colours,https://www.amazon.co.uk/dp/B075QDW3BF,100.0,,Available (see Keepa data),30.0,1.63,1.3583333333333334,64.99,9.75,3.06,0.55,10.831666666666667,0.27166666666666667,39.71833333333333,10.56,28.608333333333324,1499.1266375545847,14.99,44.019592757860174
5015302790349,,B0F33S6861,Assorted Metallic Temporary Gold Tattoos,Yatatu - Over 130 Temporary Tattoos for Weddings with Various Designs - Individual Pieces Ready to Use (English version),https://www.poundwholesale.co.uk/assorted-metallic-temporary-gold-tattoos,https://www.amazon.co.uk/dp/B0F33S6861,,Available (see Keepa data),,1.0,0.22,0.18333333333333335,25.95,3.89,1.87,0.55,4.325,0.036666666666666674,15.644999999999998,4.288333333333333,10.806666666666665,1473.6363636363633,6.53,41.64418754014129
5038673220017,,B0BJVGLGMQ,3 Hook Hat & Coat Rack,"SoBuy Wall Coat Rack Wall Shelf Storage Unit with 3 Baskets & 5 Hooks - Coat Hooks Wall Mounted for Hallway Organiser - Storage Cabinet for Coats, Bags, Scarves W100xD20xH31cm Grey FRG282-HG",https://www.poundwholesale.co.uk/3-hook-hat-coat-rack,https://www.amazon.co.uk/dp/B0BJVGLGMQ,,,Available (see Keepa data),1.0,0.85,0.7083333333333334,52.95,7.94,7.64,0.55,8.825000000000001,0.1416666666666667,27.695,8.683333333333334,18.461666666666666,1467.1523178807947,16.98,34.86622599937047
5000170500428,0039442032898,B08L8XRYY4,Animal World,"Animal Greens Pak - Chlorophyll, Spectra, Superfood Whole Food Prebiotic and Probiotic Super Digestion Blend for Gut Health, Convenient Daily Pill Packs, 30 Count",https://www.poundwholesale.co.uk/animal-world,https://www.amazon.co.uk/dp/B08L8XRYY4,,,,14.0,0.6,0.5,36.95,5.54,3.04,0.55,6.158333333333334,0.1,21.611666666666668,6.0583333333333345,15.003333333333334,1428.888888888889,9.73,40.60442038791159
5000170501661,5901468719167,B07XTMT25R,Baby Doll With Pram,Natural Wicker Dolls Pram Vintage Dolls Pushchairs on Wooden Wheels Pram for Dolls Handmade Toy Buggy Baby Doll Stroller Retro Style Doll Pram with Beige Bedding e-wicker24 (Beige),https://www.poundwholesale.co.uk/baby-doll-with-pram,https://www.amazon.co.uk/dp/B07XTMT25R,,,Available (see Keepa data),1.0,2.98,2.4833333333333334,99.0,17.25,5.63,0.55,16.5,0.49666666666666665,56.64000000000001,16.003333333333334,40.08666666666667,1321.538461538462,26.41,40.4915824915825
5055056750510,5415325171673,B0D233Z4XL,'Welcome' Wellies Door Mat,"Waterhog Machine Washable Door Mat, Pyramid Camel 55 x 85 cm - Heavy Duty & Dirt Trapper Doormat, Non-Slip Rubber Backed Doormat, Easy-to-Clean Outdoor/Indoor Entrance Mat, Made in Europe",https://www.poundwholesale.co.uk/welcome-wellies-door-mat,https://www.amazon.co.uk/dp/B0D233Z4XL,,,Available (see Keepa data),1.0,1.18,0.9833333333333333,50.0,7.5,4.76,0.55,8.333333333333334,0.19666666666666666,28.226666666666667,8.136666666666667,19.54,1274.3478260869565,13.99,39.08
,,B09QQ932ZH,1:24 Scale Rc 4Wd Racing Super Car 27Mhz,"DEERC Remote Control Car 1:10 Scale RC Cars 48+ KM/H High Speed 40+Min Play, 4WD All Terrains Off Road Radio RC for Adults and Kids Hobby RC Truck Vehicle, 2 Battery Crawler Toy Gift for Boys",https://www.poundwholesale.co.uk/1-24-scale-rc-4wd-racing-super-car-27mhz,https://www.amazon.co.uk/dp/B09QQ932ZH,,Available (see Keepa data),,2.0,3.2,2.666666666666667,89.97,13.5,5.73,0.55,14.995000000000001,0.5333333333333334,52.54499999999999,14.461666666666668,37.533333333333324,1166.8393782383416,22.98,41.717609573561546
5013922050225,0850037996001,B09SJZTSK8,Artbox 18 Water Colour Paint Set With Brush,Watercolor Paint Pack with Wood Brushes 12 Washable Colors (1 Count (Pack of 36)),https://www.poundwholesale.co.uk/artbox-18-water-colour-paint-set-with-brush,https://www.amazon.co.uk/dp/B09SJZTSK8,,Available (see Keepa data),,2.0,0.74,0.6166666666666667,36.5,5.48,4.73,0.55,6.083333333333334,0.12333333333333334,19.466666666666665,5.960000000000001,12.956666666666663,1110.5714285714282,11.500000000000002,35.49771689497716
5013922010823,,B0D49GY54W,Artbox Assorted Colour Erasable Colouring Pencils 10 Pack,"D-FantiX 24 Packs Coloured Pencils Bulk, 288 Count Pre-Sharpened Colouring Pencils Set, Back to School Gifts for Students, Elementary Classroom Kindergarten School Supplies for Kids Boys Girls",https://www.poundwholesale.co.uk/artbox-assorted-colour-erasable-colouring-pencils-10-pack,https://www.amazon.co.uk/dp/B0D49GY54W,,,,,0.69,0.575,29.99,4.4985,2.8,0.55,4.998333333333334,0.11499999999999999,17.00316666666666,4.883333333333334,11.569833333333328,1028.4296296296293,8.538499999999999,38.57897076803377
5055319562102,,B00HZWYJJO,Speaker Wire 10 Meter,"12AWG Speaker Wire, GearIT Pro Series 12 AWG Gauge Speaker Wire Cable (100 Feet / 30.48 Meters) Great Use for Home Theater Speakers and Car Speakers Black",https://www.poundwholesale.co.uk/speaker-wire-10-meter,https://www.amazon.co.uk/dp/B00HZWYJJO,,,,,0.61,0.5083333333333333,27.99,4.198499999999999,2.8,0.55,4.665,0.10166666666666667,15.7165,4.5633333333333335,10.603166666666667,1001.8740157480314,8.1585,37.88198166011671
5038673190204,8700216724968,B0DT9PMDGV,Avante Plain White Side Plate 19cm,"Lenor Outdoorable Fabric Conditioner 480 Washes (8x60), Spring Awakening - Ultra Concentrated Freshness",https://www.poundwholesale.co.uk/avante-plain-white-side-plate-19cm,https://www.amazon.co.uk/dp/B0DT9PMDGV,,,,2.0,0.61,0.5083333333333333,32.0,4.16,5.57,0.55,5.333333333333334,0.10166666666666667,16.326666666666668,5.231666666666667,10.545,996.3779527559054,10.89,32.953125
5013922011882,,B07W66T5HR,Artbox Assorted Foam Shapes 100 Pack,baleaf Mens Tracksuit Bottom Joggers with Pockets Running for Men Pants Cotton Sweatpants Elasticated Waisted,https://www.poundwholesale.co.uk/artbox-assorted-foam-shapes-100-pack,https://www.amazon.co.uk/dp/B07W66T5HR,,Available (see Keepa data),,2.0,0.64,0.5333333333333333,26.99,4.05,2.82,0.55,4.498333333333333,0.10666666666666667,14.981666666666664,4.391666666666667,10.039999999999996,926.7692307692303,8.06,37.19896257873285
5013922069265,,B0CX1CLCDX,Artbox A4 Colouring Carry Pad,"8000+Lux Super Bright A4 Light Box Drawing Pad with 3500mAH Battery,6 dimming Levels and 3 Color temperatures Light Table,Light pad for Artists, Drawing,Sketching,Tracking,Weeding Vinyl",https://www.poundwholesale.co.uk/artbox-a4-colouring-carry-pad,https://www.amazon.co.uk/dp/B0CX1CLCDX,,,,,0.64,0.5333333333333333,25.49,3.8234999999999997,2.8,0.55,4.248333333333333,0.10666666666666667,13.978166666666665,4.141666666666667,9.286499999999997,857.2153846153842,7.8134999999999994,36.43193409180069
8904102160438,,B007UQLR9U,Beech Wood Meat Hammer Large,"Capri Tools XZN Triple Square Bit Socket Set S2 Bolt Wrench Bit, Pack of 10",https://www.poundwholesale.co.uk/beech-wood-meat-hammer-large,https://www.amazon.co.uk/dp/B007UQLR9U,,Available (see Keepa data),Available (see Keepa data),3.0,0.92,0.7666666666666667,28.99,3.77,3.05,0.55,4.831666666666667,0.15333333333333335,16.41833333333333,4.678333333333334,11.189999999999994,849.8734177215183,8.290000000000001,38.59951707485338
5038673190228,5022458027267,B0C4VBYRQP,Avante Plain White Dinner Plate 23cm,"Clearly | 100M x 1.2 M Banquet Roll. Disposable Paper Tablecloth for Weddings, Buffets & Dinner. Large 100M long Disposable Tablecover Protector - Plain White",https://www.poundwholesale.co.uk/avante-plain-white-dinner-plate-23cm,https://www.amazon.co.uk/dp/B0C4VBYRQP,300.0,,Available (see Keepa data),1.0,0.78,0.65,26.49,3.9734999999999996,2.8,0.55,4.415,0.13000000000000003,14.521500000000001,4.285,9.6865,807.2083333333331,8.1035,36.5666289165723
,,B0CS392QD8,1:18 RC Model Car With Light Assorted Colours,"RIAARIO 1:18 All Terrain RC Car, 36 KPH High Speed Remote Control Car with 2.4 GHz Remote Control, 4WD Electric Vehicle Off-Road Truck, 4X4 Waterproof RC Trucks with 2 Rechargeable Batteries",https://www.poundwholesale.co.uk/1-18-rc-model-car-assorted-colours,https://www.amazon.co.uk/dp/B0CS392QD8,,Available (see Keepa data),,1.0,4.29,3.575,79.99,11.99,4.68,0.55,13.331666666666667,0.7150000000000001,45.69833333333333,12.616666666666667,32.531666666666666,788.6464646464647,21.51,40.669667041713545
5038673190198,4010537468033,B0897XP3ZR,Avante Plain White Salad Bowl 23cm,"HMF 46800900 Acrylic Display Case for Model Cars / Figures, Various Sizes, Transparent, 30 x 14 x 15 cm",https://www.poundwholesale.co.uk/plain-white-salad-bowl-23cm,https://www.amazon.co.uk/dp/B0897XP3ZR,,Available (see Keepa data),,1.0,1.2,1.0,35.74,5.36,4.73,0.55,5.956666666666667,0.2,18.493333333333336,5.756666666666667,12.186666666666667,786.236559139785,11.840000000000002,34.09811602313002
8697853092836,,B0B132MFN1,Bager Sapphire Dry Food Storage Box 1l,"Zwilling Vacuum, La Mer, Fridge Box",https://www.poundwholesale.co.uk/bager-sapphire-dry-food-storage-box-1l,https://www.amazon.co.uk/dp/B0B132MFN1,,,,,1.06,0.8833333333333334,27.95,4.1925,2.8,0.55,4.658333333333333,0.1766666666666667,15.239166666666664,4.4816666666666665,10.207499999999996,712.1511627906973,8.6025,36.52057245080499
5026180153935,,B0043RSXR8,Apollo Cerbera Bread Knife 20cm,"ZWILLING Bread Knife, Blade length: 20 cm, Serrated blade, Special stainless steel/Plastic handle, Twin Chef,Silver/Black",https://www.poundwholesale.co.uk/cerbera-bread-knife-20cm,https://www.amazon.co.uk/dp/B0043RSXR8,,,,,1.25,1.0416666666666667,29.99,4.4985,2.8,0.55,4.998333333333334,0.20833333333333334,16.443166666666663,4.790000000000001,11.103166666666661,697.5811518324603,9.098500000000001,37.022896521062556
,,B0DZTDQY91,1:16 Scale Rc Model Car Pick-Up Truck,"DEERC 9309E 1/16 All Terrain Fast RC Cars for Adults 40KPH,4WD Electric Off-Road Remote Control Monster Truck,2.4Ghz High Speed Car,Waterproof Monster Truck with 2 Batteries for Boys & Kids",https://www.poundwholesale.co.uk/1-16-scale-rc-model-car-pick-up-truck,https://www.amazon.co.uk/dp/B0DZTDQY91,,Available (see Keepa data),,1.0,6.46,5.383333333333334,99.99,15.0,4.83,0.55,16.665000000000003,1.0766666666666667,57.03499999999999,15.588333333333336,40.896666666666654,689.2696629213481,26.84,40.90075674234089
5053249265124,,B0D8397T9D,151 Multipurpose Storage Hooks 2 Pack,"Juformin Heavy Duty Steel Garage Utility Hooks, 8 Pack, Black, Wall Mount, 50 Lb Capacity, Minimalist Style",https://www.poundwholesale.co.uk/151-multipurpose-storage-hooks-2-pack,https://www.amazon.co.uk/dp/B0D8397T9D,,Available (see Keepa data),,1.0,0.76,0.6333333333333334,22.99,2.99,3.05,0.55,3.8316666666666666,0.1266666666666667,12.358333333333333,3.705,8.103333333333332,684.788732394366,7.35,35.24720893141946
5060082935992,,B09DCYBNJG,A5 Hardback Book 2 Assorted Bright Colours,"Cryptic Killers Unsolved murder mystery game - Cold Case Files Investigation Detective clues/evidence - Solve the crime - For individuals, date nights & party groups - Murder of a millionaire",https://www.poundwholesale.co.uk/a4-hardback-book-2-assorted-bright-colours,https://www.amazon.co.uk/dp/B09DCYBNJG,,,,,0.54,0.45000000000000007,19.99,2.9984999999999995,2.8,0.55,3.3316666666666666,0.09000000000000001,10.319833333333332,3.2416666666666667,6.528166666666665,652.8166666666665,6.8885,32.65716191429047
5038673190006,5055512090501,B071Z6DWSL,Avante Floral White Bowl 15cm,Argon Tableware 12x Classic White 18cm Cereal Bowls - Porcelain Ice Cream Ramen Oatmeal Dishes - Microwave and Dishwasher Safe,https://www.poundwholesale.co.uk/avante-floral-white-bowl-15cm,https://www.amazon.co.uk/dp/B071Z6DWSL,100.0,,Available (see Keepa data),1.0,0.71,0.5916666666666667,21.99,3.2984999999999998,2.8,0.55,3.665,0.11833333333333333,11.516499999999997,3.546666666666667,7.41983333333333,649.9124087591239,7.358499999999999,33.74185235713202
5038673220031,5060533530318,B07JGV2YCR,6 Hook Hat & Coat Rack,"Toughook Original Rainbow Coat Rail – 6 Hook Rack - Wall-Mounted Colourful Pegs, Tough Heavy Duty Hook for Clothes, Bag, Hat & Towel, Durable. Child-Friendly Design for School, Home & Office",https://www.poundwholesale.co.uk/6-hook-hat-coat-rack,https://www.amazon.co.uk/dp/B07JGV2YCR,,Available (see Keepa data),,1.0,1.61,1.3416666666666668,34.95,4.54,4.58,0.55,5.825000000000001,0.2683333333333334,18.395000000000003,5.5566666666666675,12.288333333333334,649.6035242290749,11.280000000000001,35.159752026704815
5013922069289,,B0CP3CK73Q,Artbox Assorted Fun Stickers 400 Pack,ILY 3D Sticker Maker Refill Pack – Safari Party | DIY Arts & Crafts Kit for Kids Ages 6+ | Creative Toy Gift Set with 50+ Custom Refills for Boys & Girls,https://www.poundwholesale.co.uk/artbox-assorted-fun-stickers-400-pack,https://www.amazon.co.uk/dp/B0CP3CK73Q,50.0,,,,0.64,0.5333333333333333,20.99,3.1485,2.8,0.55,3.498333333333333,0.10666666666666667,10.903166666666666,3.3916666666666666,6.961499999999999,642.5999999999998,7.1385,33.165793234873746
5013922011899,,B0F66BCT21,Artbox Assorted Colour Pipe Cleaners 20 Pack,"Caydo 520 Pieces Pipe Cleaners 40 Assorted Colored Chenille Stems for Art and Crafts, Pipe Cleaner Crafts for DIY Art and Craft Projects Creative Gift Party Decorations",https://www.poundwholesale.co.uk/artbox-assorted-colour-pipe-cleaners-20-pack,https://www.amazon.co.uk/dp/B0F66BCT21,,Available (see Keepa data),,1.0,0.56,0.46666666666666673,19.99,3.0,3.06,0.55,3.3316666666666666,0.09333333333333335,10.03833333333333,3.2383333333333333,6.249999999999997,614.7540983606553,7.17,31.265632816408196
5060082934636,,B09W8YG6TQ,A4 Magnetic Whiteboard & Pen,"maxtek Whiteboard Pens Markers Bullet Tip, 36 Count Dry Erase Marker Pens Erasable, 3 Assorted Colors, 2-3mm, Office & Classroom Teaching Supplies",https://www.poundwholesale.co.uk/a4-whiteboard-pen,https://www.amazon.co.uk/dp/B09W8YG6TQ,200.0,,,,0.63,0.525,19.79,2.9684999999999997,2.8,0.55,3.298333333333334,0.10500000000000001,10.093166666666665,3.193333333333334,6.349833333333332,590.6821705426355,6.948499999999999,32.086070405928915
5060082932793,,B0BHTCTPSN,4pk Highlighters Assorted Colours,"Eziglide Highlighters Pens 48-Pack, 5 Assorted Colours - Neon Assorted Chisel Tip Marker for Bold & Fine Marking, 1-4.5mm Line for Clear Marking, Ideal for Schools, Universities, & Offices",https://www.poundwholesale.co.uk/4pk-highlighters-assorted-colours,https://www.amazon.co.uk/dp/B0BHTCTPSN,200.0,,,,0.55,0.45833333333333337,18.69,2.8035,2.8,0.55,3.1150000000000007,0.09166666666666669,9.4215,3.023333333333334,5.848166666666667,579.9834710743802,6.7035,31.29035134653112
5038673190174,0726384194578,B0BRPGK4PJ,Avante Plain White Salad Bowl 17cm,"HIUME Building Bricks Classic 1500 Pieces Kids Age 6+ Building Blocks Box Compatible with Top Brand and All Major Brands,12 Colors 14 Bulk Shapes for Boys and Girls",https://www.poundwholesale.co.uk/avante-plain-white-salad-bowl-17cm,https://www.amazon.co.uk/dp/B0BRPGK4PJ,100.0,Available (see Keepa data),,2.0,0.71,0.5916666666666667,21.19,3.18,3.26,0.55,3.531666666666667,0.11833333333333333,10.508333333333333,3.413333333333334,6.544999999999999,573.2846715328467,7.7,30.887210948560632
8696601040822,0718879806349,B09WY8XT3P,Alya Tropic Breeze Air Freshener Automatic Spray 250ml,"Automatic Air Freshener Dispenser CIPSS - Wall Mounted/Free Standing Auto Aerosol Spray Dispenser Programmable Fragrance Dispenser for Indoor-Bedroom, Hotel, Office, Commercial Place, White",https://www.poundwholesale.co.uk/alya-tropic-breeze-air-freshener-automatic-spray-250ml,https://www.amazon.co.uk/dp/B09WY8XT3P,,,,1.0,0.82,0.6833333333333333,21.84,3.28,3.04,0.55,3.6400000000000006,0.1366666666666667,11.059999999999999,3.503333333333334,7.006666666666665,568.1081081081079,7.6899999999999995,32.08180708180707
5015302422455,5055198010039,B0BTYZZXS5,Bello Assorted Colour PP Chip & Dip Bowl 15cm 2 Pack,"Chabrias Pack of 24 Plain Traditional Ramekins Condiment Pots, Sauce Ramekins, Dip Bowls, Tough Plastic Sauce Pots, Made in England (White 1.5oz)",https://www.poundwholesale.co.uk/bello-assorted-colour-pp-chip-dip-bowl-15cm-2-pack,https://www.amazon.co.uk/dp/B0BTYZZXS5,,,Available (see Keepa data),1.0,0.43,0.35833333333333334,16.99,2.5484999999999998,2.8,0.55,2.8316666666666666,0.07166666666666667,8.37983333333333,2.76,5.069833333333331,558.1467889908254,6.328499999999999,29.840102020796532
5050373024665,7797369355171,B0FGQHNSVF,151 Assorted Colour Jumbo Plastic Clothes Pegs 24 Pack,Shaver Head Replacement Trimmer，Compatible for Philips， Compatible for Bodygroom， BG 2024-2040 S11 YSS2 YSS3 Series(1pcs a),https://www.poundwholesale.co.uk/151-assorted-colour-jumbo-plastic-clothes-pegs-24-pack,https://www.amazon.co.uk/dp/B0FGQHNSVF,,,Available (see Keepa data),1.0,0.95,0.7916666666666666,20.66,3.1,1.89,0.55,3.443333333333334,0.15833333333333335,11.276666666666666,3.2850000000000006,7.4416666666666655,554.6583850931676,6.489999999999999,36.01968376895772
2019042604662,,B0D37ZCWJQ,1:24 Scale X-Power Rc Truck 27Mhz,"BEZGAR HP164 RC Cars - 1:16 Scale RC Truck, High Speed 40KPH RC Car Remote Control Monster Crawler Vehicle Off-Road Radio Controlled Car with Two Rechargeable Batteries for Boys and Adults",https://www.poundwholesale.co.uk/1-24-scale-x-power-rc-truck-27mhz,https://www.amazon.co.uk/dp/B0D37ZCWJQ,,Available (see Keepa data),,1.0,6.13,5.108333333333333,79.99,12.0,5.26,0.55,13.331666666666667,1.0216666666666667,43.268333333333324,12.31,30.40833333333332,537.4079528718702,23.94,38.015168562736996
5053249240442,,B0B18LP771,151 Heavy Duty Rubber Household Gloves Xl,"Vgo... 3Pairs Household Cleaning Gloves,Rubber Dishwashing gloves,Extra Thickness,20CM Long Sleeves,Kitchen Cleaning/Working/Painting/Gardening/Pet Care(RB2143, Red, L, 3Pairs)",https://www.poundwholesale.co.uk/151-heavy-duty-rubber-household-gloves-xl,https://www.amazon.co.uk/dp/B0B18LP771,,,,,0.77,0.6416666666666667,19.98,2.997,2.8,0.55,3.3300000000000005,0.12833333333333335,10.083,3.201666666666667,6.331333333333333,531.3006993006992,7.117,31.688355021688352
5060082933066,,B00SH7X1G8,8pk Permanent Markers Assorted Colours,Sharpie Metallic Permanent Markers | Fine Point | Silver | 12 Count,https://www.poundwholesale.co.uk/8pk-permanent-markers-assorted-colours,https://www.amazon.co.uk/dp/B00SH7X1G8,100.0,,,,0.63,0.525,18.44,2.766,2.8,0.55,3.073333333333334,0.10500000000000001,9.170666666666667,2.968333333333334,5.652333333333334,525.798449612403,6.7459999999999996,30.652566883586406
