EAN,EAN_OnPage,ASIN,SupplierTitle,AmazonTitle,SupplierURL,AmazonURL,bought_in_past_month,fba_seller_count,fbm_seller_count,total_offer_count,SupplierPrice_incVAT,SupplierPrice_exVAT,SellingPrice_incVAT,ReferralFee,FBAFee,PrepHouseFee,OutputVAT,InputVAT,NetProceeds,HMRC,NetProfit,ROI,Breakeven,ProfitMargin
5.0333E+12,5.05649E+12,B0F68KJD43,ESSENTIAL PLASTIC 6 ICE CREAM BOWL,"Motorola razr 60 ultra, Pantone Scarab, Moto AI Flip Smartphone, Dual Display, 50MP Triple Camera with Co2 Offset",https://www.efghousewares.co.uk/essential-plastic-6-ice-cream-bowl,https://www.amazon.co.uk/dp/B0F68KJD43,,,,3,1.572,1.31,713.52,76.93,2.87,0.55,118.92,16.332,513.49,-16.332,512.94,27577.41935,97.992,86.26639758
5.0333E+12,5.05649E+12,B0F68KJD43,ESSENTIAL PLASTIC SALAD BOWL CLEAR REUSABLE 176 OZ,"Motorola razr 60 ultra, Pantone Scarab, Moto AI Flip Smartphone, Dual Display, 50MP Triple Camera with Co2 Offset",https://www.efghousewares.co.uk/essential-plastic-salad-bowl-clear-reusable-176-oz-119160,https://www.amazon.co.uk/dp/B0F68KJD43,,,,3,1.644,1.37,713.52,76.93,2.87,0.55,118.92,16.344,513.43,-16.344,512.88,26712.5,98.064,86.25630676
5.0336E+12,,B0CZ97V8D9,NORTHPOLE SILVER METALLIC BOWS 16PK,Osee GoStream Duet Live Streaming Switcher Multiple Camera SDI and HDMI Live Stream Video Mixer Switcher with SD Record and NDI HX Supported,https://www.efghousewares.co.uk/northpole-silver-metallic-bows-16pk-122626,https://www.amazon.co.uk/dp/B0CZ97V8D9,,,,,0.804,0.67,315.7,39.4625,2.41,0.55,52.61666667,8.6185,220.5408333,-8.6185,219.9908333,18032.03552,51.711,83.62020906
5.05544E+12,,B07SXDPVZZ,DEKTON GLOVES LATEX COATED ORAGE LARGE(SOLD EACH),WOLVERINE 10-Sheet Super Micro Cut High Security Level P-5 Heavy Duty Paper/CD/Card Ultra Quiet Shredder for Home Office by 60 Mins Running Time and 22-Litre Pullout Waste Bin SD9112(Black),https://www.efghousewares.co.uk/dekton-gloves-latex-coated-orage-large,https://www.amazon.co.uk/dp/B07SXDPVZZ,,Available (see Keepa data),,1,0.912,0.76,199.92,37.49,8,0.55,33.32,9.36,120.35,-9.36,119.8,9145.038168,56.16,71.90876351
5.05544E+12,,B07SWB992S,DEKTON GLOVES WORKING PU X LARGE(SOLD EACH),WOLVERINE 10-Sheet Super Micro Cut High Security Level P-5 Heavy Duty Paper/CD/Card Ultra Quiet Shredder for Home Office by 60 Mins Running Time and 22-Litre Pullout Waste Bin SD9112(White),https://www.efghousewares.co.uk/dekton-gloves-working-pu-x-large,https://www.amazon.co.uk/dp/B07SWB992S,,Available (see Keepa data),,1,0.804,0.67,189.92,37.49,8.18,0.55,31.65333333,9.378,111.9266667,-9.378,111.3766667,9129.234973,56.268,70.37278854
5.05057E+12,,B0BWJQSD1F,PEARLESCENT BAUBLE MASON JAR,VLAND Tail Lights for Mini Cooper R56 R57 R58 R59 2007-2013 Rear Lights Lamp Assembly With Sequential Indicator and Welcome Lights (Red),https://www.efghousewares.co.uk/pearlescent-bauble-mason-jar-117338,https://www.amazon.co.uk/dp/B0BWJQSD1F,,,,2,1.272,1.06,208.99,21.38,5.3,0.55,34.83166667,5.658,146.4183333,-5.658,145.8683333,9060.144928,33.948,83.75616058
5.05933E+12,7.61988E+12,B096SQ3CX6,PLAIN CERAMIC MUG WHITE WITH BLACK RIM 275ML,Mammut Women Nova Iv Mid GTX Hiking Shoe,https://www.efghousewares.co.uk/plain-ceramic-mug-white-with-black-rim-275ml-110858,https://www.amazon.co.uk/dp/B096SQ3CX6,,,Available (see Keepa data),8,0.66,0.55,145.79,21.87,3.55,0.55,24.29833333,5.304,95.52166667,-5.304,94.97166667,8633.787879,31.824,78.17134234
5.05544E+12,,B07SXDPVZZ,DEKTON POWER BIT SET 5PC,WOLVERINE 10-Sheet Super Micro Cut High Security Level P-5 Heavy Duty Paper/CD/Card Ultra Quiet Shredder for Home Office by 60 Mins Running Time and 22-Litre Pullout Waste Bin SD9112(Black),https://www.efghousewares.co.uk/dekton-power-bit-set-5pc,https://www.amazon.co.uk/dp/B07SXDPVZZ,,Available (see Keepa data),,1,1.08,0.9,199.92,37.49,8,0.55,33.32,9.388,120.21,-9.388,119.66,8252.413793,56.328,71.82472989
5.0508E+12,,B0B5D4LCY8,BRIGHT & HOMELY STAINLESS STEEL SCOURER 6 PIECES,OLEVS Men Automatic Watch Skeleton 5 Hands Mechanical Classic Luxury Multi Calendar Stainless Steel Waterproof Wrist Watch for Men,https://www.efghousewares.co.uk/bright-homely-stainless-steel-scourer-6-pieces-121531,https://www.amazon.co.uk/dp/B0B5D4LCY8,,Available (see Keepa data),,1,0.66,0.55,138,20.7,3.09,0.55,23,4.978,90.66,-4.978,90.11,8191.818182,29.868,78.35652174
4.89416E+12,,B0DK3N1Q4V,FESTIVE MAGIC BIG BELLY MOUSE GREY 30CM,"VANTRUE E360 ACE 5.2K Dash Cam Panoramic, 3 Channel Dashcam Wide Angle 210Â°, Dash Camera 1944P+1944P+1080P Front Rear inside, STARVIS 2, Night Vision, 5G WiFi GPS, HDR, 24H Parking Mode, Support 512GB",https://www.efghousewares.co.uk/festive-magic-big-belly-mouse-grey-30cm-116280,https://www.amazon.co.uk/dp/B0DK3N1Q4V,,Available (see Keepa data),,1,2.016,1.68,245.64,17.19,3.68,0.55,40.94,4.62,182.15,-4.62,181.6,8143.497758,27.72,88.71519297
4.89416E+12,,B0DK3N1Q4V,FESTIVE MAGIC LIGHT UP LED CAND CANE 75CM,"VANTRUE E360 ACE 5.2K Dash Cam Panoramic, 3 Channel Dashcam Wide Angle 210Â°, Dash Camera 1944P+1944P+1080P Front Rear inside, STARVIS 2, Night Vision, 5G WiFi GPS, HDR, 24H Parking Mode, Support 512GB",https://www.efghousewares.co.uk/festive-magic-light-up-led-cand-cane-75cm-73628,https://www.amazon.co.uk/dp/B0DK3N1Q4V,,Available (see Keepa data),,1,2.016,1.68,245.64,17.19,3.68,0.55,40.94,4.62,182.15,-4.62,181.6,8143.497758,27.72,88.71519297
5.05571E+12,,B085HN95YZ,DLUX ALL PURPOSE CLEANING CLOTHS 40PCS,WOLVERINE 18-Sheet 60 Mins Running Time Cross Cut High Security Level P-4 Heavy Duty Paper/CD/Card Ultra Quiet Shredder for Home Office with 22-Litre Pullout Waste Bin SD9113(Black),https://www.efghousewares.co.uk/dlux-all-purpose-cleaning-cloths-40pcs-115767,https://www.amazon.co.uk/dp/B085HN95YZ,,Available (see Keepa data),,1,1.2,1,194.39,32.4,9.47,0.55,32.39833333,8.684,119.1216667,-8.684,118.5716667,7649.784946,52.104,73.19615207
5.0508E+12,,B09ZTKXBRJ,BRIGHT & HOMELY TOILET BRUSH WHITE,Remanufactured Toner Cartridge Replacement for Lexmark C2320K0 C2320C0 C2320M0 C2320Y0 C2325dw C2325 MC2325adw C2535dw MC2535adwe C2425dw MC2425adw MC2640adwe Printer (4 pack x 1000 pages),https://www.efghousewares.co.uk/bright-homely-toilet-brush-white-105424,https://www.amazon.co.uk/dp/B09ZTKXBRJ,,Available (see Keepa data),,1,0.6,0.5,119.99,16.59,3.12,0.55,19.99833333,4.152,79.78166667,-4.152,79.23166667,7545.873016,24.912,79.23826986
5.05544E+12,,B07SXDPVZZ,DEKTON HOOK 16MM 1PC,WOLVERINE 10-Sheet Super Micro Cut High Security Level P-5 Heavy Duty Paper/CD/Card Ultra Quiet Shredder for Home Office by 60 Mins Running Time and 22-Litre Pullout Waste Bin SD9112(Black),https://www.efghousewares.co.uk/dekton-hook-16mm-1pc,https://www.amazon.co.uk/dp/B07SXDPVZZ,,Available (see Keepa data),,1,1.272,1.06,199.92,37.49,8,0.55,33.32,9.42,120.05,-9.42,119.5,7422.360248,56.52,71.72869148
5.0336E+12,,B0FCXVT75G,NORTHPOLE GIFT TAG BOOKLET PK20 HOLOGRAPHIC GOLD,"DOOGEE Blade 10 Energy Rugged Smartphone - 10.7mm Ultra-Thin Rugged Phone, 6150mAh Battery Android 15 Phone with 24GB RAM+128GB ROM, 6.56 inch 90Hz Screen 16MP+8MP Cameras/NFC/Dual SIM/Face ID - Plain",https://www.efghousewares.co.uk/northpole-gift-tag-booklet-pk20-holographic-gold-122640,https://www.amazon.co.uk/dp/B0FCXVT75G,,,,,0.672,0.56,113.98,14.2475,2.41,0.55,18.99666667,3.5535,77.76583333,-3.5535,77.21583333,6956.381381,21.321,81.29408668
5.05544E+12,,B07SWB992S,DEKTON HOOKS SET 5PC,WOLVERINE 10-Sheet Super Micro Cut High Security Level P-5 Heavy Duty Paper/CD/Card Ultra Quiet Shredder for Home Office by 60 Mins Running Time and 22-Litre Pullout Waste Bin SD9112(White),https://www.efghousewares.co.uk/dekton-hooks-set-5pc-35872,https://www.amazon.co.uk/dp/B07SWB992S,,Available (see Keepa data),,1,1.272,1.06,189.92,37.49,8.18,0.55,31.65333333,9.456,111.5366667,-9.456,110.9866667,6893.581781,56.736,70.126369
5.0153E+12,7.1771E+11,B0FGHZB8FM,LUXURY CUPCAKE 100 CASES,"Oversize Turbo Dryer Blower,Car Accessories,Max Instantaneous Thrust 1.60KG,4 Speeds,64MM Super Big Electric Cordless Air Blower for Leaf,Patio Cleaning,Lawn Care & Car Drying (Shining Black)",https://www.efghousewares.co.uk/luxury-cupcake-100-cases,https://www.amazon.co.uk/dp/B0FGHZB8FM,50,Available (see Keepa data),,1,0.852,0.71,129,19.35,3.44,0.55,21.5,4.81,84,-4.81,83.45,6623.015873,28.86,77.62790698
5.0336E+12,,B0FCXVT75G,NORTHPOLE CHRISTMAS CUTE STICKERS PK50,"DOOGEE Blade 10 Energy Rugged Smartphone - 10.7mm Ultra-Thin Rugged Phone, 6150mAh Battery Android 15 Phone with 24GB RAM+128GB ROM, 6.56 inch 90Hz Screen 16MP+8MP Cameras/NFC/Dual SIM/Face ID - Plain",https://www.efghousewares.co.uk/northpole-christmas-cute-stickers-pk50-122622,https://www.amazon.co.uk/dp/B0FCXVT75G,,,,,0.744,0.62,113.98,14.2475,2.41,0.55,18.99666667,3.5655,77.70583333,-3.5655,77.15583333,6594.51567,21.393,81.2309177
5.0336E+12,,B0FCXVT75G,NORTHPOLE EMBOSSED RIBBON 10M,"DOOGEE Blade 10 Energy Rugged Smartphone - 10.7mm Ultra-Thin Rugged Phone, 6150mAh Battery Android 15 Phone with 24GB RAM+128GB ROM, 6.56 inch 90Hz Screen 16MP+8MP Cameras/NFC/Dual SIM/Face ID - Plain",https://www.efghousewares.co.uk/northpole-embossed-ribbon-10m-122618,https://www.amazon.co.uk/dp/B0FCXVT75G,,,,,0.876,0.73,113.98,14.2475,2.41,0.55,18.99666667,3.5875,77.59583333,-3.5875,77.04583333,6019.205729,21.525,81.11510791
5.02618E+12,9.31345E+12,B0F66LVY3M,APOLLO RAMEKIN 6.5CM,Leaf Blower Cordless Turbo Mode 500000RPM 21V Air Blower 5 Gears with 2 X 4.0Ah Battery and Charger Lightweight 180Â°Rotation for Lawn Yard Garage Patio Blowing Leaves and Dust,https://www.efghousewares.co.uk/apollo-ramekin-6-5cm-10-10,https://www.amazon.co.uk/dp/B0F66LVY3M,,Available (see Keepa data),,3,0.6,0.5,99.99,15,5.42,0.55,16.665,4.294,62.405,-4.294,61.855,5890.952381,25.764,74.23342334
5.0508E+12,7.97726E+11,B0DYJKPDK5,BRIGHT & HOMELY HEAVY DUTY CONCERTINA DRAIN PLUNGER MEDIUM,"Betopper 4x100W LED Satge Lights, Upgraded Amber+Cool White COB Blinder Light, High CRI/RA(>95) DMX512 Spotlight, 4 Eye Matrix Disco Lights for Wedding Party Photostudio Theater, 1S",https://www.efghousewares.co.uk/bright-homely-heavy-duty-plunger-midi-122839,https://www.amazon.co.uk/dp/B0DYJKPDK5,,Available (see Keepa data),,2,2.148,1.79,199.99,24,5.84,0.55,33.33166667,6.436,135.0283333,-6.436,134.4783333,5746.937322,38.616,80.69103455
5.05544E+12,,B07SWB992S,DEKTON CABLE TIES BLACK 100PCS 4.8MMX250MM,WOLVERINE 10-Sheet Super Micro Cut High Security Level P-5 Heavy Duty Paper/CD/Card Ultra Quiet Shredder for Home Office by 60 Mins Running Time and 22-Litre Pullout Waste Bin SD9112(White),https://www.efghousewares.co.uk/dekton-cable-ties-white-100pcs-4-8mmx250mm-115689,https://www.amazon.co.uk/dp/B07SWB992S,,Available (see Keepa data),,1,1.68,1.4,189.92,37.49,8.18,0.55,31.65333333,9.524,111.1966667,-9.524,110.6466667,5674.188034,57.144,69.9115417
5.05571E+12,,B085HN95YZ,PROKLEEN MICROFIBRE MOP & HANDLE,WOLVERINE 18-Sheet 60 Mins Running Time Cross Cut High Security Level P-4 Heavy Duty Paper/CD/Card Ultra Quiet Shredder for Home Office with 22-Litre Pullout Waste Bin SD9113(Black),https://www.efghousewares.co.uk/prokleen-microfibre-mop-handle,https://www.amazon.co.uk/dp/B085HN95YZ,,Available (see Keepa data),,1,1.884,1.57,194.39,32.4,9.47,0.55,32.39833333,8.798,118.5516667,-8.798,118.0016667,5566.116352,52.788,72.84428211
5.01871E+12,,B0B5D4LCY8,OVEN LOVE BAKING DISH OVAL WHITE 0.19L,OLEVS Men Automatic Watch Skeleton 5 Hands Mechanical Classic Luxury Multi Calendar Stainless Steel Waterproof Wrist Watch for Men,https://www.efghousewares.co.uk/oven-love-baking-dish-oval-white-0-19l-118224,https://www.amazon.co.uk/dp/B0B5D4LCY8,,Available (see Keepa data),,1,1.344,1.12,138,20.7,3.09,0.55,23,5.092,90.09,-5.092,89.54,5361.676647,30.552,77.86086957
8.71125E+11,7.97726E+11,B0DYJKPDK5,DUNLOP LED LIGHT SE SC 2PC,"Betopper 4x100W LED Satge Lights, Upgraded Amber+Cool White COB Blinder Light, High CRI/RA(>95) DMX512 Spotlight, 4 Eye Matrix Disco Lights for Wedding Party Photostudio Theater, 1S",https://www.efghousewares.co.uk/dunlop-led-light-se-sc-2pc-116130,https://www.amazon.co.uk/dp/B0DYJKPDK5,,Available (see Keepa data),,2,2.376,1.98,199.99,24,5.84,0.55,33.33166667,6.474,134.8383333,-6.474,134.2883333,5307.839262,38.844,80.57702885
5.05544E+12,,B07SWB992S,DEKTON MINI WIRE BRUSH 3PC SET,WOLVERINE 10-Sheet Super Micro Cut High Security Level P-5 Heavy Duty Paper/CD/Card Ultra Quiet Shredder for Home Office by 60 Mins Running Time and 22-Litre Pullout Waste Bin SD9112(White),https://www.efghousewares.co.uk/dekton-mini-wire-brush-3pc-set-118204,https://www.amazon.co.uk/dp/B07SWB992S,,Available (see Keepa data),,1,1.992,1.66,189.92,37.49,8.18,0.55,31.65333333,9.576,110.9366667,-9.576,110.3866667,4994.871795,57.456,69.74726201
5.01035E+12,,B0B5D4LCY8,MINKY BRITE & BOLD MICROFIBRE CLOTHS 2PC,OLEVS Men Automatic Watch Skeleton 5 Hands Mechanical Classic Luxury Multi Calendar Stainless Steel Waterproof Wrist Watch for Men,https://www.efghousewares.co.uk/minky-brite-bold-microfibre-cloths-2pc-114014,https://www.amazon.co.uk/dp/B0B5D4LCY8,,Available (see Keepa data),,1,1.572,1.31,138,20.7,3.09,0.55,23,5.13,89.9,-5.13,89.35,4803.763441,30.78,77.69565217
5.05544E+12,,B07SWB992S,DEKTON 12 IN 1 SCREWDRIVERS,WOLVERINE 10-Sheet Super Micro Cut High Security Level P-5 Heavy Duty Paper/CD/Card Ultra Quiet Shredder for Home Office by 60 Mins Running Time and 22-Litre Pullout Waste Bin SD9112(White),https://www.efghousewares.co.uk/dekton-12-in-1-screwdrivers,https://www.amazon.co.uk/dp/B07SWB992S,,Available (see Keepa data),,1,2.22,1.85,189.92,37.49,8.18,0.55,31.65333333,9.614,110.7466667,-9.614,110.1966667,4591.527778,57.684,69.62721146
5.01035E+12,5.06502E+12,B0D3M53JGG,MINKY CURVE SCOURER 2PC,"Powerful 2200W Premium Garment Steamer with 3L Water Tank, Dual Steam Settings for Rapid Wrinkle Release, Suitable for All Fabrics Including Delicates, Updated Design, Fridja f1200 Clothes Steamer Pro",https://www.efghousewares.co.uk/minky-curve-scourer-2pc-114010,https://www.amazon.co.uk/dp/B0D3M53JGG,100,,,8,1.524,1.27,132.99,19.95,6.92,0.55,22.165,5.738,82.685,-5.738,82.135,4512.912088,34.428,74.11233927
5.01213E+12,,B00BAVI0I2,GIFTMAKER CHRISTMAS WOVEN SHOPPING BAGS TEXT,"Artago 68T/B Maximum Security Padlock, 14mm/0,55in Shackle, Sold Secure Gold Approved, Forged MONOBLOK System, Bunker Selection, Multipurpose Keyed Padlock Combinable with Chains, Door, Container",https://www.efghousewares.co.uk/giftmaker-christmas-woven-shopping-bags-text-122882,https://www.amazon.co.uk/dp/B00BAVI0I2,,,,,0.924,0.77,85.85,10.73125,2.41,0.55,14.30833333,2.89225,57.63041667,-2.89225,57.08041667,4324.27399,17.3535,79.7862551
5.0563E+12,,B085HN95YZ,CASA & CASA OCEANIC TELESCOPIC BENDY DUSTER STAINLESS STEEL,WOLVERINE 18-Sheet 60 Mins Running Time Cross Cut High Security Level P-4 Heavy Duty Paper/CD/Card Ultra Quiet Shredder for Home Office with 22-Litre Pullout Waste Bin SD9113(Black),https://www.efghousewares.co.uk/casa-casa-oceanic-telescopic-bendy-duster-stainless-steel-121249,https://www.amazon.co.uk/dp/B085HN95YZ,,Available (see Keepa data),,1,2.76,2.3,194.39,32.4,9.47,0.55,32.39833333,8.944,117.8216667,-8.944,117.2716667,4114.795322,53.664,72.39364165
3.83895E+12,7.05736E+11,B0DFCG7G7Q,PALOMA 100 YELLOW SERVIETTES,"Mould King City Aircraft Engine Building Kit, Turbojet Engine Model That Runs, Mini Engine Build Kit for Adults with Battery, Mechanical Science Education STEM Toy(2256 PCS)",https://www.efghousewares.co.uk/paloma-100-yellow-serviettes-113917,https://www.amazon.co.uk/dp/B0DFCG7G7Q,,Available (see Keepa data),,1,1.104,0.92,95.99,14.4,4.97,0.55,15.99833333,4.168,59.70166667,-4.168,59.15166667,4023.922902,25.008,73.94728618
5.0336E+12,,B0FCXVT75G,NORTHPOLE CHRISTMAS STICKER BY NUMBERS BOOK,"DOOGEE Blade 10 Energy Rugged Smartphone - 10.7mm Ultra-Thin Rugged Phone, 6150mAh Battery Android 15 Phone with 24GB RAM+128GB ROM, 6.56 inch 90Hz Screen 16MP+8MP Cameras/NFC/Dual SIM/Face ID - Plain",https://www.efghousewares.co.uk/northpole-christmas-sticker-by-numbers-book-122645,https://www.amazon.co.uk/dp/B0FCXVT75G,,,,,1.68,1.4,113.98,14.2475,2.41,0.55,18.99666667,3.7215,76.92583333,-3.7215,76.37583333,3916.709402,22.329,80.409721
6.92346E+12,6.98813E+11,B0F118YSX2,ADORN MUG 8.8X9.4CM ASSORTED,"RÃ˜DE NTH-50 Professional On-ear Wired DJ Headphones | Durable, Comfortable, Hi-Fi Audio | Musicians, Filmmakers, Creators (Black)",https://www.efghousewares.co.uk/adorn-mug-8-8x9-4cm-assorted-118131,https://www.amazon.co.uk/dp/B0F118YSX2,,,Available (see Keepa data),12,1.008,0.84,83,12.45,3.13,0.55,13.83333333,3.394,52.74666667,-3.394,52.19666667,3755.155875,20.364,75.46506024
4.89416E+12,,B0DNSWBYMZ,FESTIVE MAGIC BELLS 8PC ASSORTED,"Hazel Quinn x Eduardo Recife 2-Slice Toaster, 6 Browning Levels, Defrost/Reheat/Cancel Functions, Removable Crumb Tray for Easy Cleaning, 1.5-Inch Extra-Wide Slots, Retro Style Collaboration",https://www.efghousewares.co.uk/festive-magic-bells-8pc-assorted-93115,https://www.amazon.co.uk/dp/B0DNSWBYMZ,50,Available (see Keepa data),,1,0.672,0.56,69.99,10.5,5.15,0.55,11.665,3.352,42.115,-3.352,41.565,3744.594595,20.112,71.26446635
5.02618E+12,9.31345E+12,B0F66LVY3M,APOLLO CERAMIC JUG WHITE 0.08 LTR,Leaf Blower Cordless Turbo Mode 500000RPM 21V Air Blower 5 Gears with 2 X 4.0Ah Battery and Charger Lightweight 180Â°Rotation for Lawn Yard Garage Patio Blowing Leaves and Dust,https://www.efghousewares.co.uk/apollo-ceramic-jug-white-0-08-ltr-10-10,https://www.amazon.co.uk/dp/B0F66LVY3M,,Available (see Keepa data),,3,1.308,1.09,99.99,15,5.42,0.55,16.665,4.412,61.815,-4.412,61.265,3735.670732,26.472,73.52535254
5.06021E+12,7.05737E+11,B0DN6BWS36,BROOKSTONE ASSORTED FUSES,"Mould King V8 Engine Building Blocks Set, 2250 PCS Combustion Engine Model Kit That Runs, Mini Engine for Adults with Battery, Engineering Construction STEM Toy for Boys Girls",https://www.efghousewares.co.uk/brookstone-assorted-fuses-117389,https://www.amazon.co.uk/dp/B0DN6BWS36,,Available (see Keepa data),,1,1.332,1.11,99.99,15,4.97,0.55,16.665,4.326,62.245,-4.326,61.695,3716.566265,25.956,74.04140414
6.92346E+12,,B0CG8L4ZR2,ADORN DEEP BOWL 8INCH,"Portable Infrared Patio Heater 1500W Electric Heater with 8 Heating Levels, Tip-over Protection, IP45 Waterproof, 8H Timer, Remote Control, 33 Inch, Elegent Brown",https://www.efghousewares.co.uk/adorn-deep-bowl-8inch-116013,https://www.amazon.co.uk/dp/B0CG8L4ZR2,,Available (see Keepa data),,1,1.608,1.34,118.99,21.3,6.38,0.55,19.83166667,5.914,70.13833333,-5.914,69.58833333,3681.922399,35.484,70.17900664
26102895139,,B0FNN1JYYV,CARINE DINNER PLATE WHITE 26CM,"Western Bank Heist Building Kit â€“ 2875pcs West Town Flagship Model with 11 LED Lights, 6 Minifigures, Highly Detailed Western Architecture, Collectible Gift for Adults & Kids",https://www.efghousewares.co.uk/carine-dinner-plate-white-26cm-1-09,https://www.amazon.co.uk/dp/B0FNN1JYYV,,Available (see Keepa data),,1,1.572,1.31,115.99,21.75,5.34,0.55,19.33166667,5.79,68.25833333,-5.79,67.70833333,3640.232975,34.74,70.04914217
5.05571E+12,7.1771E+11,B0FGHZB8FM,PROKLEEN SPUNLACE FLOOR MOP & HANDLE,"Oversize Turbo Dryer Blower,Car Accessories,Max Instantaneous Thrust 1.60KG,4 Speeds,64MM Super Big Electric Cordless Air Blower for Leaf,Patio Cleaning,Lawn Care & Car Drying (Shining Black)",https://www.efghousewares.co.uk/prokleen-spunlace-floor-mop-handle,https://www.amazon.co.uk/dp/B0FGHZB8FM,50,Available (see Keepa data),,1,2.088,1.74,129,19.35,3.44,0.55,21.5,5.016,82.97,-5.016,82.42,3599.126638,30.096,76.66976744
5.05544E+12,,B07SWB992S,DEKTON SCREW NUTS & WASHER KIT 374PCS,WOLVERINE 10-Sheet Super Micro Cut High Security Level P-5 Heavy Duty Paper/CD/Card Ultra Quiet Shredder for Home Office by 60 Mins Running Time and 22-Litre Pullout Waste Bin SD9112(White),https://www.efghousewares.co.uk/dekton-screw-nuts-washer-kit-374pcs-118175,https://www.amazon.co.uk/dp/B07SWB992S,,Available (see Keepa data),,1,3.024,2.52,189.92,37.49,8.18,0.55,31.65333333,9.748,110.0766667,-9.748,109.5266667,3567.643865,58.488,69.20387532
5.01035E+12,,B0B5D4LCY8,MINKY M CLOTH ANTIBACTERIAL PAD BATHROOM,OLEVS Men Automatic Watch Skeleton 5 Hands Mechanical Classic Luxury Multi Calendar Stainless Steel Waterproof Wrist Watch for Men,https://www.efghousewares.co.uk/minky-m-cloth-antibacterial-pad-bathroom,https://www.amazon.co.uk/dp/B0B5D4LCY8,,Available (see Keepa data),,1,2.352,1.96,138,20.7,3.09,0.55,23,5.26,89.25,-5.26,88.7,3533.864542,31.56,77.13043478
5.05544E+12,,B07SWB992S,"DEKTON SHANK WOOD DRILL 8PC 1/4"" 30-10MM",WOLVERINE 10-Sheet Super Micro Cut High Security Level P-5 Heavy Duty Paper/CD/Card Ultra Quiet Shredder for Home Office by 60 Mins Running Time and 22-Litre Pullout Waste Bin SD9112(White),https://www.efghousewares.co.uk/dekton-shank-masanory-drill-8pc-1/4-3-10m-115754,https://www.amazon.co.uk/dp/B07SWB992S,,Available (see Keepa data),,1,3.096,2.58,189.92,37.49,8.18,0.55,31.65333333,9.76,110.0166667,-9.76,109.4666667,3497.337593,58.56,69.16596462
5.0253E+12,,B0F6B9NTF2,POLAROID SUPER HEAVY DUTY BATTERIES AA 8 PACK,"AI Voice Recorder with transcription, Note Voice Recorder App Control Dictaphone, Transcribe and Summarize with AI Technology, voice to text transcription Magnetic Phone call Recording Device",https://www.efghousewares.co.uk/polaroid-super-heavy-duty-batteries-aa-8-pack-118930,https://www.amazon.co.uk/dp/B0F6B9NTF2,,Available (see Keepa data),,1,0.804,0.67,59.99,4.2,2.2,0.55,9.998333333,1.524,42.92166667,-1.524,42.37166667,3473.087432,9.144,84.75745958
5.0553E+12,7.1771E+11,B0FGHZB8FM,PLUNGER BUFFALO MINI PLUNGER,"Oversize Turbo Dryer Blower,Car Accessories,Max Instantaneous Thrust 1.60KG,4 Speeds,64MM Super Big Electric Cordless Air Blower for Leaf,Patio Cleaning,Lawn Care & Car Drying (Shining Black)",https://www.efghousewares.co.uk/plunger-buffalo-mini-plunger,https://www.amazon.co.uk/dp/B0FGHZB8FM,50,Available (see Keepa data),,1,2.196,1.83,129,19.35,3.44,0.55,21.5,5.034,82.88,-5.034,82.33,3459.243697,30.204,76.58604651
5.05544E+12,,B07SWB992S,"DEKTON FILLING KNIFE 100MM,1.27MM",WOLVERINE 10-Sheet Super Micro Cut High Security Level P-5 Heavy Duty Paper/CD/Card Ultra Quiet Shredder for Home Office by 60 Mins Running Time and 22-Litre Pullout Waste Bin SD9112(White),https://www.efghousewares.co.uk/dekton-filling-knife-100mm-1-27mm-122107,https://www.amazon.co.uk/dp/B07SWB992S,,Available (see Keepa data),,1,3.36,2.8,189.92,37.49,8.18,0.55,31.65333333,9.804,109.7966667,-9.804,109.2466667,3261.094527,58.824,69.02695872
5.01221E+12,,B08KYJWQPV,TOM SMITH CHRISTMAS CARDS LUXURY SLIM FOLIAGE TEXT,Nilfisk Core 130 Bar High Pressure Washer with Power Control - Mini Power Washer for Patios and Car Cleaner (1500 W),https://www.efghousewares.co.uk/tom-smith-christmas-cards-luxury-slim-foliage-text-122728,https://www.amazon.co.uk/dp/B08KYJWQPV,50,,,,2.016,1.68,104.67,13.08375,2.41,0.55,17.445,3.54475,70.05125,-3.54475,69.50125,3116.647982,21.2685,79.68042419
5.03867E+12,5.03806E+12,B0BGJ6BKW8,PRIMA DISH BRUSH,"Remington RX7 Electric Head Shaver for Bald Men (Cordless, 60-Min Usage, USB, 5 Cutting Heads Skin Close Results (0.2mm), Turbo, Wet & Dry, Easy Clean, Waterproof, Pop-up Trimmer, Travel Pouch) XR1600",https://www.efghousewares.co.uk/prima-dish-brush-112223,https://www.amazon.co.uk/dp/B0BGJ6BKW8,,,,3,0.672,0.56,55,8.25,3.23,0.55,9.166666667,2.518,33.79333333,-2.518,33.24333333,2994.894895,15.108,72.53090909
8.69252E+12,7.59041E+11,B0DPZLWX8J,THL COTTON MOP & HANDLE 250GRM,"TYMO CurlPro Plus Hair Curler Automatic Rotating - Long Barrel Curling Wand for Long Hair, Ceramic Curling Iron for Women, Anti-Scald, Tangle-Free, 600M Ionic, Dual Voltage, Gold, 25 mm",https://www.efghousewares.co.uk/thl-cotton-mop-handle-250g,https://www.amazon.co.uk/dp/B0DPZLWX8J,,Available (see Keepa data),,1,1.872,1.56,99.99,15,3.13,0.55,16.665,4.048,63.635,-4.048,63.085,2989.810427,24.288,75.70957096
5.05544E+12,4.03029E+12,B002J5JXW0,DEKTON FLEX SAND BLOCK 80GRIT,"Flex - Sandpaper Xtreme Plus 225mm, 25 Sheet Pack, P120 Grit - 282405 - Sandpaper for Wood and Drywall, Sand Paper Pack for Walls in Different Sizes - Home Improvement and Decorating Tools",https://www.efghousewares.co.uk/dekton-flex-sand-block-80grit,https://www.amazon.co.uk/dp/B002J5JXW0,,Available (see Keepa data),Available (see Keepa data),9,0.876,0.73,59.99,7.8,3.14,0.55,9.998333333,2.444,38.32166667,-2.444,37.77166667,2950.911458,14.664,75.55592599
5.06021E+12,7.05737E+11,B0DN6BWS36,BROOKSTONE WINDSCREEN COVERS,"Mould King V8 Engine Building Blocks Set, 2250 PCS Combustion Engine Model Kit That Runs, Mini Engine for Adults with Battery, Engineering Construction STEM Toy for Boys Girls",https://www.efghousewares.co.uk/brookstone-windscreen-covers,https://www.amazon.co.uk/dp/B0DN6BWS36,,Available (see Keepa data),,1,1.884,1.57,99.99,15,4.97,0.55,16.665,4.418,61.785,-4.418,61.235,2888.443396,26.508,73.48934893
5.01056E+12,5.0606E+12,B0G2HR9JXH,DRAPER MASONRY DRILL SDS 5X160MM,"Belaco Electric Heater Oil Filled Radiator 11 Fins Portable Electric Heater, Room Heater with Adjustable thermostat, 3 Heat settings, 2500W Energy saving Heater for Home (Black)",https://www.efghousewares.co.uk/draper-masonry-drill-sds-5x160mm,https://www.amazon.co.uk/dp/B0G2HR9JXH,,Available (see Keepa data),Available (see Keepa data),2,1.476,1.23,85.99,12.9,6.83,0.55,14.33166667,4.302,50.69833333,-4.302,50.14833333,2817.322097,25.812,69.98255611
5.05057E+12,,B0DL47ZJR2,PAPER EASTER 10 PLATES 7 INCH,"Mould King V8 Engine Building Blocks Sets, 10171 MOC Scale Model Kit with Battery and Motor, Collectible Set for Adults, Construction Toys for Teens(487 Pcs)",https://www.efghousewares.co.uk/paper-easter-10-plates-7-inch,https://www.amazon.co.uk/dp/B0DL47ZJR2,100,,,,0.744,0.62,50.99,6.37375,2.41,0.55,8.498333333,1.99075,33.08791667,-1.99075,32.53791667,2781.018519,11.9445,76.57481859
