EAN,EAN_OnPage,ASIN,SupplierTitle,AmazonTitle,SupplierURL,AmazonURL,bought_in_past_month,fba_seller_count,fbm_seller_count,total_offer_count,SupplierPrice_incVAT,SupplierPrice_exVAT,SellingPrice_incVAT,ReferralFee,FBAFee,PrepHouseFee,OutputVAT,InputVAT,NetProceeds,HMRC,NetProfit,ROI,Breakeven,ProfitMargin
5.03603E+12,,B0C2D2TLGM,SILVERHOOK BIG BOY FILLER HYBRID EPOXY 250ML,"Car Boot Organiser with Cooler Bag, Extra Large Premium Expandable Compartments, Foldable Car Organiser, Trunk Organiser for Most Vehicles & Indoor",https://www.efghousewares.co.uk/silverhook-big-boy-filler-hybrid-epoxy-250ml,https://www.amazon.co.uk/dp/B0C2D2TLGM,100,Available (see Keepa data),,1,6.3,5.25,45.99,6.84,5.63,0.55,7.665,3.654,20.605,-3.654,20.055,345.7758621,21.924,52.32876712
,5.05596E+12,B09F6XKJHG,PREMIER ACRYLIC PENGUIN COLOUR CHANGE 10CM,Marco Paul 30cm Acrylic LED Penguin Christmas Decoration Light - Battery Operated Figure with Auto Timer Indoor & Outdoor Xmas Ornament - Home & Garden Festive Lighting Decor,https://www.efghousewares.co.uk/premier-acrylic-penguin-colour-change-10cm-123191,https://www.amazon.co.uk/dp/B09F6XKJHG,100,Available (see Keepa data),Available (see Keepa data),4,3.096,2.58,24.99,3.3,3.58,0.55,4.165,2.002,11.365,-2.002,10.815,345.5271565,12.012,51.93277311
5.0253E+12,5.05678E+12,B0DT4XQMMS,THE CHRISTMAS WORKSHOP SHATTERPROOF BAUBLES MULTI COLOUR PACK OF 12,"Tower T17190GRP Vortx XL Dual Stack Air Fryer with Digital Control Panel, Space Saving Design, 6 Preset Cooking Modes, Match Cook & Smart Finish Functions, 2460W, 11L, Graphite with Chrome Trim",https://www.efghousewares.co.uk/the-christmas-workshop-shatterproof-baubles-multi-colour-pack-of-12-123389,https://www.amazon.co.uk/dp/B0DT4XQMMS,,,,29,13.104,10.92,87.29,13.5,8.27,0.55,14.54833333,6.648,40.05166667,-6.648,39.50166667,344.3911654,39.888,54.30404399
5.0603E+12,,B0DFPL2MZL,MASON HACKSAW WITH 2 SPARE BLADES,"AIRAJ Hacksaw - Heavy Duty Hacksaw for Metal Cutting - Two Sawing Angles 45Â°/90Â° - with 10 Spare Blades - Metal Hack Saw for Wood, Plastics, Rubber and Other Common Materials",https://www.efghousewares.co.uk/mason-hacksaw-with-2-spare-blades-123866,https://www.amazon.co.uk/dp/B0DFPL2MZL,200,Available (see Keepa data),,2,1.008,0.84,13.25,1.72,3.15,0.55,2.208333333,1.252,5.331666667,-1.252,4.781666667,344.0047962,7.512,43.30566038
,7.00116E+11,B079K9HRRR,PREMIER WATERGLOBE CHIMMNEY 45MM,Chimney Balloon 14 x 38 Inch Large Chimney Draught Excluder,https://www.efghousewares.co.uk/premier-waterglobe-chimmney-45mm-123163,https://www.amazon.co.uk/dp/B079K9HRRR,200,Available (see Keepa data),,1,2.016,1.68,19,2.85,3.09,0.55,3.166666667,1.634,8.213333333,-1.634,7.663333333,343.6472347,9.804,48.4
9.33353E+12,,B0DM557C6M,FESTIVE MAGIC CANDY CANE STAKE,65W 45W Round Tip 4.0 * 1.7mm Laptop Charger Fit for Lenovo Ideapad 100 110 110S 120 120S 130 130S 310 310S 320 320S 340 Flex 4 1130 1480 1580 1470 1570 ADLX65CCGB2A 20V 3.25A Adapter Wall Plug,https://www.efghousewares.co.uk/festive-magic-candy-cane-stake-83280,https://www.amazon.co.uk/dp/B0DM557C6M,,Available (see Keepa data),,1,0.936,0.78,12.99,1.95,3,0.55,2.165,1.256,5.095,-1.256,4.545,341.7293233,7.536,41.98614319
5.02959E+12,8.10151E+11,B0FF4HSW77,ROLSON QUICK RELEASE SOCKET ADAPTOR WITH IMPACT BITS,"EZARC Impact Socket Adapter Set, 1/4"",3/8"",1/2"" Square Drive Socket Adapter,Quick-Release & Magnetic Drill Bit Extension,Swivel & Right Angle Drill Attachments for Power Drill & Impact Driver,14PCS",https://www.efghousewares.co.uk/rolson-quick-release-socket-adaptor-with-impact-bits-123591,https://www.amazon.co.uk/dp/B0FF4HSW77,50,Available (see Keepa data),,1,4.704,3.92,31.97,4.16,2.77,0.55,5.328333333,2.28,15.79166667,-2.28,15.24166667,340.9768829,13.68,57.20988427
8.83314E+11,7.33969E+11,B0DTBVMRSS,CADIX 24CM PASTA PLATE,"Music Theory Key Concepts Wheel, Guitar, Piano, Accelerated Learning Tool, Understand Chords, Scales, Keys - FAST! No Music Reading Needed. New for 2025.",https://www.efghousewares.co.uk/cadix-24cm-pasta-plate,https://www.amazon.co.uk/dp/B0DTBVMRSS,50,Available (see Keepa data),,1,1.164,0.97,11.99,1.44,1.87,0.55,1.998333333,0.966,5.711666667,-0.966,5.161666667,339.5833333,5.796,51.65971643
4.00739E+12,59318963231,B08235DXWH,D-C-FIX SELF ADHESIVE BUTCHERBLOCK 2 MTR X 45CM,"d-c-fix 346-0099-2PKA Decorative Self-Adhesive Film, 17"" x 78"" Roll-2-Pk with Applicator, Beige Marble",https://www.efghousewares.co.uk/d-c-fix-s-adh-butcherblock-2-mtr-x-45cm,https://www.amazon.co.uk/dp/B08235DXWH,,,Available (see Keepa data),1,3.288,2.74,28.44,5.59,3.65,0.55,4.74,2.506,11.72,-2.506,11.17,339.5136778,15.036,47.13080169
5.01593E+12,6.97507E+12,B0CGQZPL76,BLOCK TECH CARS ASSORTED,"22Pcs Toy Cars with 8 Roadblock, Metal Shell Race Car Set for Kids, Mini Pull Back Playset, Micro Machines Vehicles Toys, Christmas Birthday Party Gifts for 3 4 5 6 7 8 Year Old Boys & Girls",https://www.efghousewares.co.uk/block-tech-cars-assorted-124122,https://www.amazon.co.uk/dp/B0CGQZPL76,300,Available (see Keepa data),,2,0.924,0.77,11.99,1.5,2.7,0.55,1.998333333,1.104,5.021666667,-1.104,4.471666667,338.7626263,6.624,44.75396163
8.71125E+12,5.06069E+12,B08ZCJNQGH,COSMETIC MIRROR 13X1.5X15CM,"VINN DUNN Folding Cosmetic Mirror 15cm With Magnification 1X/3X Chrome, Pre-Assembled Tilting Countertop, Dual-Sided Folding",https://www.efghousewares.co.uk/cosmetic-mirror-13x1-5x15cm,https://www.amazon.co.uk/dp/B08ZCJNQGH,,Available (see Keepa data),,4,0.912,0.76,12.99,1.95,3.13,0.55,2.165,1.278,4.985,-1.278,4.435,338.5496183,7.668,40.96997691
5.05544E+12,,B07J41J715,DEKTON DIGITAL VOLTAGE TESTER,BSIDE AVD06 Non-Contact Voltage Detector Electric Power Socket Outlet AC Voltage Tester Pen 12-1000V Auto/Manual Mode Adjustable Sensitivity NCV Live Wire Check with Color LED Indicator and Flashlight,https://www.efghousewares.co.uk/dekton-digital-voltage-tester-106699,https://www.amazon.co.uk/dp/B07J41J715,100,Available (see Keepa data),Available (see Keepa data),4,1.212,1.01,13.99,1.82,3,0.55,2.331666667,1.276,5.828333333,-1.276,5.278333333,338.3547009,7.656,45.27519657
5.0603E+12,,B08R3ZJD7R,MASON SCREW HOOK SET 15 PIECES,135 PCS Screw Hooks 6 Sizes Vintage Bronze Cup Hooks for Mug Hanging Christmas Lights Plants Indoors Outdoors Use,https://www.efghousewares.co.uk/mason-screw-hook-set-15-pieces-123875,https://www.amazon.co.uk/dp/B08R3ZJD7R,100,Available (see Keepa data),Available (see Keepa data),2,1.008,0.84,12.59,1.64,2.77,0.55,2.098333333,1.16,5.241666667,-1.16,4.691666667,337.529976,6.96,44.71803018
5.0174E+12,6.93121E+12,B0BGXBY8N6,BLACKSPUR 5PCE COMB SPANNER SET,"DURATECH 12-Piece Combination Spanner Set, Open End Wrench Set, Matte Chrome-Plated, Chrome Vanadium Steel, DIN 3113, Metric, 6-22mm, 12-Point, with Storage Pouch",https://www.efghousewares.co.uk/blackspur-5pce-comb-spanner-set,https://www.amazon.co.uk/dp/B0BGXBY8N6,,Available (see Keepa data),,2,2.148,1.79,18.99,2.47,3.14,0.55,3.165,1.59,8.425,-1.59,7.875,336.5384615,9.54,49.76303318
5.06008E+12,5.06502E+12,B0FPXHNBSX,DLUX ALL PURPOSE 20 CLOTHS,"MagicWipeÂ® Microfibre Cloth - 2 Pack 30 x 40 cm Dual Sided Cleaning Cloth - 600 GSM All Purpose Streak Free Diamond Wave Polishing Cloth for Kitchen Worktops, Glass, Mirrors, Bathrooms, Car",https://www.efghousewares.co.uk/dlux-all-purpose-20-cloths,https://www.amazon.co.uk/dp/B0FPXHNBSX,,Available (see Keepa data),Available (see Keepa data),2,0.924,0.77,12.99,1.95,3.13,0.55,2.165,1.28,4.975,-1.28,4.425,335.2272727,7.68,40.87759815
5.06039E+12,,B0FD9QXN2Q,BLUE CANYON TOILET BRUSH PLASTIC LACE WHIT,Strongthium Predator 212 Tune Up Parts Carb Kit for 196cc 200cc 212cc 224cc + Pull Start + Coil + Air Filter Assembly + Spark Plug + Throttle Springs + Gaskets,https://www.efghousewares.co.uk/blue-canyon-toilet-brush-plastic-lace-whit,https://www.amazon.co.uk/dp/B0FD9QXN2Q,,Available (see Keepa data),,1,4.824,4.02,33.99,5.1,3.34,0.55,5.665,2.602,15.865,-2.602,15.315,335.1203501,15.612,54.06884378
5.0603E+12,7.86411E+11,B08Y1Z8CWP,"MASON HEAVY DUTY SPRING CLAMPS 4"" 2 PIECES","10 Pieces Large Nylon Spring Clamps, 6 Inch and 4 Inch Heavy Duty Plastic Grip Clips Set",https://www.efghousewares.co.uk/mason-heavy-duty-spring-clamps-4-2-pieces-123899,https://www.amazon.co.uk/dp/B08Y1Z8CWP,50,,,1,1.008,0.84,12.99,1.69,3.13,0.55,2.165,1.242,5.165,-1.242,4.615,332.0143885,7.452,42.63279446
5.02442E+12,,B0FPWR2HBZ,CHRISTMAS DIFFUSER CAT IN HAT 100ML,DERDUFT Christmas Reed Diffuser Gift Set - Fire Free Holiday Home Fragrance with Sweet Home & Christmas Wreath Scents 2x100ml Bottles with Reed Sticks - Festive Aroma for Living Room Bedroom Office,https://www.efghousewares.co.uk/christmas-diffuser-cat-in-hat-100ml-123270,https://www.amazon.co.uk/dp/B0FPWR2HBZ,,,,,2.616,2.18,19.99,2.49875,2.41,0.55,3.331666667,1.52775,9.569583333,-1.52775,9.019583333,330.3876679,9.1665,54.14457229
8.69417E+12,,B0FD3FSGLM,"ISTANBUL DEEP PLATE 8""","Wrova Plastic Plates Set of 8 Reusable Dinner Plate 9 Inch Deep Plate Set, Unbreakable, Lightweight, Dishwasher & Microwave Safe for Kitchen - White",https://www.efghousewares.co.uk/istanbul-deep-plate-8-121836,https://www.amazon.co.uk/dp/B0FD3FSGLM,,Available (see Keepa data),,1,1.14,0.95,13.99,2.1,3.14,0.55,2.331666667,1.348,5.468333333,-1.348,4.918333333,327.8888889,8.088,42.18727663
5.05544E+12,5.06048E+12,B07FMVBBG2,DEKTON PHILIPS PRO SCREWDRIVER NO2X150MM,"US Pro 12pc Go-Through Screwdrivers Set, Screw Driver Slotted, Philips B1610",https://www.efghousewares.co.uk/dekton-philips-pro-screwdriver-no2x150mm,https://www.amazon.co.uk/dp/B07FMVBBG2,,Available (see Keepa data),Available (see Keepa data),9,1.476,1.23,17.77,2.33,4.87,0.55,2.961666667,1.796,6.378333333,-1.796,5.828333333,327.4344569,10.776,39.35846933
5.03276E+12,,B0FV7JZVLG,AMTECH FLAT TIP ART B/SET XL 12PC,"5pcs Fuumuui Dual-Layer Synthetic Hair Flat Grainer Brush Set- Professional Flat Comb Brushes for Unique Texture Painting Perfect for Acrylic, Watercolour",https://www.efghousewares.co.uk/amtech-flat-tip-art-b-set-xl-12pc,https://www.amazon.co.uk/dp/B0FV7JZVLG,50,Available (see Keepa data),,1,3.216,2.68,23.19,3.48,2.07,0.55,3.865,1.756,11.095,-1.756,10.545,326.4705882,10.536,54.56662354
5.0333E+12,8.10057E+11,B0BGN8NGZP,ESSENTIAL PLASTIC MARTINI 6 GLASSES,"Youngever 6 Pack Plastic Martini Glasses, 300ML Shatterproof Martini Cups",https://www.efghousewares.co.uk/essential-plastic-martini-6-glasses,https://www.amazon.co.uk/dp/B0BGN8NGZP,,Available (see Keepa data),,1,1.548,1.29,15.99,2.4,3.13,0.55,2.665,1.474,6.505,-1.474,5.955,323.6413043,8.844,44.69043152
4.89416E+12,,B0FGXKTF76,FESTIVE MAGIC RIBBON MESH SEQUIN 63MM X 2.7M,"Christmas Tree Ribbon, 26cm X 10 Yards Mesh Ribbon Christmas, Metallic Foil Mesh Fabric for Xmas Trees, Garlands, Weddings and Winter Parties",https://www.efghousewares.co.uk/festive-magic-ribbon-mesh-sequin-63mm-x-2-7m-123114,https://www.amazon.co.uk/dp/B0FGXKTF76,200,,,,1.272,1.06,12.99,1.62375,2.41,0.55,2.165,1.12875,5.73125,-1.12875,5.18125,321.8167702,6.7725,47.86374134
5.01871E+12,,B0F5WYM6NN,OVEN LOVE BAKING DISH RECTANGLE WHITE 0.18L,"Preciva Heavy Duty Staple Gun,Staple Nail Gun Kit with Remover and 1800PCS Staplesï¼Œfor Fixing Material, Decoration, Carpentry,Wood, Crafts",https://www.efghousewares.co.uk/oven-love-baking-dish-rectangle-white-0-18l-118229,https://www.amazon.co.uk/dp/B0F5WYM6NN,50,Available (see Keepa data),,3,1.272,1.06,13.59,1.77,2.77,0.55,2.265,1.23,5.725,-1.23,5.175,321.4285714,7.38,45.69536424
5.0508E+12,,B0CBGDBFBF,BRIGHT & HOMELY MULTI-PURPOSE WORK GLOVES LARGE,"Gardening Gloves for Men and Women - Tough, Thorn Proof Comfortable Breathable Leather Multi-Purpose Work Gloves â€“ Protective Large Garden Gloves with Strong Grip (X-Large)",https://www.efghousewares.co.uk/bright-homely-work-gloves-large-pack-of-12-115978,https://www.amazon.co.uk/dp/B0CBGDBFBF,300,,,,0.672,0.56,9.99,1.24875,2.41,0.55,1.665,0.95375,4.10625,-0.95375,3.55625,320.3828829,5.7225,42.71771772
5.06036E+12,,B0DK486X41,SUPERIOR FOIL 2 CONTAINERS MEDIUM ROASTER,Superior Pack of 40 Foil Containers with Lids â€“ 750ml Sturdy Deep Foil Trays with Lids - Ideal for Storage Baking Roasting BBQ Cooking â€“ Reusable Food Containers for Small to Medium Size Meals,https://www.efghousewares.co.uk/superior-foil-2-containers-medium-roaster-107571,https://www.amazon.co.uk/dp/B0DK486X41,,,,,1.68,1.4,14.97,1.87125,2.41,0.55,2.495,1.24625,6.79375,-1.24625,6.24375,320.1923077,7.4775,50.0501002
5.01348E+12,,B07GZGXQYG,KINGFISHER FOIL 5 DISH & LID LARGE,"Superior Foil Containers with Lids â€“ 9x13 Inches Sturdy Deep Foil Trays with Lid, Ideal for Cooking, Baking,Roasting, BBQ, Meal Prep Storage Tray â€“ Large Foil Trays with Lids (5 Pack)",https://www.efghousewares.co.uk/kingfisher-foil-5-dish-lid-large,https://www.amazon.co.uk/dp/B07GZGXQYG,200,,,,1.644,1.37,14.79,1.84875,2.41,0.55,2.465,1.23575,6.69625,-1.23575,6.14625,320.1171875,7.4145,49.86815416
5.05325E+12,,B0FPWR2HBZ,PAN AROMA CRACKER  REED DIFUFSER CHRISTMAS JOY 100ML,DERDUFT Christmas Reed Diffuser Gift Set - Fire Free Holiday Home Fragrance with Sweet Home & Christmas Wreath Scents 2x100ml Bottles with Reed Sticks - Festive Aroma for Living Room Bedroom Office,https://www.efghousewares.co.uk/pan-aroma-100ml-cracker-reed-difufser-christmas-joy-120025,https://www.amazon.co.uk/dp/B0FPWR2HBZ,,Available (see Keepa data),,1,2.352,1.96,19.99,3,3.13,0.55,3.331666667,1.728,8.568333333,-1.728,8.018333333,319.4555113,10.368,48.13406703
5.0174E+12,,B0BZ4TW8HC,ASHLEY SHOWER CURTAIN & HOOK SET SATIN FABRIC,"YellyHommy No Hook Shower Curtain with Snap in Fabric Liner Set Less Time White Waffle Shower Curtain for Bathroom 81"" L x 72"" W",https://www.efghousewares.co.uk/ashley-shower-curtain-hook-set-satin-fabric-109392,https://www.amazon.co.uk/dp/B0BZ4TW8HC,,,Available (see Keepa data),3,3.828,3.19,30.08,6.25,3.14,0.55,5.013333333,2.626,12.48666667,-2.626,11.93666667,319.1622103,15.756,47.61968085
6.26971E+12,7.69045E+11,B0CQ8615W9,BAROQ 2 CUP RELISH ON TRAY SET,"Ceramic Condiment Appetizer Set,with lid Porcelain Divided Serving Dishes, Relish Tray, Perfect for Chips and Dip, Veggies, Candy and Snacks, Fruits, appetizers",https://www.efghousewares.co.uk/baroq-2-cup-relish-on-tray-set-124016,https://www.amazon.co.uk/dp/B0CQ8615W9,,Available (see Keepa data),,1,1.572,1.31,15.99,2.4,3.14,0.55,2.665,1.48,6.475,-1.48,5.925,318.5483871,8.88,44.46529081
5.01316E+12,,B0FMNXP67B,ELLIOTT BOTTLE CLEANING BRUSH 1LTR,Benjia 30th Birthday Banner Decorations for Men Women Born in 1996 UK Background Happy 30 Years Old Birthday Backdrop Cheers to 30 Years Banners Black Gold Poster Bday Gift Home Decor Party Supplies,https://www.efghousewares.co.uk/elliott-bottle-cleaning-brush-1ltr-15-2,https://www.amazon.co.uk/dp/B0FMNXP67B,,Available (see Keepa data),,1,0.804,0.67,9.99,1.5,1.72,0.55,1.665,0.888,4.435,-0.888,3.885,318.442623,5.328,46.66666667
5.0174E+12,,B0FMNXCKMJ,BLACKSPUR SHARPENING STONE SET,Benjia 30th Birthday Banner Decorations for Men Women Born in 1996 UK Background Happy 30 Years Old Birthday Backdrop Cheers to 30 Years Banners Vintage Poster Bday Gift Home Decor Party Supplies,https://www.efghousewares.co.uk/blackspur-sharpening-stone-set-109390,https://www.amazon.co.uk/dp/B0FMNXCKMJ,,Available (see Keepa data),,1,0.804,0.67,9.99,1.5,1.72,0.55,1.665,0.888,4.435,-0.888,3.885,318.442623,5.328,46.66666667
8.00365E+12,7.20194E+11,B091KPM2KX,TONKITA TOILET BRUSH,"Toilet Brush, 2 Pack Bathroom Silicone Toilet Brushes and Holder Sets with No-Slip Long Plastic Handle and Soft Flexible Bristles, Toilet Brushes with holders and Base for Anti-drip (White)",https://www.efghousewares.co.uk/tonkita-toilet-brush,https://www.amazon.co.uk/dp/B091KPM2KX,,Available (see Keepa data),,2,1.104,0.92,12.99,1.69,3,0.55,2.165,1.232,5.215,-1.232,4.665,317.3469388,7.392,43.09468822
5.05406E+12,7.05737E+11,B0DRFJ1LDG,BELDRAY SWIVEL TOP TOILET ROLL HOLDER MATT BLACK,"Mould King V8 Engine Building Blocks Set, 10206 Engine Model That Runs, Sports Car Engines Kit for Adults with Battery Box and Motor, Construction STEM Toy for Teens (737 Pcs)",https://www.efghousewares.co.uk/beldray-swivel-top-toilet-roll-holder-matt-black-121362,https://www.amazon.co.uk/dp/B0DRFJ1LDG,,Available (see Keepa data),,1,6.72,5.6,41.99,6.3,3.1,0.55,6.998333333,3.11,19.99166667,-3.11,19.44166667,316.1246612,18.66,55.56084782
5.03276E+12,5.01836E+12,B00N2SHPDC,AMTECH NO BRISTLE LOSS ANGLED 1.5INCH,"Cutting Edge 3 Piece Paint Brush Set - Professional Premium Quality - Precision Angled Cutting In Paint Brushes - for Sharp Edge Lines Painting with Paints on Walls, Ceilings, Wood & Metal, 1""|1.5""|2""",https://www.efghousewares.co.uk/amtech-no-bristle-loss-angled-1-5inch,https://www.amazon.co.uk/dp/B00N2SHPDC,,Available (see Keepa data),Available (see Keepa data),2,1.38,1.15,13.99,1.82,2.77,0.55,2.331666667,1.258,5.918333333,-1.258,5.368333333,315.7843137,7.548,46.04717655
5.03048E+12,1.99285E+11,B0DZNWNYV7,PPS FOIL ROASTING 2 DISHES,"10 Pack Large Aluminium Foil Trays Deep (3500ml) - Tin Foil Food Containers for Cooking, Baking, Roasting, and BBQ (32x26x7)",https://www.efghousewares.co.uk/pps-foil-roasting-2-dishes,https://www.amazon.co.uk/dp/B0DZNWNYV7,400,Available (see Keepa data),,1,0.672,0.56,11.99,1.8,3.58,0.55,1.998333333,1.298,4.051666667,-1.298,3.501666667,315.4654655,7.788,35.04587156
5.0563E+12,6.97602E+12,B0D9Q8SJWF,CASA & CASA OCEANIC DUSTPAN & BRUSH SET,JHY DESIGN 3 Colors Bedside Rechargeable Table Lamp Translucent Ceramics Dimmable LED Touch Lamp for Living Room Bedroom Cafe Outdoors Kids Room (Snowflake),https://www.efghousewares.co.uk/casa-casa-oceanic-dustpan-brush-set-121256,https://www.amazon.co.uk/dp/B0D9Q8SJWF,,Available (see Keepa data),,1,2.82,2.35,22.99,3.45,3.68,0.55,3.831666667,2.006,9.678333333,-2.006,9.128333333,314.7701149,12.036,47.64680296
5.0174E+12,5.06028E+12,B005DR2P7Q,BLACKSPUR LEVER LOCK SET ALUM,From the Anvil Black Smooth Lever Lock Set,https://www.efghousewares.co.uk/blackspur-lever-lock-set-alum,https://www.amazon.co.uk/dp/B005DR2P7Q,,,Available (see Keepa data),3,5.112,4.26,32.7,4.25,3.08,0.55,5.45,2.428,15.66,-2.428,15.11,314.1372141,14.568,55.44954128
8.72104E+12,8.40324E+11,B0F4QJFY82,PLATE STONEWARE 20CM,"Amazon Basics Glazed Stoneware Dinner Plates, 6-Piece Set, Microwave and Dishwasher-Safe, 26.67cm, Ivory",https://www.efghousewares.co.uk/plate-stoneware-20cm-118492,https://www.amazon.co.uk/dp/B0F4QJFY82,,,,1,2.088,1.74,22.26,3.34,5.74,0.55,3.71,2.274,7.73,-2.274,7.18,313.5371179,13.644,38.70619946
5.03048E+12,5.06066E+12,B08G1Y82GN,PPS FOIL FLAN 5 DISHES ROUND LARGE,20 Aluminium Foil Trays with Paper Lids â€“ Round Foil Flan Dishes â€“ Durable and Food Grade Tin Pie Cases â€“ Oven and Freezer Safe â€“ Baking Trays Containers - 9 inch-23cm,https://www.efghousewares.co.uk/pps-foil-flan-5-dishes-round-large,https://www.amazon.co.uk/dp/B08G1Y82GN,200,Available (see Keepa data),,2,0.804,0.67,11.98,1.8,3.14,0.55,1.996666667,1.232,4.373333333,-1.232,3.823333333,313.3879781,7.392,38.29716194
,7.37056E+11,B0FSZPND35,FESTIVE MAGIC GINGERBREAD WINDOW CLING,Christmas Gingerbread Man Window Film 17.7 x 39.3 Inch Candy Cane Stained Glass Static Cling Decorative Privacy Window Sticker for Holiday Festive Winter Home Decoration,https://www.efghousewares.co.uk/festive-magic-gingerbread-window-cling-122998,https://www.amazon.co.uk/dp/B0FSZPND35,,,Available (see Keepa data),1,0.744,0.62,13.68,2.92,3.65,0.55,2.28,1.548,4.21,-1.548,3.66,312.8205128,9.288,32.10526316
5.05544E+12,5.06051E+12,B06Y64P5YM,DEKTON GECKOSLIDE CARPET PROTECTORS,Winsome Clear Carpet Protector Film Self Adhesive Roll Temporary Protecting Water Resistant Floor Dust Sheet Cover | 60cm x 25m Roll (60 Micron),https://www.efghousewares.co.uk/dekton-geckoslide-carpet-protectors-119563,https://www.amazon.co.uk/dp/B06Y64P5YM,700,Available (see Keepa data),Available (see Keepa data),3,1.884,1.57,17.99,2.34,3.9,0.55,2.998333333,1.672,7.181666667,-1.672,6.631666667,312.8144654,10.032,44.23568649
5.0553E+12,5.06047E+12,B076VM5BCB,PLUNGER BUFFALO HANDY PRO SINK & BASIN,Metal Access Panel - Picture Frame - Non Fire Rated - (150x150mm),https://www.efghousewares.co.uk/plunger-buffalo-handy-pro-sink-basin-115774,https://www.amazon.co.uk/dp/B076VM5BCB,,Available (see Keepa data),Available (see Keepa data),2,5.844,4.87,36,4.68,2.96,0.55,6,2.612,17.49,-2.612,16.94,312.5461255,15.672,56.46666667
8.00365E+12,,B0D5QGWXR9,TONKITA TOILET BRUSH & HOLDER MASTER,"Electric Citrus Juicer Rechargeable - Electric Juicer Machines with USB and Cleaning Brush Portable Compact Juicer for Orange, Lemon, Limes",https://www.efghousewares.co.uk/tonkita-toilet-brush-holder-master,https://www.amazon.co.uk/dp/B0D5QGWXR9,100,Available (see Keepa data),,1,2.58,2.15,21.19,3.18,3.35,0.55,3.531666667,1.846,8.978333333,-1.846,8.428333333,312.1604938,11.076,47.73006135
6.26057E+12,,B0CRQDLYTQ,OPAL ROUND CEREAL BOWl WHITE,"12V Power Supply, 12V 2A Power Adapter, for Yamaha Keyboard LED Strip Light CCTV Camera External Hard Drive BT Speaker GPS Webcam Router Scanner with 12Vdc Power Cord",https://www.efghousewares.co.uk/opal-round-cereal-bowl-white-112468,https://www.amazon.co.uk/dp/B0CRQDLYTQ,50,Available (see Keepa data),,1,1.056,0.88,12.99,1.95,3,0.55,2.165,1.276,4.995,-1.276,4.445,310.8391608,7.656,41.06235566
8.83315E+11,19954926809,B0002E1G5C,LUMINARC HARENA DESSERT PLATE 19CM WHITE,D'addario Pro Guitar Winder/Cutter DP0002,https://www.efghousewares.co.uk/luminarc-harena-dessert-plate-19cm-white,https://www.amazon.co.uk/dp/B0002E1G5C,,,Available (see Keepa data),15,1.164,0.97,11.4,1.37,1.89,0.55,1.9,0.956,5.27,-0.956,4.72,310.5263158,5.736,49.68421053
26102895207,,B0FP2RK8GK,CARINE PASTA PLATE BLACK,"HOMQUEN Pasta Bowls Set of 6, 37oz Salad Bowls Black Soup Bowls, Large Pasta Serving Bowls, Unbreakable Plastic Dinner Bowls, Dinnerware Sets,Valentines Day Gift, Dishwasher Safe (Black)",https://www.efghousewares.co.uk/carine-pasta-plate-black,https://www.amazon.co.uk/dp/B0FP2RK8GK,50,Available (see Keepa data),,1,1.788,1.49,16.99,2.55,3.25,0.55,2.831666667,1.568,6.868333333,-1.568,6.318333333,309.7222222,9.408,44.62625074
5.02618E+12,,B07TDNYMCH,APOLLO CHROME TOILET BRUSH & HOLDER,BGL 304 Stainless Steel Toilet Brush Long Bucket Stand Round Toilet Brush with Holder Chrome,https://www.efghousewares.co.uk/apollo-chrome-toilet-brush-holder-09-02-23,https://www.amazon.co.uk/dp/B07TDNYMCH,200,,,,4.032,3.36,25.99,3.24875,2.41,0.55,4.331666667,1.91375,12.63958333,-1.91375,12.08958333,309.1965047,11.4825,55.81954598
4.89416E+12,7.27381E+11,B085CCNXXB,FESTIVE MAGICSNOW WINDOW DECORATION,"Dirt Bike Gifts, Motocross 3D Night Light for Kids for Xmas Holiday Birthday Gifts for KidsMotorcycle Fan with Remote Control 16 Colors Changing + 4 Changing Mode + Dim Function",https://www.efghousewares.co.uk/festive-magicsnow-window-decoration-83376,https://www.amazon.co.uk/dp/B085CCNXXB,100,Available (see Keepa data),,1,1.944,1.62,16.99,2.21,3.1,0.55,2.831666667,1.496,7.228333333,-1.496,6.678333333,307.7572965,8.976,47.1689229
5.02618E+12,5.06058E+12,B09S3YBBRR,APOLLO CERAMIC 0.25LTR CHURN JUG,"Herd Mentality â€“ Udderly Hilarious Family Board Game for 4â€“20 Players | Easy to Learn, Loved by Millions, with Bonus Online Exclusive Content",https://www.efghousewares.co.uk/apollo-ceramic-0-25ltr-churn-jug-10-10,https://www.amazon.co.uk/dp/B09S3YBBRR,,Available (see Keepa data),Available (see Keepa data),5,1.368,1.14,14.99,2.25,3.36,0.55,2.498333333,1.46,5.741666667,-1.46,5.191666667,307.199211,8.76,41.56104069
5.02618E+12,5.06058E+12,B09S3YBBRR,APOLLO JUG 0.125LTR,"Herd Mentality â€“ Udderly Hilarious Family Board Game for 4â€“20 Players | Easy to Learn, Loved by Millions, with Bonus Online Exclusive Content",https://www.efghousewares.co.uk/apollo-jug-0-125ltr,https://www.amazon.co.uk/dp/B09S3YBBRR,,Available (see Keepa data),Available (see Keepa data),5,1.368,1.14,14.99,2.25,3.36,0.55,2.498333333,1.46,5.741666667,-1.46,5.191666667,307.199211,8.76,41.56104069
5.02618E+12,,B0F2SZQMXF,APOLLO CERAMIC FLUTED DISH 7 X 3CM,"White Quiche,18cm Pie Dish Flan Dish,Ceramic Oven Dish Baking Dishes,Ceramic Baking Tray for Pie,Quiche,Pizza, Pasta,Pastry",https://www.efghousewares.co.uk/apollo-ceramic-fluted-dish-7-x-3cm-10-10,https://www.amazon.co.uk/dp/B0F2SZQMXF,,Available (see Keepa data),,1,0.936,0.78,11.98,1.8,2.77,0.55,1.996666667,1.18,4.633333333,-1.18,4.083333333,307.0175439,7.08,40.9015025
,,B0CBC32HQK,PREMIER COLOUR YOUR OWN CHRISTMAS CHRACTER 15CM,"Tenare 16 Pack Colour Your Own Christmas Cards Xmas Colouring Greeting Cards Santa Snowman Xmas Tree Elk Card Making Kits for Children DIY Merry Christmas Cards with 16 Envelopes for Kids, 4 Styles",https://www.efghousewares.co.uk/premier-colour-your-own-christmas-chracter-15cm-123166,https://www.amazon.co.uk/dp/B0CBC32HQK,50,Available (see Keepa data),,1,1.14,0.95,12.99,1.95,2.77,0.55,2.165,1.244,5.155,-1.244,4.605,307,7.464,42.5404157
5.01125E+12,5.06092E+12,B0CLH8FTC9,MOP HEAD PLASTIC OPTIMA NO14 PK10,"Hamilton Beach Pro Smart Waffle Maker, Non-Stick, 7 Browning Levels, 5 Programmes, Family Size, Digital Display, Overflow Protection - HB5403T, Silver",https://www.efghousewares.co.uk/mop-head-plastic-optima-no14-pk10,https://www.amazon.co.uk/dp/B0CLH8FTC9,200,Available (see Keepa data),Available (see Keepa data),2,9.876,8.23,59.99,9,5.3,0.55,9.998333333,4.616,27.46166667,-4.616,26.91166667,306.5110099,27.696,53.83230538
5.05258E+12,,B0FMNXCKMJ,BETTINA WIZARD 3 COPPER SCOURERS,Benjia 30th Birthday Banner Decorations for Men Women Born in 1996 UK Background Happy 30 Years Old Birthday Backdrop Cheers to 30 Years Banners Vintage Poster Bday Gift Home Decor Party Supplies,https://www.efghousewares.co.uk/bettina-wizard-3-copper-scourers-111811,https://www.amazon.co.uk/dp/B0FMNXCKMJ,,Available (see Keepa data),,1,0.852,0.71,9.99,1.5,1.72,0.55,1.665,0.896,4.395,-0.896,3.845,305.1587302,5.376,46.18618619
