EAN,EAN_OnPage,ASIN,SupplierTitle,AmazonTitle,SupplierURL,AmazonURL,bought_in_past_month,fba_seller_count,fbm_seller_count,total_offer_count,SupplierPrice_incVAT,SupplierPrice_exVAT,SellingPrice_incVAT,ReferralFee,FBAFee,PrepHouseFee,OutputVAT,InputVAT,NetProceeds,HMRC,NetProfit,ROI,Breakeven,ProfitMargin
8.00109E+12,6.06826E+11,B09HQT8586,HAND SCRUBBING BRUSH & HANDLE ABBEY,Flying Ball Orb Toys 2025ï¼ŒHover Ball Pro Flying Spinner Toyï¼Œ UFO RGB Cool Stuff Globe Orbi Magic Boomerang Hand Controller Mini Drone for 8 9 10 11 12 boys girls Kids (Blue),https://www.efghousewares.co.uk/hand-scrubbing-brush-handle-abbey,https://www.amazon.co.uk/dp/B09HQT8586,,Available (see Keepa data),,1,1.212,1.01,23,3.45,3.19,0.55,3.833333333,1.64,11.51666667,-1.64,10.96666667,702.991453,9.84,57.2173913
5.0508E+12,7.03327E+11,B00VXMR8DG,BRIGHT & HOMELY MULTI-PURPOSE WORK GLOVES EXTRA LARGE,10 Pairs - Click 2000 MP1 Multi Purpose Work Builders Safety Gloves Sizes M L XL (Extra Large),https://www.efghousewares.co.uk/bright-homely-work-gloves-extra-large-pack-of-12-115979,https://www.amazon.co.uk/dp/B00VXMR8DG,,,,2,0.672,0.56,17.5,2.47,3.22,0.55,2.916666667,1.36,8.333333333,-1.36,7.783333333,701.2012012,8.16,53.37142857
5.01035E+12,7.92106E+11,B0D83GCC8H,MINKY LINT ROLLER,"Hand Operated Flying Toy Drone for Kids, 360Â° Hands Free Motion Sensors Mini Drone with Cool LED Lights, Easy Indoor Small UFO Toy Flying Ball Drone for 6 7 8 9 10+ Year Old Boys and Girls",https://www.efghousewares.co.uk/minky-lint-roller,https://www.amazon.co.uk/dp/B0D83GCC8H,,Available (see Keepa data),,1,1.236,1.03,22.99,3.45,3.1,0.55,3.831666667,1.626,11.57833333,-1.626,11.02833333,697.9957806,9.756,57.56415833
8.00899E+12,7.12673E+11,B08HJX6WJQ,TONKITA ECO DISH BRUSH,"YunSCM 2PCS 700C Bike Heavy Duty Tubes 700x25C 700x28C 700x30C 700x32C 700x34C ETRTO 25/34-622 FV80mm Long Presta Valve 28"" Inner Tubes Compatible with 700x25C/28C/30C/32C/34C bike Tyre Tubes",https://www.efghousewares.co.uk/tonkita-eco-dish-brush,https://www.amazon.co.uk/dp/B08HJX6WJQ,,Available (see Keepa data),,1,0.636,0.53,14.89,1.04,2.75,0.55,2.481666667,0.974,8.088333333,-0.974,7.538333333,697.9938272,5.844,60.75218267
5.01348E+12,,B0FQNMBKD4,KINGFISHER BIN LINER 50 BAG 75 LTR,"3-Player Whack Game Toy Mole with Lights & Sounds, 3Modes&7Speed Levels, LED Scoreboard, Interactive Hammer Toy, Educational Pounding Game for Kids Ages 3-10, Gifts for Boys & Girls",https://www.efghousewares.co.uk/kingfisher-bin-liner-50-bag-75-ltr,https://www.amazon.co.uk/dp/B0FQNMBKD4,,Available (see Keepa data),,1,3.54,2.95,45.99,6.9,3.58,0.55,7.665,2.796,24.895,-2.796,24.345,695.5714286,16.776,63.52250489
,,B097RWHTJV,D-C FIX SELF ADHESIVE STATIC VITRAIL,67.5cm x 2m (Pack of 5 + App Kit) d-c-fix CONCRETE GREY sticky back plastic vinyl wrap film (346-8166),https://www.efghousewares.co.uk/d-c-fix-self-adhesive-static-vitrail-121737,https://www.amazon.co.uk/dp/B097RWHTJV,,Available (see Keepa data),,1,3.288,2.74,45,6.75,4.58,0.55,7.5,2.924,23.43,-2.924,22.88,695.4407295,17.544,61.01333333
5.03276E+12,,B0CD7W7L71,AMTECH TILE SPACERS 400PC 3MM,3mm Tile Leveling Spacers 400PCSï¼ŒHeighten Tile Levelling Clips for Tiles with a Thickness of 15-23mm,https://www.efghousewares.co.uk/amtech-tile-spacers-400pc-3mm,https://www.amazon.co.uk/dp/B0CD7W7L71,,,,,1.488,1.24,23.49,2.93625,2.41,0.55,3.915,1.42725,12.98875,-1.42725,12.43875,694.9022346,8.5635,63.5440613
5.05258E+12,,B0FD9QXN2Q,BETTINA COTTON MOP  & HANDLE,Strongthium Predator 212 Tune Up Parts Carb Kit for 196cc 200cc 212cc 224cc + Pull Start + Coil + Air Filter Assembly + Spark Plug + Throttle Springs + Gaskets,https://www.efghousewares.co.uk/bettina-cotton-mop-handle-116997,https://www.amazon.co.uk/dp/B0FD9QXN2Q,,Available (see Keepa data),,1,2.352,1.96,33.99,5.1,3.34,0.55,5.665,2.19,17.925,-2.19,17.375,692.2310757,13.14,61.34157105
5.70495E+12,5.70495E+12,B07VP62248,GORILLA WOOD GLUE 236ML,Gorilla Wood Glue 236ml (Pack of 12),https://www.efghousewares.co.uk/gorilla-wood-glue-236ml,https://www.amazon.co.uk/dp/B07VP62248,,,Available (see Keepa data),7,4.836,4.03,54.84,5.35,4.2,0.55,9.14,2.826,32.12,-2.826,31.57,689.30131,16.956,69.0809628
8.71999E+12,8.7211E+12,B0FBGZRLRK,WOODEN CHRISTMAS TREE DECORATION 25CM (2 ASSORTED DESIGNS),"Philips 3600LM Solar Security Lights, 5000K Waterproof Dimmable LED Motion Sensor Outdoor Lights, 3 Adjustable Heads w/5m Cable, Separate Solar Panel with 3 Modes Solar Flood Lights for Yard, Garage",https://www.efghousewares.co.uk/wooden-christmas-tree-decoration-25cm-2-assorted-designs-105373,https://www.amazon.co.uk/dp/B0FBGZRLRK,200,Available (see Keepa data),,1,2.016,1.68,35.14,6.75,4.97,0.55,5.856666667,2.79,15.88333333,-2.79,15.33333333,687.593423,16.74,52.36198065
5.03276E+12,,B0FGJ9JGSB,AMTECH RECHARGEABLE WORK LIGHT WITH MAGNETIC STAND 3W,"T-SUN Rechargeable LED Work Light with Metal Stand,4100Lumen Portable Magnetic Camping Light,10400Ah Battery,Job Site Lighting for Outdoor Barbecue Golf Fishing Indoor Workshop Garage",https://www.efghousewares.co.uk/amtech-rechargeable-work-light-with-magnetic-stand-3w-119149,https://www.amazon.co.uk/dp/B0FGJ9JGSB,100,Available (see Keepa data),,1,4.956,4.13,59.99,7.8,5.49,0.55,9.998333333,3.594,32.57166667,-3.594,32.02166667,684.2236467,21.564,64.054009
5.05057E+12,,B0FCYHZSMR,TOP OF THE LIST MELAMINE LARGE PLATE,Wrova Reusable Large Plates Set of 8-11 INCH Plastic Plate Unbreakable Salad Plate Dishwasher & Microwave Safe Big Deep Plates for Kitchen - Colorful,https://www.efghousewares.co.uk/top-of-the-list-melamine-large-plate-92058,https://www.amazon.co.uk/dp/B0FCYHZSMR,,,,,1.14,0.95,19.99,2.49875,2.41,0.55,3.331666667,1.28175,10.79958333,-1.28175,10.24958333,683.3055556,7.6905,61.52826413
8.83315E+11,8.10097E+11,B0DMSPF13X,LUMINARC HARENA DINNER PLATE 25CM BLACK,"TOSY Magnet Pyramid Glow - 1 Cube Transforms into 1 Billion Shapes, 12 pieces, 243 Magnets, Glowing, Christmas Stocking Stuffers Gift for Kids, Holographic Design, Creative Puzzle STEM/STEAM Toy",https://www.efghousewares.co.uk/luminarc-harena-dinner-plate-25cm-black,https://www.amazon.co.uk/dp/B0DMSPF13X,,Available (see Keepa data),,2,1.38,1.15,24.2,3.7,3.19,0.55,4.033333333,1.718,12.12666667,-1.718,11.57666667,680.9803922,10.308,57.40495868
8.69417E+12,,B082G91T8Q,"KIYOTO CEREAL BOWL 6""","SEYMAC stock Case for iPad 9th/8th/7th Generation (10.2 Inch) 2021/2020/2019, Heavy Duty Shockproof with Screen Protector, 360Â° Rotating Stand/Hand Strap, Pencil Holder & Shoulder Strap, Black",https://www.efghousewares.co.uk/kiyoto-cereal-bowl-6-121822,https://www.amazon.co.uk/dp/B082G91T8Q,50,Available (see Keepa data),,3,1.14,0.95,21.59,3.6,2.77,0.55,3.598333333,1.574,10.67166667,-1.574,10.12166667,674.7777778,9.444,56.25752663
8.72104E+12,8.8517E+11,B074817DK1,PAN WITH LID STONEWARE 8 ASSORTED,"Amazon Basics 8-Piece Non-Stick Cookware Set, Black",https://www.efghousewares.co.uk/pan-with-lid-stoneware-8-assorted-121706,https://www.amazon.co.uk/dp/B074817DK1,400,,,16,2.544,2.12,38.49,5.77,5.66,0.55,6.415,2.82,18.525,-2.82,17.975,673.2209738,16.92,56.04053001
5.06007E+12,,B078H7XLT1,GLITTER SILVER OVAL BOWL LARGE 3PCS,"Elegance 72650 Hammered Stainless Steel Oval Bowl, Silver",https://www.efghousewares.co.uk/glitter-silver-oval-bowl-large-110306,https://www.amazon.co.uk/dp/B078H7XLT1,,,Available (see Keepa data),1,1.584,1.32,27.44,5.28,3.13,0.55,4.573333333,2.056,13.13666667,-2.056,12.58666667,673.083779,12.336,55.04373178
26102377925,7.69044E+11,B0DTDLVHTN,CADIX 25CM DINNER PLATE,"KAHEIGN 32Pcs Unbreakable Black Plastic Dinnerware Set, 8 Sets of 25cm Dinner Plates, 20cm Salad Plates, 720ml Bowls, 360ml Cups - Microwave & Dishwasher Safe",https://www.efghousewares.co.uk/cadix-25cm-dinner-plate,https://www.amazon.co.uk/dp/B0DTDLVHTN,100,Available (see Keepa data),,1,1.164,0.97,24.99,3.75,5.34,0.55,4.165,2.122,10.765,-2.122,10.215,672.0394737,12.732,49.05162065
5.05384E+12,5.03733E+12,B09P58TDMW,PREMIER BATTERY OPERATED 24 LED MULTI ACTION TIMER LIGHTS WARM WHITE,"Safety First Aid Group Workplace First Aid Kit (Small 1-10 Persons) Economy HSE-Compliant with Inspection Tags, Wall Bracket, Extra Plasters",https://www.efghousewares.co.uk/premier-battery-operated-24-led-multi-action-timer-lights-warm-white-102541,https://www.amazon.co.uk/dp/B09P58TDMW,400,Available (see Keepa data),,2,2.616,2.18,32,2.54,3.14,0.55,5.333333333,1.682,18.80666667,-1.682,18.25666667,668.7423687,10.092,68.4625
5.05258E+12,,B07YWB6QGR,BETTINA MOP CHENILLE MOP & HANDLE,OLEVS Men Watch Leather Strap Classic Dress Large Face Analog Quartz Date Luminous Waterproof Gents Wrist Watch,https://www.efghousewares.co.uk/bettina-mop-chenille-mop-handle,https://www.amazon.co.uk/dp/B07YWB6QGR,50,Available (see Keepa data),,1,3.156,2.63,38.77,5.82,2.07,0.55,6.461666667,2.214,21.78833333,-2.214,21.23833333,667.8721174,13.284,65.73639412
5.05544E+12,4.02695E+12,B004UMBMEC,DEKTON RACHET HANDLE SPINNER 1/2 INCH,"BGS 107 | Reversible Ratchet with Spinner Handle | 12.5 mm (1/2"")",https://www.efghousewares.co.uk/dekton-rachet-handle-spinner-1-2-inch-25-9,https://www.amazon.co.uk/dp/B004UMBMEC,,,Available (see Keepa data),2,4.032,3.36,46.74,6.23,2.77,0.55,7.79,2.582,26.59,-2.582,26.04,665.9846547,15.492,66.85494223
5.0508E+12,,B0BPLGMW1B,BRIGHT & HOMELY HEAVY DUTY CONCERTINA TOILET PLUNGER LARGE,OLEVS Mens Watches Designer Calendar Dress Metal Stainless Steel Quartz Analog Waterproof Luminous Wrist Watch Gent Large,https://www.efghousewares.co.uk/bright-homely-heavy-duty-toilet-plunger-122841,https://www.amazon.co.uk/dp/B0BPLGMW1B,100,Available (see Keepa data),,1,3.492,2.91,42.77,6.42,2.77,0.55,7.128333333,2.53,23.54166667,-2.53,22.99166667,664.4990366,15.18,64.50783259
9.33353E+12,,B0DNCY21RY,FESTIVE MAGIC HAIR SCRUNCHIE GLITTER DEC,65W 4.5 * 3.0mm Laptop Charger Blue Tip Compatible with HP EliteBook 840 850 845 830 820 G8 G7 G6 G5 G4 G3 ProBook 640 650 450 430 440 446 455 470 745 735 725 755 Pavilion Stream Envy X360 Adapter,https://www.efghousewares.co.uk/festive-magic-hair-scrunchie-glitter-dec-101437,https://www.amazon.co.uk/dp/B0DNCY21RY,,,,,0.744,0.62,15.99,1.99875,2.41,0.55,2.665,1.11575,8.29625,-1.11575,7.74625,662.0726496,6.6945,58.13320826
4.89416E+12,,B0FYMVDQX8,FESTIVE MAGIC LIGHT UP HAIR CLIP,"6PCS Christmas Headbands, Light Up Christmas Headband, LED Reindeer Head Boppers, flashing xmas antler hair bands, party accessories for kids and adults, fun light-up design for Christmas celebrations",https://www.efghousewares.co.uk/festive-magic-light-up-hair-clip-83356,https://www.amazon.co.uk/dp/B0FYMVDQX8,,,,,1.08,0.9,18.99,2.37375,2.41,0.55,3.165,1.24675,10.14125,-1.24675,9.59125,661.4655172,7.4805,60.60821485
6.26057E+12,6.9777E+12,B0DW93JXWB,OPAL SQUARE CEREAL BOWL WHITE,"473ml (16 OZ MAX) White Opal Glass Cereal Bowl Set of 6, 6.5 inch Dishwasher & Microwave Safe Round Bowls for Soup, Salad and Rice",https://www.efghousewares.co.uk/opal-square-cereal-bowl-white-112464,https://www.amazon.co.uk/dp/B0DW93JXWB,,Available (see Keepa data),,1,0.936,0.78,19.99,3,3.58,0.55,3.331666667,1.582,9.298333333,-1.582,8.748333333,657.7694236,9.492,52.51625813
50552306,4.06355E+12,B0DTKSF4K7,CARLUBE BRAKE FLUID DOT3,"HUGO Women Bel Crossbody Nw Bag, Black, One Size",https://www.efghousewares.co.uk/carlube-brake-fluid-dot3,https://www.amazon.co.uk/dp/B0DTKSF4K7,,,Available (see Keepa data),2,5.448,4.54,59.5,8.93,2.16,0.55,9.916666667,3.236,33.95333333,-3.236,33.40333333,656.254093,19.416,67.36806723
5.06036E+12,,B0FD9SCTR3,SPLENDID PLASTIC 40 BOWLS 12 INCH,Strongthium GX340 GX390 Tune Up Parts Carb Kit for Honda Predator 11 13 hp 420cc w/Carburetor + Pull Start + Coil + Air Filter + Spark Plug + Throttle Springs + Gaskets,https://www.efghousewares.co.uk/splendid-plastic-40-bowls-12-inch,https://www.amazon.co.uk/dp/B0FD9SCTR3,,Available (see Keepa data),,1,2.484,2.07,34.19,5.4,3.34,0.55,5.698333333,2.272,17.68166667,-2.272,17.13166667,653.8804071,13.632,60.1286926
8.83315E+11,,B0DPQ8GSHH,LUMINARC HARENA DINNER 25CM WHITE,"for iPad 9th/8th/7th Generation 10.2"" Case - Kawaii Cute for iPad 9th/8th/7th Gen Cover Soft Silicone PK Unicorn 3D Cartoon Funda Para iPad 9/8/7 with Strap & Rotating Stand for Girls Girly",https://www.efghousewares.co.uk/luminarc-harena-dinner-25cm-white,https://www.amazon.co.uk/dp/B0DPQ8GSHH,,Available (see Keepa data),,1,1.272,1.06,21.99,3.3,2.93,0.55,3.665,1.568,11.035,-1.568,10.485,651.242236,9.408,57.21691678
5.01111E+12,,B0007OV79C,CHURCHILL WILLOW TEAPLATE 17CM,"Churchill Blue Willow Dinner Plates 10"", Set of 4",https://www.efghousewares.co.uk/willow-17cm-teaplate,https://www.amazon.co.uk/dp/B0007OV79C,,Available (see Keepa data),,1,4.368,3.64,53.15,7.97,4.87,0.55,8.858333333,3.406,27.81166667,-3.406,27.26166667,650.636436,20.436,61.55032926
5.03048E+12,7.4196E+11,B08XX11X5N,GLEAMAX BROOM AND HANDLE SILVER,"304 Ink Cartridge Remanufactured for HP 304 Black Ink Cartridge, 304XL Black for Envy 5020 5010 5030 5032 5000, DeskJet 3720 2600 2633 2632, 3733 2634 3760, 3750 3735 3762, 2630 2620 2622 (2-Pack)",https://www.efghousewares.co.uk/gleamax-broom-and-handle-silver,https://www.amazon.co.uk/dp/B08XX11X5N,100,Available (see Keepa data),,1,1.5,1.25,23.73,3.56,2.77,0.55,3.955,1.626,12.195,-1.626,11.645,646.9444444,9.756,58.8874842
8.71125E+12,,B0CL5YG3TW,DUNLOP BICYCLE MINI PUMP,"Electric Bike Pump, 150Psi Portable Bicycle Tire Pump with Digital Pressure Gauge for E-Bike, Road and Mountain Bicycle Pump, Mini Bike Pump with Presta, Schrader, Dunlop Valve Accessories",https://www.efghousewares.co.uk/dunlop-bicycle-mini-pump-110948,https://www.amazon.co.uk/dp/B0CL5YG3TW,900,Available (see Keepa data),,1,2.484,2.07,29.99,2.4,3.23,0.55,4.998333333,1.65,17.29166667,-1.65,16.74166667,638.9949109,9.9,66.98899633
5.05628E+12,,B0773HXND3,SEW YOUR OWN GONK KIT,DONYER POWER Convector Radiator Heater 2000W Room Heating with Adjustable Thermostat,https://www.efghousewares.co.uk/sew-your-own-gonk-kit-106153,https://www.amazon.co.uk/dp/B0773HXND3,500,,,3,1.476,1.23,27.49,4.12,5.66,0.55,4.581666667,2.312,11.89833333,-2.312,11.34833333,637.5468165,13.872,49.53801382
7.42289E+11,5.70663E+12,B0DTHZVF5T,P SHAPE WHITE PIZZA PLATE 31.5CM,"Eva Trio | Legio Nova Pizza Plate 31.5 cm | Flat, but with a slightly raised rim for easier pizza cutting | White",https://www.efghousewares.co.uk/p-shape-white-pizza-plate-31-5cm-114929,https://www.amazon.co.uk/dp/B0DTHZVF5T,,,Available (see Keepa data),1,2.892,2.41,39.29,7.59,3.36,0.55,6.548333333,2.782,19.38166667,-2.782,18.83166667,636.204955,16.692,57.51590736
5.03048E+12,,B0BPY7K5DF,PPS COCKTAIL GLASS CLEAR STEM 190ML 4 PIECES,"Set of 4 Rose with Stem Cocktail Glass, 175 ml Flower Red Wine Glass, Crystal Clear Rose Goblet Glasses, Champagne Flutes Drinkware for Mother's Day Gift, Wedding, Party, Dinner, Birthday",https://www.efghousewares.co.uk/pps-cocktail-glass-clear-stem-190ml-4-pieces-123573,https://www.amazon.co.uk/dp/B0BPY7K5DF,,Available (see Keepa data),,1,0.744,0.62,19.69,2.95,4.87,0.55,3.281666667,1.798,7.968333333,-1.798,7.418333333,634.045584,10.788,45.21076689
5.02618E+12,7.1771E+11,B0FGHZB8FM,APOLLO WOOD NAIL BRUSH PK24,"Oversize Turbo Dryer Blower,Car Accessories,Max Instantaneous Thrust 1.60KG,4 Speeds,64MM Super Big Electric Cordless Air Blower for Leaf,Patio Cleaning,Lawn Care & Car Drying (Shining Black)",https://www.efghousewares.co.uk/apollo-wood-nail-brush-pk24-4-2-23,https://www.amazon.co.uk/dp/B0FGHZB8FM,50,Available (see Keepa data),,1,13.236,11.03,129,19.35,3.44,0.55,21.5,6.874,73.68,-6.874,73.13,631.5198618,41.244,68.02790698
5.02959E+12,,B09M9XKPFW,ROLSON  HOLLOW PUNCH 9PCE SET,"BBDINO Super Elastic Silicone Mould Making Kit, 2000g Jade Green, Liquid Silicone 1:1 Mixing, Ideal for Making Moulds of Resins, Plaster, Wax etc.",https://www.efghousewares.co.uk/rolson-hollow-punch-9pce-set-108553,https://www.amazon.co.uk/dp/B09M9XKPFW,100,,,,3.36,2.8,37.98,4.7475,2.41,0.55,6.33,2.1015,21.6925,-2.1015,21.1425,631.119403,12.609,66.80094787
9.33353E+12,,B0DNCY21RY,FESTIVE MAGIC TEALIGHT 2PCE FLICKER,65W 4.5 * 3.0mm Laptop Charger Blue Tip Compatible with HP EliteBook 840 850 845 830 820 G8 G7 G6 G5 G4 G3 ProBook 640 650 450 430 440 446 455 470 745 735 725 755 Pavilion Stream Envy X360 Adapter,https://www.efghousewares.co.uk/festive-magic-tealight-2pce-flicker-20570,https://www.amazon.co.uk/dp/B0DNCY21RY,,,,,0.804,0.67,15.99,1.99875,2.41,0.55,2.665,1.12575,8.24625,-1.12575,7.69625,630.8401639,6.7545,57.75797373
,,B0FCG3BC2H,FESTIVE MAGIC HANGING DEC SLIEGH,"Christmas Teddy Bear Sleigh Ornament Enameled Festive Decoration, Red Ribbon Hanging, Holiday Tree Decor Gift",https://www.efghousewares.co.uk/festive-magic-hanging-dec-sliegh-122995,https://www.amazon.co.uk/dp/B0FCG3BC2H,,Available (see Keepa data),Available (see Keepa data),2,0.744,0.62,16.99,2.55,3.09,0.55,2.831666667,1.362,7.898333333,-1.362,7.348333333,628.0626781,8.172,51.9011183
4.89416E+12,,B08MQ4P879,FESTIVE MAGIC BOW red flock,YunSCM 2Pcs Self-Sealing 20 inch Fat Bike Inner Tubes AV32mm Schrader Valve Automatic Repair Puncture Resistant Tube Compatible Fat Bicycle Tyre Inner Tube,https://www.efghousewares.co.uk/festive-magic-bow-red-flock-102294,https://www.amazon.co.uk/dp/B08MQ4P879,,,,,1.272,1.06,19.89,2.48625,2.41,0.55,3.315,1.30125,10.61875,-1.30125,10.06875,625.3881988,7.8075,60.74660633
5.03048E+12,7.58227E+11,B0CPHZVKQ2,PPS FOIL PIE 6 DISHES RECTANGULAR,"LEXININ 100 Pack 6 Inch Round Aluminium Foil Pie Trays, 500ml Foil Flan Cases Dishes with Lids for Baking Cooking Roasting",https://www.efghousewares.co.uk/pps-foil-pie-6-dishes-rectangular,https://www.amazon.co.uk/dp/B0CPHZVKQ2,,,,1,0.672,0.56,16.99,2.55,3.58,0.55,2.831666667,1.448,7.468333333,-1.448,6.918333333,623.2732733,8.688,48.86403767
5.05384E+12,,B0FQNMBKD4,PREMIER LANTERN 24CM WITH STRING LIGHTS,"3-Player Whack Game Toy Mole with Lights & Sounds, 3Modes&7Speed Levels, LED Scoreboard, Interactive Hammer Toy, Educational Pounding Game for Kids Ages 3-10, Gifts for Boys & Girls",https://www.efghousewares.co.uk/premier-lantern-24cm-with-string-lights-91670,https://www.amazon.co.uk/dp/B0FQNMBKD4,,Available (see Keepa data),,1,3.96,3.3,45.99,6.9,3.58,0.55,7.665,2.866,24.545,-2.866,23.995,623.2467532,17.196,62.60926288
4.89416E+12,,B0CMP9M725,FESTIVE MAGIC GINGERBREAD RIBBON 63MM X 2.7M,"TOSY Flying Ring - 12 monocolor LEDs, Super Bright, Lost Mode, Auto Light Up, Christmas Stocking Stuffers Gift for Kid/Teen/Boy/Girl, Safe, Waterproof, Pool/Beach/Camping Toy (Blue)",https://www.efghousewares.co.uk/festive-magic-gingerbread-ribbon-63mm-x-2-7m-123025,https://www.amazon.co.uk/dp/B0CMP9M725,,,,,0.876,0.73,16.41,2.05125,2.41,0.55,2.735,1.14825,8.48375,-1.14825,7.93375,619.8242188,6.8895,58.01645338
1.04044E+12,,B0FD9QXN2Q,DURACELL HEARING AID BATTERIES 6PCE ZA312,Strongthium Predator 212 Tune Up Parts Carb Kit for 196cc 200cc 212cc 224cc + Pull Start + Coil + Air Filter Assembly + Spark Plug + Throttle Springs + Gaskets,https://www.efghousewares.co.uk/duracell-hearing-aid-batteries-6pce-za312-111026,https://www.amazon.co.uk/dp/B0FD9QXN2Q,,Available (see Keepa data),,1,2.664,2.22,33.99,5.1,3.34,0.55,5.665,2.242,17.665,-2.242,17.115,617.8700361,13.452,60.42365402
5.06002E+12,,B0FD9QXN2Q,BOND IT MITRE KIT CLAM PACK 200ML+50G,Strongthium Predator 212 Tune Up Parts Carb Kit for 196cc 200cc 212cc 224cc + Pull Start + Coil + Air Filter Assembly + Spark Plug + Throttle Springs + Gaskets,https://www.efghousewares.co.uk/bond-it-mitre-kit-clam-pack-200ml-50g,https://www.amazon.co.uk/dp/B0FD9QXN2Q,,Available (see Keepa data),,1,2.676,2.23,33.99,5.1,3.34,0.55,5.665,2.244,17.655,-2.244,17.105,615.2877698,13.464,60.38834951
5.01035E+12,,B0DY5VTRDH,MINKY SPONGE MOP WITH HANDLE,OLEVS Men Watch Chronograph Stainless Steel Quartz Business Dress Luminous Waterproof Multi-Function Men Wrist Watch,https://www.efghousewares.co.uk/minky-sponge-mop-with-handle,https://www.amazon.co.uk/dp/B0DY5VTRDH,100,Available (see Keepa data),,1,3.828,3.19,43,6.45,2.77,0.55,7.166666667,2.592,23.42333333,-2.592,22.87333333,611.5864528,15.552,63.83255814
5.01213E+12,,B09RG376NY,GIFTMAKER FESTIVE CRAFT ACTIVITY PACK,"TOPDON AL400-A OBD2 Code Reader, 10 OBD2 Functions, Check Engine Light/Smog Emission Test / O2 Sensor Test/EVAP, Free Lifetime Update",https://www.efghousewares.co.uk/giftmaker-festive-craft-activity-pack-115433,https://www.amazon.co.uk/dp/B09RG376NY,100,,,,2.28,1.9,27.99,3.49875,2.41,0.55,4.665,1.67175,15.51625,-1.67175,14.96625,610.8673469,10.0305,64.16398714
5.01593E+12,,B0DRFJ1LDG,CHRISTMAS REINDEER PLUSH 25CM,"Mould King V8 Engine Building Blocks Set, 10206 Engine Model That Runs, Sports Car Engines Kit for Adults with Battery Box and Motor, Construction STEM Toy for Teens (737 Pcs)",https://www.efghousewares.co.uk/christmas-reindeer-plush-25cm-123377,https://www.amazon.co.uk/dp/B0DRFJ1LDG,,,,,3.96,3.3,41.99,5.24875,2.41,0.55,6.998333333,2.30175,24.03291667,-2.30175,23.48291667,609.9458874,13.8105,67.1100262
5.0508E+12,4.0546E+12,B09LTDXR1W,BRIGHT & HOMELY MASKING TAPE 24MMx15M PACK OF 3,"ScotchBlue Multi-Surface Premium Masking Tape, Pack of 3, 48 mm x 41 m, Scotch Adhesive Blue Painters Tape, For Painting and Decorating, Indoor & Outdoor, Sticks Well, 70% PEFC",https://www.efghousewares.co.uk/bright-homely-masking-tape-24mmx15m-pack-of-3-122425,https://www.amazon.co.uk/dp/B09LTDXR1W,200,Available (see Keepa data),Available (see Keepa data),5,0.804,0.67,16.71,2.17,3.12,0.55,2.785,1.302,7.965,-1.302,7.415,607.7868852,7.812,53.24955117
5.01187E+12,,B0DFCG7G7Q,HAMMERITE RADIATOR ENAMEL SATIN WHITE 500ML,"Mould King City Aircraft Engine Building Kit, Turbojet Engine Model That Runs, Mini Engine Build Kit for Adults with Battery, Mechanical Science Education STEM Toy(2256 PCS)",https://www.efghousewares.co.uk/hammerite-radiator-enamel-satin-white-500ml,https://www.amazon.co.uk/dp/B0DFCG7G7Q,,,,,10.464,8.72,95.99,11.99875,2.41,0.55,15.99833333,4.73575,56.86291667,-4.73575,56.31291667,607.4748292,28.4145,70.39847901
5.0174E+12,6.58556E+11,B09QLJ7FSP,PRO USER SANDER PAD SET,"Crafty Products 2 x Replacement Hook Pads for Detail Sanders, with 3mm Foam Backing, Self Adhesive",https://www.efghousewares.co.uk/pro-user-sander-pad-set,https://www.amazon.co.uk/dp/B09QLJ7FSP,,Available (see Keepa data),Available (see Keepa data),2,0.936,0.78,15.99,2.08,1.87,0.55,2.665,1.056,8.595,-1.056,8.045,604.887218,6.336,60.37523452
8.69512E+12,,B0F837GVR7,TOILET BRUSH & HOLDER TITIZ,"Shower Stool for Inside Shower, Upgrade Swivel Stool Shower Chair for Elderly Seniors Adult Disabled, 360Â° Swivel Shower Seat for Bathroom 6-Level Adjustable Height Bath Chair Shelf",https://www.efghousewares.co.uk/toilet-brush-holder-titiz,https://www.amazon.co.uk/dp/B0F837GVR7,,,,1,3.432,2.86,42.99,6.45,5.39,0.55,7.165,3.05,21.125,-3.05,20.575,603.372434,18.3,57.43196092
5.05544E+12,5.0579E+12,B0DPR7Q4P5,DEKTON HANDLE MANHOLE KEY 2PC SET,"ROUGHNECKÂ® Universal Manhole Key Set, 13 Pieces: 2 Handles, 11 Keys (6 Types) and Carry Case",https://www.efghousewares.co.uk/dekton-handle-manhole-key-2pc-set-121202,https://www.amazon.co.uk/dp/B0DPR7Q4P5,100,,Available (see Keepa data),9,5.556,4.63,59.38,8.29,5.12,0.55,9.896666667,3.718,31.44333333,-3.718,30.89333333,596.3963964,22.308,62.43179522
5.01111E+12,5.03806E+12,B096Y9XNLF,CHURCHILL WILLOW OATMEAL BOWL 15.5CM,"Russell Hobbs Good-to-Go 6.5L Electric Multicooker - 8 Digital functions inc Sear, Slow Cook, Steam, Boil, Keep warm & Roast, Cast aluminium housing, Glass lid, Dishwasher safe parts, 750W, 28270",https://www.efghousewares.co.uk/willow-oatmeal,https://www.amazon.co.uk/dp/B096Y9XNLF,,Available (see Keepa data),Available (see Keepa data),11,4.368,3.64,51.99,7.8,6.35,0.55,8.665,3.668,25.535,-3.668,24.985,596.300716,22.008,57.66878246
6.92346E+12,5.01204E+12,B01AZRV218,ADORN SHOWER SET & 1.5M HOSE,"Croydex Shower Head and Hose Mixer Set with Riser Rail - 1.5m Shower Hose and Handset with Rub Clean Nozzles, Easy Install Wall Mounted Rail for Bathrooms - Ideal Hot & Cold Water Mixer (Chrome)",https://www.efghousewares.co.uk/adorn-shower-set-1-5m-hose,https://www.amazon.co.uk/dp/B01AZRV218,,Available (see Keepa data),Available (see Keepa data),9,2.58,2.15,32.32,4.01,4.15,0.55,5.386666667,2.172,16.62333333,-2.172,16.07333333,595.308642,13.032,59.67821782
6.26035E+12,7.18932E+11,B0CWV5LSTC,SHAKILA SOUP PLATE,"fMBB Ceramic Soup Bowls, 4 Pack White Dinner Plates, Porcelain, Classic Style, 8.5 Inch Shallow Bowls - Ideal for Soup, Dessert, Salad and Pasta, Microwave and Dishwasher Safe",https://www.efghousewares.co.uk/shakila-soup-plate-123998,https://www.amazon.co.uk/dp/B0CWV5LSTC,,,Available (see Keepa data),1,1.728,1.44,28.76,6.58,3.58,0.55,4.793333333,2.43,12.36666667,-2.43,11.81666667,593.8023451,14.58,49.30458971
5.02618E+12,4.18985E+12,B0DC9M4N97,APOLLO SHOWER CURTAIN PEVA WAVE,"Bathroom Curtains Shower 170 x 230 cm(67 x 91inch) Weighted Hem, Quick-Drying, Customizable, Bpa Free, with Hooks Bath Curtains Waterproof Peva Bath Curtains, Gray Waves",https://www.efghousewares.co.uk/apollo-shower-curtain-peva-wave,https://www.amazon.co.uk/dp/B0DC9M4N97,,,Available (see Keepa data),1,3.096,2.58,33.99,4.24875,2.41,0.55,5.665,1.95775,19.08625,-1.95775,18.53625,592.2124601,11.7465,65.44130627
7.42289E+11,,B0CFQ7WGBX,PORCELAIN MUG 12OZ WHITE,"Hoikwo 12oz / 380ml Coffee Mugs Set of 6, White Bone China Mugs with Relief Pattern for Coffee, Tea, Latte, Milk, Cocoa, Juice and Other Hot Drinks",https://www.efghousewares.co.uk/porcelain-mug-12oz-white-123968,https://www.amazon.co.uk/dp/B0CFQ7WGBX,,Available (see Keepa data),,1,0.672,0.56,20.24,4.05,5.15,0.55,3.373333333,2.062,7.106666667,-2.062,6.556666667,590.6906907,12.372,38.87351779
