,EAN_str,SupplierTitle,AmazonTitle,NetProfit,bought_in_past_month,SupplierPrice_incVAT
1177,5059001500861,AIRWICK REED DIFFUSER MULLED WINE 33ML PK5,"Air Wick Essential Oils Reed Diffuser Air Freshener Mulled Wine Scent, 5 Bottles X 30 ml",16.5533333333333,200,13.4279999999999
690,5050028016069,EVERREADY T8 4FT 36W TUBE LIGHT,Eveready T8 Tube 4ft 36w White 3500k,8.00124999999999,50,2.988
1690,5010853235530,MASON CASH MIXING BOWL CREAM 29CM,"Mason Cash Colour Mix Cream Mixing Bowl | 4 Litre Capacity | 29cm Earthenware Bowl with Classic Pattern Design | Lightweight & Dishwasher Safe | Ideal for Baking, Pastry, Dough, Cakes & Cookies",5.11499999999999,200,7.656
676,5060357991357,PHOODS FOIL TRAY ROASTER,"Superior Sandwich Platter Trays - Pack of 10 Catering Trays for Parties - Buffet Serving Tray with Spill Proof Lids - Catering Platters for Cakes, Parties & Events, Meal Prep Large Tray",3.905,50,1.08
929,5053249248356,PAN AROMA JAR CANDLE 85GM SALTED CARAMEL,"Pan Aroma Orange Decorative Holder & Scented Candle, Salted Caramel, 85G",2.725,50,1.08
1312,5032759031078,AMTECH LED MINI TORCH,Amtech S1532 9 LED mini Torch,2.34833333333333,200,1.716
1850,5060357990107,SUPERIOR FOIL 10 CONTAINERS & LID 9X9IN,"Superior 10-Pack Aluminium Foil Trays with Paper Lids, Heavy Duty Aluminium Takeaway Containers, Freezer & Oven Safe Tin Foil Trays For Baking, Cooking, Broiling, Storage Containers, 9 x 9 inch",2.12833333333333,700,3.65999999999999
455,5053249253183,ELBOW GREASE TOILET CLEANER FOAM LEMON FRESH 500G,"3 x Elbow Grease Foaming Toilet Cleaner, Deep Cleaning Action, Lemon Fresh Fragrance 500g",2.09333333333333,200,0.0
1334,5053249248295,PAN AROMA JAR CANDLE 85GM RED BERRY,"PAN AROMA® RED Decorative Holder & Scented Candle, RED Berry, 85g",1.67166666666666,50,1.08
1067,5014749165598,BEAUTY VELCRO HAIR GRIP ROLLERS 7 PACK,42 pcs x 15mm Small Self Grip Hair Rollers Salon Hairdressing Curlers - By Beauty Care,1.595,200,0.54
1421,5053249228174,PAN AROMA C TEA-LIGHTS 16PK APP&CIN,Pan Aroma 16 Tea Lights Apple & Cinnamon,1.515,100,1.08
1978,5053249215044,151 ADHESIVE SPRAY HEAVY DUTY 500ML,3 Spray Glue Adhesive Contact Glue Heavy Duty Mount DIY Craft Upholstery 500ml,1.41833333333333,200,3.024
2377,5010792542676,CHRISTMAS LAPTRAY  ROBINS,Cushioned Lap Tray - Christmas Robins Design,1.40458333333333,50,9.204
2358,5010792542737,GEL  LED CANDLE FESTIVE ROBIN,Macneil Christmas Robin LED Gel Candle,1.29583333333333,50,7.728
2319,5010792749549,HIGHLAND COW PLAQUE FRIENDS,Lesser & Pavey Love & Affection Highland Cow Wooden Plaque - Friends For Home Decor & Gift | Wooden and Acrylic Plaques For Home and Office | Ideal Signs & Plaque Birthday Gifts For Women & Men,1.24166666666666,400,6.588
1828,5056175901166,CRAFT FABRIC GLUE 50ML,"SOL 2pk x 50ml Fabric Glue Strong with Spreader & Tape Measure - Scout Badge Adhesive for Crafts, Upholstery, Material, Textile, Felt or Wool - Waterproof, Flexible, Fast Drying, Durable Bond",0.855,300,1.008
2310,5039295201040,HOUSE MATE STAINLESS STEEL CLEANER & POLISH,House Mate Stainless Steel Cleaner and Polisher 400ml (Pack of 1),0.791666666666665,50,3.888
2194,5015302202996,SAMS SCRUMMY GIANT LEG DOG BONE,Dog Bone Giant Roasted Beef Leg Dog Food Dog Feeding Chew Treats Pack Of 2,0.776666666666667,50,2.616
2195,26102251102,CARAFE .5LT GLASS,"Arcoroc ARC C0199 Carafon Vin Carafe, Glass, transparent, 580 ml",0.761666666666667,50,2.556
2391,5019200117338,PRODEC CAULKER 12 INCH,"ProDec 12"" Flexible Caulker Blade for Fast, Efficient Application of Fillers and Caulk and Smoothing of Wallpaper",0.684999999999999,50,4.572
2448,5038135108600,WHAM CRYSTAL 32LTR CLEAR UNDERBED BOX&LID,"Wham Clear Plastic Storage Box Boxes With Lids Home Office Stackable Nestable, 32L Underbed, Set of 3",0.548333333333334,50,4.572
2261,5015302472535,ROYLE HOME SPRINGFORM CAKE TIN,"Royle Kids 2 Mini Springform Cake Tin Kids Round 5Inch Non Stick Springform Baking Tin 12cm,Black",0.516666666666666,100,1.944
2328,5053249215105,151 PAINT SPRAY 400ML WHITE MATT,3 x 400ml 151 Multi Purpose Spray Paint Aerosol Wood Metal Brick - Matt White,0.506666666666666,500,2.352
2096,5026180033572,APOLLO VINEGAR SHAKER,"apollo THE HOUSEWARES BRAND 3357 Glass Vinegar Shaker, Clear 15 x 5.5 x 5.5 cm",0.463333333333332,50,0.936
2429,5060187173633,MIRROR BLUE CANYON SQUARE PLASTIC MIRROR,Blue Canyon - 18cm Free Standing Square Mirror - White Colour - Perfect for Shaving and Applying Makeup - One Side with 2x Magnification - Double Sided Multipurpose Mirror - BA2046,0.434999999999999,100,3.096
2225,5030481940088,PPS ROUND 40 DOYLEYS 21CM,"40 X White Round LACE DOYLEYS - 22cm/8.5"" Quality Disposable Paper mats Great for Entertaining and Parties",0.296666666666666,700,0.672
2422,5013159300353,ELLIOTT WINDOW SQUEEGE 20CM,"Elliott Multi-Purpose Window Squeegee perfect for streak free cleaning on Windows, shower screens, cars and mirrors, Aluminium frame housing a 20cm rubber squeegee with an ergonomic Grey Handle.",0.293333333333333,200,1.836
2351,5053249215341,151 SILICONE LUBRICANT SPRAY 200ML,"Silicone Lubricant Spray - 3 Pack, 200ml Each, Eliminates Squeaking & Sticking, Protects Against Cracking & Hardening",0.283333333333333,500,1.14
2469,5036200121479,THE BIG CHEESE QUICK CLICK MOUSE TRAP 2PK,"The Big Cheese Quick Click Mouse Trap - Twinpack, Kills Mice, Baited and Ready-To-Use, Easy Clean and Disposal, Plastic, Indoor and Outdoor Use, White",0.271666666666667,50,2.22
2274,5012904061204,TALA COCKTAIL STICKS 200,"Tala Bamboo Cocktail Sticks, Ponted End Cocktails Sticks Perfect for Buffets, Canapes and Appetisers, Pack Off 200 Stick Each Measuring 8cm, Can Also be Used a dential/toothpicks",0.251666666666667,50,0.672
2515,5013159004428,ELLIOTTS GLASS SPRAY BOTTLE BROWN480ML,"Elliott 480ml Brown Glass Spray Bottle, Manufactured from Recycled Glass and featuring a locking trigger action spray Mechanism, Ideal for use for Cleaning, Watering Plants and many other uses",0.218333333333333,100,2.436
2577,5060187175750,BLUE CANYON VECTOR SHOWER SPRAY,Blue Canyon Vector Double Tap Shower Spray| Bathroom Accessory| Premium Shower Attachment for Bath taps| Push-on-Fitting| Suitable for Round & Oval Taps| Shower Head for Bathroom| ~1.5 Meters| (White),0.198333333333333,500,4.296
2493,5056239413680,SIMMER RING,Simmer Ring Pan Mat Heat Diffuser For Gas Electric Cookers Stove Hob 21cm,0.154999999999999,100,1.14
2615,5010853203508,MASON CASH CERAMIC RECT DISH 16cm,"Mason Cash 2001.542 Collection Fine Stoneware Square Roasting Baking and Serving Dish, Ceramic, White, 16 x 16 x 4.5 cm",0.101666666666666,50,3.65999999999999
2598,5012904004188,CHEF AID STRAINER DIAMETER 18CM,"Chef Aid 18cm Long Handled Metal Sieve, Kitchen Essential Tool and Ideal for Straining, draining, Washing and Wide Range of Foods, with a fine mesh for Ease of use",0.0833333333333337,200,1.944
2643,5055361761119,MEMORIAL WATERPROOF GRAVESIDE LANTERN WITH ROBIN SOMEONE SPECIAL,Waterproof Robin Memorial Graveside Lantern with LED Candle (Someone Special),0.0783333333333329,50,6.948
2589,5056175904327,TREAT AND EASE EYE MIST SPRAY,Eye Mist Eyelid Spray for Refreshing Soothing Relief Dry Tired Irritated Itch Sore Eyes 15ml,0.061666666666667,100,1.008
2593,5056239417244,RYSONS KITCHEN FRIDGE/FREEZER THERMOMETER,RYSON 2 Pack Fridge & Freezer Thermometer Kitchen Tool REFRIGERATORS Temperature Coloured,0.0583333333333332,50,1.008
2638,5012904148738,CHEF AID SHOT GLASSES ASSORTED 20PCE,"Chef Aid Multi-Coloured Plastic Shot Glasses, Pack of 20 Reusable 30ml Party Cups, Bright, Colourful Drinking Glasses for Shots, Cocktails and Celebrations",0.0300000000000009,600,1.752
2636,5022704000013,FIRE UP NATURAL FIRELIGHTERS 28 PACK,"Fireglow Firelighters 24 Pack, White",0.0216666666666669,100,0.912
2654,8711252100531,GLASS WHISKEY DECANTER,alpina Whiskey Decanter and Caraf,0.0183333333333328,200,2.352
