EAN,EAN_OnPage,ASIN,SupplierTitle,AmazonTitle,SupplierURL,AmazonURL,bought_in_past_month,fba_seller_count,fbm_seller_count,total_offer_count,SupplierPrice_incVAT,SupplierPrice_exVAT,SellingPrice_incVAT,ReferralFee,FBAFee,PrepHouseFee,OutputVAT,InputVAT,NetProceeds,HMRC,NetProfit,ROI,Breakeven,ProfitMargin
05012251886727,,B0CT5TK1PR,BF DAILY MOISTURISER CREAM BRIGHTENING VITAMIN C 100ML PK12,"Beauty Formulas Vitamin C Moisturiser Cream for Face, Neck - Brightening Hydrating Face Cream with Vitamin C, E, B for Women, Daily Skin Care Moisturiser All Skin Types 100 ml, 3 pack+Cheeroo Magnet",https://www.efghousewares.co.uk/bf-vitanim-c-daily-moisturiser-100ml-pk12,https://www.amazon.co.uk/dp/B0CT5TK1PR,,Available (see Keepa data),Available (see Keepa data),3.0,12.084,10.07,8.86,0.71,2.65,0.55,1.4766666666666666,2.7959999999999994,-6.046666666666667,-2.7959999999999994,-6.596666666666667,-62.11550533584431,16.776000000000003,-89.34537246049662
8801051218657,,B0F7XYFTJT,REACH MICROBIOME TOOTHPASTE 120G WHITENING PK12,"9.9% Hydroxyapatite Toothpaste 2 Pack, Fluoride-Free Nano Hydroxyapatite Toothpaste, Helps Remineralize, Protects Enamel, Relieves Sensitivity, Strengthens Teeth, Whitening, for Adult, Kids Oral Care",https://www.efghousewares.co.uk/reach-microbiome-toothpaste-120g-whitening-pk12-120445,https://www.amazon.co.uk/dp/B0F7XYFTJT,600.0,Available (see Keepa data),,1.0,12.084,10.07,8.49,0.68,2.42,0.55,1.415,2.7439999999999993,-6.095,-2.7439999999999993,-6.645,-62.57062146892655,16.464,-93.92226148409894
08710447195215,8720181335389,B0BWFSBLYB,SURE APA INVISIBLE ANTI-BACTERIAL MENS 250ML PK6,Sure Men Invisible Ice Fresh Antiperspirant Aerosol deodorant that protects against white marks and yellow stains for 48-hour sweat and odour protection 6x 200 ml,https://www.efghousewares.co.uk/sure-apa-invisible-anti-bacterial-mens-250ml-pk6-114392,https://www.amazon.co.uk/dp/B0BWFSBLYB,,,Available (see Keepa data),11.0,14.1,11.75,11.4,1.71,3.24,0.55,1.9000000000000004,3.4499999999999997,-7.2,-3.4499999999999997,-7.75,-63.008130081300806,20.700000000000003,-81.57894736842105
08717644332160,8720181335389,B0BWFSBLYB,SURE APA INVISIBLE ICE FRESH MENS 250ML PK6,Sure Men Invisible Ice Fresh Antiperspirant Aerosol deodorant that protects against white marks and yellow stains for 48-hour sweat and odour protection 6x 200 ml,https://www.efghousewares.co.uk/sure-apa-250ml-invisible-ice-fresh-mens-pk6,https://www.amazon.co.uk/dp/B0BWFSBLYB,,,Available (see Keepa data),11.0,14.1,11.75,11.4,1.71,3.24,0.55,1.9000000000000004,3.4499999999999997,-7.2,-3.4499999999999997,-7.75,-63.008130081300806,20.700000000000003,-81.57894736842105
5031413946413,3337875684118,B07W8H2X23,FACE FACTS SPA BODY CLEANSER SALICYLIC ACID PACK OF 12,"CeraVe SA Smoothing Cleanser with Salicylic Acid for Dry, Rough & Bumpy Skin 236ml",https://www.efghousewares.co.uk/face-facts-spa-body-cleanser-salicylic-acid-pack-of-12-116256,https://www.amazon.co.uk/dp/B07W8H2X23,,,,1.0,22.560000000000002,18.8,14.49,2.17,2.77,0.55,2.414999999999999,4.858000000000001,-11.665,-4.858000000000001,-12.215,-63.126614987080096,29.147999999999996,-101.15942028985508
5012251013314,5012251013314,B08WR4VPZ9,BF WIPES AVOCADO 25S PK12,BEAUTY FORMULAS AVOCADO MAKE UP REMOVER WIPES,https://www.efghousewares.co.uk/bf-wipes-25s-avocado-skin-pk12,https://www.amazon.co.uk/dp/B08WR4VPZ9,,,Available (see Keepa data),2.0,10.739999999999998,8.95,7.84,0.62,2.42,0.55,1.3066666666666666,2.507999999999999,-5.456666666666666,-2.507999999999999,-6.006666666666666,-63.22807017543859,15.047999999999998,-91.93877551020407
29319871000626,7061114414445,B08D8PGPSN,WHITE GLO T/P SMOKERS FORMULA 100ML PK6,White Glo Smokers Formula Whitening Toothpaste Pack 150g (Pack of 2),https://www.efghousewares.co.uk/white-glo-t-p-smokers-formula-100ml-pk6,https://www.amazon.co.uk/dp/B08D8PGPSN,50.0,Available (see Keepa data),Available (see Keepa data),8.0,10.739999999999998,8.95,8.15,0.65,2.65,0.55,1.3583333333333334,2.559999999999999,-5.458333333333332,-2.559999999999999,-6.008333333333332,-63.245614035087705,15.36,-88.46625766871163
5012251013925,3701152109579,B0F325PPJQ,BF BRIGHTENING VITAMIN C EYE GEL 20ML PK12,"Vitamin C & Caffeine Under Eye Gel Patches, Under Eye Patches for Puffy Eyes & Dark Circles, Vitamin C & Caffeine for Brightening & Hydration, Bridesmaid Gift (30 Pairs, 60 Pieces)",https://www.efghousewares.co.uk/bf-brightening-vitamin-c-eye-gel-20ml-pk12-113090,https://www.amazon.co.uk/dp/B0F325PPJQ,300.0,Available (see Keepa data),,1.0,15.443999999999999,12.87,9.99,0.8,2.65,0.55,1.6649999999999991,3.3739999999999997,-7.994999999999997,-3.3739999999999997,-8.544999999999998,-63.67362146050669,20.244,-102.6426426426426
05025416400157,,B0DFR845HL,BMB BEARD OIL 30ML PK12,"Viking Revolution - Beard Oil - All Natural Variety Beard Oil For Men With Argan & Jojoba Oils - Softens, Smooths & Strengthens - Gifts For Men - Sandalwood - 30 ml",https://www.efghousewares.co.uk/bmb-beard-oil-30ml-pk12,https://www.amazon.co.uk/dp/B0DFR845HL,,Available (see Keepa data),,1.0,13.968,11.64,8.99,0.72,2.42,0.55,1.498333333333333,3.0659999999999994,-7.288333333333333,-3.0659999999999994,-7.838333333333333,-64.30133989608969,18.396,-104.62736373748609
9319871000646,,B009F64DH6,WHITE GLO T/P & MOUTHWASH 2IN1 100ML PK6,White Glo - 2in1 Mouthwash Formula Toothpaste 150g,https://www.efghousewares.co.uk/white-glo-t-p-mouthwash-2in1-100ml-pk6,https://www.amazon.co.uk/dp/B009F64DH6,,Available (see Keepa data),Available (see Keepa data),2.0,10.739999999999998,8.95,7.99,0.64,2.65,0.55,1.331666666666666,2.557999999999999,-5.581666666666665,-2.557999999999999,-6.131666666666665,-64.5438596491228,15.348,-92.09011264080097
29319871001616,0787907933678,B0B8ZM3KRP,WHITE GLO T/P INSTANT WHITE PK6,2 x White Glo Instant White Optic Technology Whitening Toothpaste + Toothbrush,https://www.efghousewares.co.uk/white-glo-t-p-instant-white-pk6,https://www.amazon.co.uk/dp/B0B8ZM3KRP,,Available (see Keepa data),Available (see Keepa data),6.0,13.427999999999999,11.19,8.99,0.72,2.65,0.55,1.498333333333333,3.0219999999999994,-7.068333333333332,-3.0219999999999994,-7.618333333333331,-64.89210675752412,18.132,-101.69076751946604
08711600353343,8720181274114,B0CNS2YD5K,SURE ROLL ON SENSITIVE MENS 50ML PK6,"Sure Men Sensitive Roll On Deodorant Antiperspirant with MotionSense technology for 48 hour protection against sweat and odour 50 ml, Pack of 6",https://www.efghousewares.co.uk/sure-roll-on-sensitive-mens-50ml-pk6-109951,https://www.amazon.co.uk/dp/B0CNS2YD5K,,Available (see Keepa data),Available (see Keepa data),9.0,8.052,6.71,7.58,0.64,3.13,0.55,1.2633333333333328,2.2059999999999995,-4.163333333333332,-2.2059999999999995,-4.713333333333332,-64.92194674012855,13.236,-74.61741424802109
08717644319895,8720181274398,B0CNS1MR3F,SURE ROLL ON COTTON WOMEN 50ML PK6,"Sure Cotton Dry Women's Deodorant with a clean fragrance inspired by fresh cotton sheets Anti-Perspirant Roll On and 48 hour sweat and odour protection 50 ml, Pack of 6",https://www.efghousewares.co.uk/sure-roll-on-50ml-cotton-women-pk6,https://www.amazon.co.uk/dp/B0CNS1MR3F,,,Available (see Keepa data),11.0,8.052,6.71,7.58,0.64,3.13,0.55,1.2633333333333328,2.2059999999999995,-4.163333333333332,-2.2059999999999995,-4.713333333333332,-64.92194674012855,13.236,-74.61741424802109
08717644321171,8720181274114,B0CNS2YD5K,SURE ROLL ON QUANTUM MENS 50ML PK6,"Sure Men Sensitive Roll On Deodorant Antiperspirant with MotionSense technology for 48 hour protection against sweat and odour 50 ml, Pack of 6",https://www.efghousewares.co.uk/sure-roll-on-quantum-mens-50ml-pk6-33624,https://www.amazon.co.uk/dp/B0CNS2YD5K,,Available (see Keepa data),Available (see Keepa data),9.0,8.052,6.71,7.58,0.64,3.13,0.55,1.2633333333333328,2.2059999999999995,-4.163333333333332,-2.2059999999999995,-4.713333333333332,-64.92194674012855,13.236,-74.61741424802109
05060120170743,,B0FGTFC2JX,XOC TOOTHPASTE & BRUSH HEMP 100ML PK12,XOC Hemp Toothpaste 100ml + Free Toothbrush – 2 Pack,https://www.efghousewares.co.uk/xoc-hemp-t-paste-t-brush-100ml-pk12-18-12-22,https://www.amazon.co.uk/dp/B0FGTFC2JX,,Available (see Keepa data),,1.0,12.084,10.07,8.45,0.71,2.65,0.55,1.4083333333333332,2.7959999999999994,-6.388333333333334,-2.7959999999999994,-6.9383333333333335,-65.33270558694288,16.776000000000003,-98.53254437869823
6920354836077,0035000511201,B01BNHREXE,COLGATE TOOTHPASTE WHITE TEETH WITH BAKING SODA 75ML PK12,Colgate Baking Soda and Peroxide Whitening Toothpaste - 6 ounce (2 Count),https://www.efghousewares.co.uk/colgate-toothpaste-white-teeth-with-baking-soda-75ml-pk12-109580,https://www.amazon.co.uk/dp/B01BNHREXE,700.0,Available (see Keepa data),Available (see Keepa data),12.0,12.084,10.07,8.02,0.64,2.42,0.55,1.336666666666666,2.7359999999999993,-6.446666666666666,-2.7359999999999993,-6.996666666666666,-65.88198367859384,16.416,-104.68827930174562
05012251886987,,B0F6Y7XLVW,BF FACIAL SERUM MOISTURE HYALURONIC ACID 30ML PK12,"30Pcs 5% Hyaluronic Acid Serum, Ultra Hydrating Serum, Hyaluronic Acid Seru m for Face, Lightweight Essence for Glass Skin, Pre-Makeup Skincare, Plumping & Anti-Aging, Long-Lasting Hydration",https://www.efghousewares.co.uk/bf-facial-serum-moisture-hyaluronic-acid-30ml-pk12-109631,https://www.amazon.co.uk/dp/B0F6Y7XLVW,,Available (see Keepa data),,1.0,17.46,14.55,11.99,1.8,3.09,0.55,1.998333333333333,3.998,-9.448333333333334,-3.998,-9.998333333333335,-66.2141280353201,23.988000000000003,-100.06672226855716
6001067525936,5057271240142,B073V1QRDL,COLGATE TOOTHBRUSH MAX WHITE PK12,Colgate Max White Toothbrushes - Teeth Whitening Toothbrush with Polishing Star - Medium Manual Toothbrush - Assorted Designs - Adult Toothbrush Multipack - 3 Pack,https://www.efghousewares.co.uk/colgate-t-brush-max-white-pk12,https://www.amazon.co.uk/dp/B073V1QRDL,,Available (see Keepa data),Available (see Keepa data),6.0,8.724,7.27,5.95,0.66,1.67,0.55,0.9916666666666663,2.0300000000000007,-4.641666666666666,-2.0300000000000007,-5.1916666666666655,-66.38959931798806,12.18,-104.70588235294113
5054563180179,5054563180179,B0CKLTCT3D,AQUAFRESH TOOTHPASTE ACTIVE WHITE 100ML PK12,Aquafresh Milk Teeth 0-2 Years Toothpaste Bundle with Extra Soft Toothbrush 0-3 Years,https://www.efghousewares.co.uk/aquafresh-toothpaste-active-white-100ml-pk12-109650,https://www.amazon.co.uk/dp/B0CKLTCT3D,,Available (see Keepa data),,2.0,12.084,10.07,7.89,0.63,2.42,0.55,1.3149999999999995,2.733999999999999,-6.545,-2.733999999999999,-7.095,-66.80790960451976,16.404,-107.90874524714829
5012251013932,4005900545701,B07H1YQYP9,BF RESTORING EYE CREAM Q10 20ML PK12,"NIVEA Q10 Anti-Wrinkle Power Firming Eye Cream (15ml), Anti-Wrinkle Skincare for Eliminating Fine Lines and Dark Circles, Nourishing Eye Cream for Softer, Smoother Skin",https://www.efghousewares.co.uk/bf-restoring-eye-cream-q10-20ml-pk12-113089,https://www.amazon.co.uk/dp/B07H1YQYP9,,Available (see Keepa data),Available (see Keepa data),12.0,15.443999999999999,12.87,7.87,0.63,1.5,0.55,1.3116666666666665,3.11,-8.441666666666666,-3.11,-8.991666666666667,-67.0019870839543,18.66,-137.10292249047015
5015934851241,,B0FX3H22LW,ARTIST CASE WATERCOLOUR,"Portable Empty Watercolour Paint Case, Compact Watercolor Box with Folding Palette, Travel Paint Box for Students, Lightweight and Portable Painting Pigment Box for Watercolor Packaging",https://www.efghousewares.co.uk/artist-case-watercolour-120279,https://www.amazon.co.uk/dp/B0FX3H22LW,,Available (see Keepa data),,1.0,4.596,3.83,4.28,0.64,1.5,0.55,0.7133333333333334,1.3040000000000003,-2.4033333333333333,-1.3040000000000003,-2.953333333333333,-67.42770167427702,7.823999999999999,-82.80373831775701
5055566999454,,B07BHLJVN6,WIND UP TRAIN SET,"Junior train Wind Up Train Set, 8 pc",https://www.efghousewares.co.uk/wind-up-train-set-93638,https://www.amazon.co.uk/dp/B07BHLJVN6,,,,,0.876,0.73,3.99,0.49875,2.41,0.55,0.665,0.8377500000000001,-0.3137500000000002,-0.8377500000000001,-0.8637500000000002,-67.48046875000003,5.0264999999999995,-25.97744360902256
3574661604732,3574661604732,B08JL5B792,AVEENO DAILY MOISTURISING BODY LOTION PUMP 500ML EACH,"Aveeno Daily Moisturising Body Lotion, With Soothing Oats & Rich Emollients, Suitable For Sensitive Skin, Nourishes and Protects Normal to Dry Skin, Fragrance Free, 500ml",https://www.efghousewares.co.uk/aveeno-daily-moisturising-body-lotion-pump-500ml-each-124594,https://www.amazon.co.uk/dp/B08JL5B792,,Available (see Keepa data),Available (see Keepa data),34.0,8.724,7.27,6.89,0.61,2.65,0.55,1.1483333333333334,2.2160000000000006,-4.788333333333334,-2.2160000000000006,-5.338333333333334,-68.26513213981245,13.296,-92.97532656023225
08711600454071,8720181085765,B092NGVX8H,DOVE BODY LOTION 400ML INTENSIVE EXTRA PK6,Dove Body Lotion Intensive Care for Very Dry Skin with 3x More Moisture 400 ml Pack of 1,https://www.efghousewares.co.uk/dove-body-lotion-400ml-intensive-extra-pk6,https://www.amazon.co.uk/dp/B092NGVX8H,,Available (see Keepa data),,3.0,18.131999999999998,15.11,9.99,0.73,2.65,0.55,1.6649999999999991,3.8079999999999985,-10.165,-3.8079999999999985,-10.715,-68.42273307790549,22.848,-128.70870870870868
3574660536737,,B00402E942,AVEENO BODY LOTION SKIN RELIEF SHEA 300ML EACH,"Aveeno Skin Relief Moisturising Lotion (1x 300ml) With Soothing Triple Oat Complex & Shea Butter, 72-Hour Intense Hydration, Helps Relieve Dryness and Tightness, Suitable for Sensitive Skin",https://www.efghousewares.co.uk/aveeno-body-lotion-skin-relief-shea-300ml-each-124582,https://www.amazon.co.uk/dp/B00402E942,,Available (see Keepa data),Available (see Keepa data),12.0,7.104,5.92,6.3,0.56,2.65,0.55,1.0499999999999998,1.9360000000000002,-3.8800000000000003,-1.9360000000000002,-4.430000000000001,-68.46986089644514,11.616000000000001,-84.3809523809524
08710908863011,8710908778230,B0D4F6KPQG,DOVE BODY LOTION RESTORING / COCONUT 250ML PK6,Dove Body Love Restoring Care Body Lotion For Dry Skin with Coconut Oil and Almond Milk 400ml – Pack of 2,https://www.efghousewares.co.uk/dove-body-lotion-restoring-/-coconut-250ml-pk6-109108,https://www.amazon.co.uk/dp/B0D4F6KPQG,200.0,Available (see Keepa data),Available (see Keepa data),4.0,13.427999999999999,11.19,9.99,1.5,3.13,0.55,1.6649999999999991,3.2739999999999996,-7.494999999999998,-3.2739999999999996,-8.044999999999998,-68.52640545144803,19.644000000000002,-96.6366366366366
08714789101262,8714789101279,B00C4S0UDS,COLGATE TOOTHPASTE 2 IN 1 ICY BLAST 100ML PK12,Colgate 2 in 1 icy blast whitening toothpaste 100ml - Pack of 4,https://www.efghousewares.co.uk/colgate-toothpaste-2-in-1-icy-blast-100ml-pk12-124756,https://www.amazon.co.uk/dp/B00C4S0UDS,,Available (see Keepa data),Available (see Keepa data),12.0,14.772,12.31,8.55,0.68,2.42,0.55,1.4249999999999998,3.1919999999999997,-8.285,-3.1919999999999997,-8.835,-68.701399688958,19.152,-124.0
05012251881661,4088600216645,B0FL9RSZGR,BF WIPES CUCUMBER 25S PK12,"Facial Wipes with Cucumber Extract and Pro Vitamin B5, 25 Wipes, Cool and Refreshing, All Skin Types, Pack of 2 with crwp card.",https://www.efghousewares.co.uk/bf-wipes-30s-cucumber-pk12-n-a,https://www.amazon.co.uk/dp/B0FL9RSZGR,,Available (see Keepa data),,1.0,10.739999999999998,8.95,7.45,0.6,2.7,0.55,1.2416666666666663,2.559999999999999,-6.041666666666665,-2.559999999999999,-6.591666666666665,-69.38596491228068,15.36,-106.17449664429526
5031413963816,5031413962383,B0FGWPC4CT,FACE FACTS GEL EYE MASKS AWAKENING CAFFEINE PACK OF 12,"Facetacts Awakening Gel Eye Patches, 30 Pairs, Vegan Collagen and Vitamin C, Instant Radiant Revival",https://www.efghousewares.co.uk/face-facts-gel-eye-masks-awakening-caffeine-pack-of-12-125146,https://www.amazon.co.uk/dp/B0FGWPC4CT,,,Available (see Keepa data),1.0,15.443999999999999,12.87,8.95,0.72,2.65,0.55,1.4916666666666663,3.3579999999999997,-8.781666666666666,-3.3579999999999997,-9.331666666666667,-69.53551912568307,20.148,-125.1173184357542
6001067522553,,B00OYAC87K,COLGATE TOOTHBRUSH EXTRA CLEAN MEDIUM PK12,Colgate WTOH22 Extra Clean Toothbrush,https://www.efghousewares.co.uk/colgate-t-brush-extra-clean-pk12,https://www.amazon.co.uk/dp/B00OYAC87K,,Available (see Keepa data),Available (see Keepa data),6.0,5.364,4.47,3.97,0.32,1.46,0.55,0.6616666666666666,1.36,-2.941666666666666,-1.36,-3.4916666666666663,-69.5551128818061,8.16,-105.54156171284632
8901030024023,8886304604821,B0FRSDC93Q,PEARS SOAP PURE & GENTLE BLUE 125G PK12,"Pears Pure & Gentle Transparent Soap Bar 3 Pack (125g Each) – Natural Oils, Mint Extracts & Lemon Flower Extracts",https://www.efghousewares.co.uk/pears-soap-125g-pure-gentle-blue-pk12,https://www.amazon.co.uk/dp/B0FRSDC93Q,600.0,Available (see Keepa data),,1.0,10.739999999999998,8.95,7.99,0.64,3.13,0.55,1.331666666666666,2.653999999999999,-6.061666666666665,-2.653999999999999,-6.611666666666665,-69.59649122807015,15.924,-99.29912390488106
58901314519721,8901314308177,B075WYTKXC,COLGATE TOOTHBRUSH SUPER FLEXIBLE PK12,Colgate Sensitive Toothbrush - Pack of 4 - Ultra Soft bristles take Care of Sensitive Teeth and Gums - India,https://www.efghousewares.co.uk/colgate-toothbrush-super-flexible-pk12-124374,https://www.amazon.co.uk/dp/B075WYTKXC,,Available (see Keepa data),Available (see Keepa data),14.0,5.364,4.47,4.3,0.34,1.73,0.55,0.7166666666666663,1.4180000000000001,-2.956666666666666,-1.4180000000000001,-3.506666666666666,-69.85391766268259,8.508,-97.86046511627904
5031413949148,5031413939101,B0D63J3GXP,FACE FACTS BODY BUTTER SWEET SKIN MARSHMALLOW PK6,Face Facts Body Butter | Kiwi Paradise | 400ml,https://www.efghousewares.co.uk/face-facts-body-butter-sweet-skin-marshmallow-pk6-125177,https://www.amazon.co.uk/dp/B0D63J3GXP,,,Available (see Keepa data),2.0,21.887999999999998,18.24,9.99,0.8,1.87,0.55,1.6649999999999991,4.292,-12.584999999999997,-4.292,-13.134999999999998,-69.90420436402341,25.752,-157.77777777777771
5015934755112,,B0B2F2BTW4,SQUEEZY GOO MARBLE BALLS,SqueeZee Goo Marble Ball (One Supplied),https://www.efghousewares.co.uk/squeezy-goo-marble-balls,https://www.amazon.co.uk/dp/B0B2F2BTW4,,,,,1.008,0.84,3.99,0.49875,2.41,0.55,0.665,0.8597500000000001,-0.4237500000000002,-0.8597500000000001,-0.9737500000000002,-70.05395683453239,5.1585,-29.285714285714292
5015934755150,,B0B2F28WYC,SQUEEZY GOO OCTOPUS,SqueeZee Goo Octo Ball (One Supplied),https://www.efghousewares.co.uk/squeezy-goo-octopus,https://www.amazon.co.uk/dp/B0B2F28WYC,,,,,1.008,0.84,3.99,0.49875,2.41,0.55,0.665,0.8597500000000001,-0.4237500000000002,-0.8597500000000001,-0.9737500000000002,-70.05395683453239,5.1585,-29.285714285714292
3574661646992,3574661646992,B09GNST3CY,AVEENO BODY OIL SKIN RELIEF SPRAY 200ML EACH,"Aveeno Skin Relief Body Oil Spray, With Oat Oil & Jojoba Oil, Suitable For Sensitive Skin, Instantly Nourishes Very Dry, Sensitive Skin, Suitable for a Massage, 200ml",https://www.efghousewares.co.uk/aveeno-body-oil-skin-relief-spray-200ml-each-124602,https://www.amazon.co.uk/dp/B09GNST3CY,,,Available (see Keepa data),9.0,7.380000000000001,6.15,5.93,0.53,2.42,0.55,0.9883333333333333,1.9300000000000006,-4.158333333333334,-1.9300000000000006,-4.708333333333334,-70.27363184079603,11.580000000000002,-95.27824620573358
5012251013949,5061094410828,B0F9PJPPNG,BF VITAMIN C STIMULATING BODY SERUM SPRAY 150ML PACK OF 12,3x 100ml Face Facts Vitamin C Face Mists | Hydrating Vitamin C | Vegan (Pack of 3) – Bundled by Smart Cutie,https://www.efghousewares.co.uk/bf-vitamin-c-stimulating-body-serum-spray-150ml-pack-of-12-118886,https://www.amazon.co.uk/dp/B0F9PJPPNG,,Available (see Keepa data),,1.0,16.788,13.99,8.19,0.66,1.87,0.55,1.3649999999999993,3.414,-9.695,-3.414,-10.245000000000001,-70.46079779917468,20.483999999999998,-150.1098901098901
8886467064354,,B00B4RA04Y,LUX SOAP SOFT TOUCH 80G 3S PK16,"LUX Velvet Touch Beauty Soap Bar - Indulgent Skincare for Face, Hands & Body - Enriched for Smooth, Radiant Skin - Gentle Daily Bath & Shower Soap w/Fresh Fragrance - Men & Women - 80g x 12",https://www.efghousewares.co.uk/lux-soap-soft-touch-80g-3s-pk16-114428,https://www.amazon.co.uk/dp/B00B4RA04Y,500.0,Available (see Keepa data),,1.0,17.184,14.32,9.99,0.8,3.14,0.55,1.6649999999999991,3.762000000000001,-9.934999999999999,-3.762000000000001,-10.485,-70.51109616677874,22.572000000000003,-125.94594594594592
8886467064364,,B00B4RA04Y,LUX SOAP VELVET TOUCH 80G 3S PK16,"LUX Velvet Touch Beauty Soap Bar - Indulgent Skincare for Face, Hands & Body - Enriched for Smooth, Radiant Skin - Gentle Daily Bath & Shower Soap w/Fresh Fragrance - Men & Women - 80g x 12",https://www.efghousewares.co.uk/lux-soap-velvet-touch-80g-3s-pk16-114429,https://www.amazon.co.uk/dp/B00B4RA04Y,500.0,Available (see Keepa data),,1.0,17.184,14.32,9.99,0.8,3.14,0.55,1.6649999999999991,3.762000000000001,-9.934999999999999,-3.762000000000001,-10.485,-70.51109616677874,22.572000000000003,-125.94594594594592
5050837660910,,B09Y32MX24,MAGIC SCRATCH ART,"Vicloon Rainbow Scratch Art, 50Pcs Black Magic Scratch Art Notes Painting Boards Arts and Crafts for Kids with 4 Stencils 5 Wooden Stylus Birthday Gifts DIY Party Gift(8.5 * 8.5CM)",https://www.efghousewares.co.uk/magic-scratch-art-111280,https://www.amazon.co.uk/dp/B09Y32MX24,900.0,Available (see Keepa data),,1.0,3.828,3.19,5.49,0.83,2.65,0.55,0.915,1.444,-2.0949999999999998,-1.444,-2.6449999999999996,-70.72192513368982,8.664,-57.81420765027321
5028763010802,5028763010802,B01KOQR33Q,WISDOM SPINBRUSH JUNIOR PK5,WISDOM SPIN BRUSH JUNIOR 6 YR +,https://www.efghousewares.co.uk/wisdom-spinbrush-junior-pk5,https://www.amazon.co.uk/dp/B01KOQR33Q,,,Available (see Keepa data),1.0,19.476,16.23,9.67,0.77,2.42,0.55,1.6116666666666664,3.993999999999999,-11.361666666666666,-3.993999999999999,-11.911666666666667,-70.98728645212555,23.964000000000002,-147.81799379524304
5012251013642,5012251013642,B0CB11F49J,BF FACIAL SERUM RENEWING AHA + BHA 30ML PK12,Renewing Aha + Bha Serum 30Ml,https://www.efghousewares.co.uk/bf-facial-serum-renewing-aha-bha-30ml-pk12-109644,https://www.amazon.co.uk/dp/B0CB11F49J,,,,2.0,17.46,14.55,8.96,0.72,2.42,0.55,1.4933333333333332,3.648,-10.223333333333333,-3.648,-10.773333333333333,-71.34657836644591,21.888,-144.28571428571425
5012251012027,4008666830227,B0B3RWDZLQ,BF ACTIVE TOOTHPASTE SENSITIVE ENAMEL 100ML PK12,Dr. Wolff's Bioniq Repair Toothpaste Gel | Fluoride Free with Biomimetic Enamel Hydroxyapatite | for Sensitive Teeth | Helps to Repair Enamel Surface 75ml,https://www.efghousewares.co.uk/bf-active-toothpaste-100ml-sens-enamel-pk12,https://www.amazon.co.uk/dp/B0B3RWDZLQ,,,Available (see Keepa data),1.0,11.411999999999999,9.51,6.99,0.56,2.42,0.55,1.165,2.607999999999999,-6.664999999999999,-2.607999999999999,-7.214999999999999,-71.7196819085487,15.648,-123.862660944206
05011417778081,,B083JF3P8N,CLEARASIL FACE WASH SKIN PERFECTING SENSITIVE 150ML PK6,Clearasil Daily Clear Skin Perfecting Gel Wash Sensitive (Pack of 3 x 150 ml),https://www.efghousewares.co.uk/clearasil-face-wash-skin-perfecting-sensitive-150ml-pk6-109110,https://www.amazon.co.uk/dp/B083JF3P8N,200.0,Available (see Keepa data),,15.0,12.084,10.07,7.99,0.64,3.13,0.55,1.331666666666666,2.8779999999999992,-7.181666666666666,-2.8779999999999992,-7.731666666666666,-72.8028876333961,17.268,-116.12015018773462
35033849924776,,B0C2PSTN18,SPACE LIGHT UP BALL PK12,"Tuko 6packs Spiky Bounce Balls 6.5 CM - Sensory Light Up Balls,Squishy Stress Relief Fidget Squeezy Spikey Ball Toy Specially for Kids Party Bag Fillers",https://www.efghousewares.co.uk/space-light-up-ball-pk12-111857,https://www.amazon.co.uk/dp/B0C2PSTN18,100.0,,,,13.704,11.42,7.99,0.99875,2.41,0.55,1.331666666666666,3.0757500000000007,-8.170416666666666,-3.0757500000000007,-8.720416666666667,-72.85226956279588,18.4545,-130.9699624530663
7891024233771,0723905168858,B00I08XZ9M,COLGATE TOOTHPASTE HERBAL 125ML PK12,"Colgate Herbal Toothpaste - Multipack of 4 Pack Toothpaste With Eucalyptus, Myrrh, Camomile and Sage - Bulk Fluoride Tooth Paste Gel For Gum Disease - 100ml",https://www.efghousewares.co.uk/colgate-toothpaste-herbal-125ml-pk12-121454,https://www.amazon.co.uk/dp/B00I08XZ9M,200.0,Available (see Keepa data),Available (see Keepa data),19.0,13.427999999999999,11.19,7.4,0.59,2.42,0.55,1.2333333333333334,2.9499999999999993,-8.033333333333331,-2.9499999999999993,-8.583333333333332,-73.11186825667232,17.7,-139.18918918918916
5060120177292,,B0D7N13SSF,XOC TOOTHPASTE & BRUSH PURPLE 100ML PK12,"XOC Purple Whitening Toothpaste and Bamboo Toothbrush Set - Advanced Enamel-Safe Color Correction Technology for Whitening and Polishing Teeth, Achieve a Brighter, More Confident Smile, Pack of 2",https://www.efghousewares.co.uk/xoc-purple-t/paste-t/brush-100ml-pk12-108903,https://www.amazon.co.uk/dp/B0D7N13SSF,,,Available (see Keepa data),2.0,12.084,10.07,6.99,0.56,2.42,0.55,1.165,2.7199999999999993,-7.225,-2.7199999999999993,-7.7749999999999995,-73.21092278719397,16.32,-133.4763948497854
5015934799376,9781787722217,178772221X,DINO ACTIVITY CASE,Dinosaur Activity Case | Dinosaur Activity Book | Dinosaur Stickers |Dinosaur Toys | Dinosaur Gifts for Boys | Dinosaur Play Sets | Kids Activities (Colour and Carry Activity Kit),https://www.efghousewares.co.uk/dino-activity-case-118440,https://www.amazon.co.uk/dp/178772221X,,Available (see Keepa data),,1.0,4.368,3.64,4.99,0.4,2.65,0.55,0.8316666666666661,1.4480000000000002,-2.531666666666666,-1.4480000000000002,-3.081666666666666,-73.5481304693715,8.687999999999999,-74.1082164328657
5012251013758,,B0CXT9JGTN,BF HYALURONIC ACID EXFOLIATING TONER PADS 30 PADS PACK OF 12,"Glycolic Acid Pads 30%, Exfoliates Surface Skin and Reduces Fine Lines and Wrinkles, 50Pads",https://www.efghousewares.co.uk/bf-hyaluronic-acid-exfoliating-toner-pads-30-pads-pack-of-12-118897,https://www.amazon.co.uk/dp/B0CXT9JGTN,100.0,,,1.0,12.084,10.07,7.21,0.58,2.67,0.55,1.2016666666666662,2.773999999999999,-7.3116666666666665,-2.773999999999999,-7.861666666666666,-74.02699309478969,16.644000000000002,-130.84604715672677
