EAN,EAN_OnPage,ASIN,SupplierTitle,AmazonTitle,SupplierURL,AmazonURL,bought_in_past_month,fba_seller_count,fbm_seller_count,total_offer_count,SupplierPrice_incVAT,SupplierPrice_exVAT,SellingPrice_incVAT,ReferralFee,FBAFee,PrepHouseFee,OutputVAT,InputVAT,NetProceeds,HMRC,NetProfit,ROI,Breakeven,ProfitMargin
5031413943771,5031413930214,B0D45V7N8K,FACE FACTS NIACINAMIDE FACIAL SERUM 30ML PK12,Face Facts Polypeptide Facial Serum | Firm + Renew | 30ml,https://www.efghousewares.co.uk/face-facts-niacinamide-facial-serum-30ml-pk12-124665,https://www.amazon.co.uk/dp/B0D45V7N8K,,,Available (see Keepa data),3.0,14.772,12.31,6.95,0.55,5.32,0.55,1.1583333333333332,3.7459999999999996,-12.388333333333334,-3.7459999999999996,-12.938333333333334,-100.60912389839294,22.476,-223.39568345323744
5012251013468,5012251013468,B09M3S59DC,BF RETINOL ANTI AGEING SHEET MASK PK18,Beauty Formulas Retinol Sheet Mask,https://www.efghousewares.co.uk/bf-retinol-anti-ageing-sheet-mask-pk18-114423,https://www.amazon.co.uk/dp/B09M3S59DC,,Available (see Keepa data),Available (see Keepa data),3.0,16.116,13.43,1.99,0.25,1.5,0.55,0.33166666666666655,3.146,-13.521666666666667,-3.146,-14.071666666666667,-100.655698617072,18.876,-848.5427135678392
5031413930153,5031413930146,B0C1CTR9P4,FACE FACTS FACIAL THE ROUTINE SUPERBERRY SERUM PK12,Face Facts The Routine Superberry Radiance Serum | Illuminate + Nourish | 30ml,https://www.efghousewares.co.uk/face-facts-facial-the-routine-superberry-serum-pk12-116246,https://www.amazon.co.uk/dp/B0C1CTR9P4,,Available (see Keepa data),Available (see Keepa data),8.0,14.772,12.31,2.99,0.25,2.42,0.55,0.4983333333333331,3.106,-12.488333333333333,-3.106,-13.038333333333334,-101.38672887506479,18.636,-523.2775919732441
5054805039852,5054805039852,B0CZS5H9Q1,WRIGHTS SOAP 100G 4PCS  PK6,"Wright's Coal Tar Soap, for everyday skin cleansing, suitable for all skin types. 4 x 100g bars",https://www.efghousewares.co.uk/wrights-soap-125gm-x-4-pk6,https://www.amazon.co.uk/dp/B0CZS5H9Q1,,Available (see Keepa data),Available (see Keepa data),13.0,17.46,14.55,3.2,0.26,2.65,0.55,0.5333333333333332,3.6020000000000003,-14.793333333333333,-3.6020000000000003,-15.343333333333334,-101.61147902869756,21.612000000000002,-575.3749999999999
3574660398410,3574660398410,B00GHNXQXM,CLEAN & CLEAR QUICK CLEAR ADVANTAGE DAILY TREATMENT WASH IN 150ML PK6,CLEAN & CLEAR® Advantage Spot Control Daily Wash 150ml (Packing May Vary),https://www.efghousewares.co.uk/clean-clear-quick-clear-advantage-daily-treatment-wash-in-150ml-pk6-110590,https://www.amazon.co.uk/dp/B00GHNXQXM,600.0,,Available (see Keepa data),2.0,18.528,15.44,3.16,0.27,2.65,0.55,0.5266666666666664,3.781999999999999,-15.726666666666667,-3.781999999999999,-16.276666666666667,-101.79278715864082,22.692,-618.1012658227847
5031413929324,5031413929300,B0BH552Z22,FACE FACTS HYALURONIC FACE & BODY MIST 200ML PK12,"Face Facts Hyaluronic Face Body Mist, with peptides and betaine, lock in moisture and stimulate collagen production; Hydrating, Vegan, 200ml, Pack of 1",https://www.efghousewares.co.uk/face-facts-hyaluronic-face-body-mist-200ml-pk12-124729,https://www.amazon.co.uk/dp/B0BH552Z22,300.0,,Available (see Keepa data),3.0,21.887999999999998,18.24,2.99,0.25,2.65,0.55,0.4983333333333331,4.338,-18.64833333333333,-4.338,-19.19833333333333,-102.17314174206138,26.027999999999995,-770.5016722408025
5031413943030,5031413929300,B0BH552Z22,FACE FACTS MULTIBIOTIC INFINITE GLOW ESSENCE MIST 150ML PK6,"Face Facts Hyaluronic Face Body Mist, with peptides and betaine, lock in moisture and stimulate collagen production; Hydrating, Vegan, 200ml, Pack of 1",https://www.efghousewares.co.uk/face-facts-multibiotic-infinite-glow-essence-mist-150ml-pk6-124710,https://www.amazon.co.uk/dp/B0BH552Z22,300.0,,Available (see Keepa data),3.0,21.492,17.91,2.99,0.25,2.65,0.55,0.4983333333333331,4.272000000000001,-18.31833333333333,-4.272000000000001,-18.868333333333332,-102.2119898880462,25.631999999999998,-757.2575250836119
03574660483536,3574660183375,B004PU6SRU,REACH LISTERINE TOOTHBRUSH ACCESS PK12,"Listerine Duo Reach Interdental Medium Toothbrush - Pack of 2, Multicolor",https://www.efghousewares.co.uk/reach-listerine-toothbrush-access-pk12-114089,https://www.amazon.co.uk/dp/B004PU6SRU,300.0,Available (see Keepa data),Available (see Keepa data),7.0,9.792,8.16,2.95,0.24,2.42,0.55,0.4916666666666667,2.2739999999999996,-8.361666666666666,-2.2739999999999996,-8.911666666666667,-102.31534634519707,13.644,-362.50847457627117
,5031413914436,B0BH54HXJB,FACE FACTS GEL EYE PATCHES BRIGHTENING  PK12,Face Facts Brightening Under-Eye Gel Patches | Moisturises + Brightens | 4 Pairs,https://www.efghousewares.co.uk/face-facts-gel-eye-patches-brightening-pk12-109784,https://www.amazon.co.uk/dp/B0BH54HXJB,,,Available (see Keepa data),2.0,10.739999999999998,8.95,1.99,0.38,1.52,0.55,0.33166666666666655,2.2799999999999994,-9.191666666666666,-2.2799999999999994,-9.741666666666667,-102.54385964912281,13.68,-587.4371859296482
,5031413914436,B0BH54HXJB,FACE FACTS GEL EYE PATCHES TARGET PK12,Face Facts Brightening Under-Eye Gel Patches | Moisturises + Brightens | 4 Pairs,https://www.efghousewares.co.uk/face-facts-gel-eye-patches-target-pk12-109782,https://www.amazon.co.uk/dp/B0BH54HXJB,,,Available (see Keepa data),2.0,10.739999999999998,8.95,1.99,0.38,1.52,0.55,0.33166666666666655,2.2799999999999994,-9.191666666666666,-2.2799999999999994,-9.741666666666667,-102.54385964912281,13.68,-587.4371859296482
3574660658606,3574660658606,B006B6SH3E,CLEAN & CLEAR MORNING ENERGY SKIN ENERGISING DAILY FACIAL SCRUB 150ML PK6,Clean & Clear Morning Energy Skin Energising Daily Facial Scrub 150 ml,https://www.efghousewares.co.uk/clean-clear-morning-energy-skin-energising-daily-facial-scrub-150ml-pk6-106659,https://www.amazon.co.uk/dp/B006B6SH3E,300.0,,Available (see Keepa data),4.0,17.46,14.55,2.98,0.25,2.65,0.55,0.4966666666666666,3.6,-14.966666666666667,-3.6,-15.516666666666667,-102.75938189845475,21.599999999999998,-624.8322147651007
8801051127218,3574660183375,B004PU6SRU,REACH LISTERINE TOOTHBRUSH CONTROL MEDIUM PK12,"Listerine Duo Reach Interdental Medium Toothbrush - Pack of 2, Multicolor",https://www.efghousewares.co.uk/reach-listerine-toothbrush-control-medium-pk12-118960,https://www.amazon.co.uk/dp/B004PU6SRU,300.0,Available (see Keepa data),Available (see Keepa data),7.0,8.052,6.71,2.95,0.28,2.42,0.55,0.4916666666666667,1.9919999999999995,-6.951666666666666,-1.9919999999999995,-7.501666666666666,-103.32874196510559,11.952,-305.1525423728813
05012251886963,5031413919523,B091X3KMZW,BF FACIAL SERUM GLOWING VITAMIN C 30ML PK12,Face Facts Vitamin C Facial Serum | Brightening + Hydrating | 30ml,https://www.efghousewares.co.uk/bf-facial-serum-glowing-vitamin-c-30ml-pk12-114376,https://www.amazon.co.uk/dp/B091X3KMZW,200.0,,Available (see Keepa data),6.0,17.46,14.55,2.49,0.25,2.42,0.55,0.41500000000000004,3.5540000000000003,-15.145,-3.5540000000000003,-15.695,-103.94039735099336,21.323999999999998,-756.3855421686746
05012251886734,5031413919523,B091X3KMZW,BF FACIAL SERUM BRIGHTENING VITAMIN C 30ML PK12,Face Facts Vitamin C Facial Serum | Brightening + Hydrating | 30ml,https://www.efghousewares.co.uk/bf-vitamin-c-facial-serum-30ml-pk12,https://www.amazon.co.uk/dp/B091X3KMZW,200.0,,Available (see Keepa data),6.0,16.116,13.43,2.49,0.25,2.42,0.55,0.41500000000000004,3.33,-14.024999999999999,-3.33,-14.575,-104.2560801144492,19.98,-702.4096385542168
3574660123906,,B002W6ONC6,CLEAN & CLEAR BLACK HEAD CLEANSER 200ML PK6,"Clean & Clear Blackhead Clearing Oil-Free Cleanser, 200ml,CLNCLR02",https://www.efghousewares.co.uk/clean-clear-black-head-cleanser-200ml-pk6,https://www.amazon.co.uk/dp/B002W6ONC6,,,Available (see Keepa data),12.0,18.131999999999998,15.11,2.5,0.25,2.52,0.55,0.4166666666666665,3.6859999999999986,-15.796666666666667,-3.6859999999999986,-16.346666666666668,-104.38484461472967,22.116,-784.64
5050375079496,5050375079496,B003XN1RIU,COTTON TREE PETROLEUM JELLY 284G PK6,"Cotton Tree Everday Essential Petroleum Jelly, 284G",https://www.efghousewares.co.uk/cotton-tree-petroleum-jelly-284g-pk6,https://www.amazon.co.uk/dp/B003XN1RIU,,Available (see Keepa data),Available (see Keepa data),17.0,7.380000000000001,6.15,3.05,0.25,2.65,0.55,0.5083333333333333,1.9200000000000004,-6.508333333333334,-1.9200000000000004,-7.058333333333334,-105.34825870646767,11.520000000000001,-277.7049180327869
5000207007159,,B001RYNKYQ,CLEAN & CLEAR MOISTURISER CREAM DUAL ACTION 100ML PK6,"Clean & Clear Dual Action Moisturiser, 100ml",https://www.efghousewares.co.uk/clean-clear-moisturiser-cream-dual-action-100ml-pk6-110589,https://www.amazon.co.uk/dp/B001RYNKYQ,,Available (see Keepa data),,9.0,17.46,14.55,2.1,0.25,2.42,0.55,0.34999999999999987,3.5540000000000003,-15.47,-3.5540000000000003,-16.02,-106.09271523178808,21.323999999999998,-915.4285714285713
03574661106366,,B001AV0ZUI,CLEAN & CLEAR 150ML BLACKHEAD SCRUB PK6,"Clean & Clear Blackhead Clearing Daily Scrub, 150 ml",https://www.efghousewares.co.uk/clean-clear-150ml-blackhead-scrub-pk6,https://www.amazon.co.uk/dp/B001AV0ZUI,,,Available (see Keepa data),13.0,18.804000000000002,15.67,2.25,0.25,2.65,0.55,0.375,3.824000000000002,-16.695,-3.824000000000002,-17.245,-106.3193588162762,22.944,-919.7333333333335
3574661245409,,B000KU70VC,CLEAN & CLEAR 150ML DEEP ACTION WASH PK6,"Clean & Clear Deep Action Wash Cream, White, 150 ml (Pack of 1)",https://www.efghousewares.co.uk/clean-clear-150ml-deep-action-wash-pk6,https://www.amazon.co.uk/dp/B000KU70VC,,Available (see Keepa data),Available (see Keepa data),4.0,16.116,13.43,2.33,0.25,2.65,0.55,0.3883333333333332,3.376,-14.388333333333332,-3.376,-14.938333333333333,-106.8550309966619,20.255999999999997,-769.3562231759655
5013826010547,,B001CLR60S,CLEAN & CLEAR 200ML DEEP CLEANSING LOTION PK6,"Clean & Clear Deep Cleansing Lotion for Sensitive Skin (1x 200ml), Clean and Clear Facial Cleanser with Salicylic Acid to Deeply Clean, Remove Dirt and Oil, Help Prevent Spots",https://www.efghousewares.co.uk/clean-clear-200ml-deep-cleansing-lotion-pk6,https://www.amazon.co.uk/dp/B001CLR60S,,,Available (see Keepa data),14.0,14.772,12.31,2.1,0.25,2.52,0.55,0.34999999999999987,3.126,-13.33,-3.126,-13.88,-107.93157076205287,18.756,-793.1428571428571
5031413940893,5031413919646,B08PS16PNX,FACE FACTS AGE DEFYING FACE SERUM 30ML PK12,Face Facts Hyaluronic Facial Serum | Sodium Hyaluronate + Glycerin + Betaine | Smooth + Plump + Hydrate | 30ml,https://www.efghousewares.co.uk/face-facts-age-defying-face-serum-30ml-pk12-124679,https://www.amazon.co.uk/dp/B08PS16PNX,200.0,Available (see Keepa data),Available (see Keepa data),12.0,15.168000000000001,12.64,1.79,0.14,2.42,0.55,0.29833333333333334,3.1500000000000004,-13.708333333333334,-3.1500000000000004,-14.258333333333335,-108.09957038160223,18.900000000000002,-955.8659217877097
5012251008822,5012251008822,B01MS9A5IW,BF ACTIVE TOOTHBRUSH TRAVEL 2S PK12,Beauty Formulas Active Oral Care 2 Travel Toothbrushes,https://www.efghousewares.co.uk/bf-active-t-brush-2s-travel-pk12,https://www.amazon.co.uk/dp/B01MS9A5IW,,,,2.0,10.739999999999998,8.95,1.25,0.32,1.5,0.55,0.20833333333333326,2.2639999999999993,-9.728333333333332,-2.2639999999999993,-10.278333333333332,-108.19298245614036,13.584,-986.7199999999999
5031413940565,5031413919646,B08PS16PNX,FACE FACTS HYALURONIC ACID SERUM PK12,Face Facts Hyaluronic Facial Serum | Sodium Hyaluronate + Glycerin + Betaine | Smooth + Plump + Hydrate | 30ml,https://www.efghousewares.co.uk/face-facts-hyaluronic-acid-serum-pk12-116244,https://www.amazon.co.uk/dp/B08PS16PNX,200.0,Available (see Keepa data),Available (see Keepa data),12.0,14.772,12.31,1.79,0.14,2.42,0.55,0.29833333333333334,3.0839999999999996,-13.378333333333334,-3.0839999999999996,-13.928333333333335,-108.30741316744428,18.504,-933.7430167597767
05013826017904,,B01BKOA9DM,CLEAN & CLEAR 150ML EXFOLIATING DAILY WASH PK6,"Clean and Clear Exfoliating Daily Wash, 150ml",https://www.efghousewares.co.uk/clean-clear-150ml-exfoliate-daily-wash-pk6,https://www.amazon.co.uk/dp/B01BKOA9DM,,Available (see Keepa data),Available (see Keepa data),18.0,14.1,11.75,2.21,0.25,2.65,0.55,0.3683333333333332,3.0399999999999996,-12.808333333333334,-3.0399999999999996,-13.358333333333334,-108.60433604336043,18.240000000000002,-725.3393665158371
5031413928617,5031413928600,B0BH56KHL9,FACE FACTS CERAMIDE REPLENISHING EYE CREAM 15ML PK12,"Face Facts Ceramide Eye Cream; Hydrates delicate skin; Strengthens skin barrier, reduces puffiness and dark circles; 5 Ceramides, Hyaluronic Acid, soothing Oats, Glycerin and Vitamin E; 15ml",https://www.efghousewares.co.uk/face-facts-ceramide-replenishing-eye-cream-15ml-pk12-109735,https://www.amazon.co.uk/dp/B0BH56KHL9,900.0,Available (see Keepa data),Available (see Keepa data),15.0,14.772,12.31,1.69,0.25,2.42,0.55,0.2816666666666665,3.106,-13.571666666666667,-3.106,-14.121666666666668,-109.81078278900983,18.636,-1002.7218934911243
5012251013512,5055193550073,B0F8R12PM1,BF WIPES BRIGHTENING VITAMIN C 25S PK12,Sunkissed Skin Vitamin C Cleansing Wipes 25 Pack,https://www.efghousewares.co.uk/bf-vitamin-c-make-up-wipes-30s-pk12-14-11,https://www.amazon.co.uk/dp/B0F8R12PM1,,Available (see Keepa data),Available (see Keepa data),6.0,10.739999999999998,8.95,2.18,0.39,2.42,0.55,0.3633333333333333,2.4619999999999993,-9.943333333333332,-2.4619999999999993,-10.493333333333332,-110.45614035087719,14.772,-577.6146788990825
5031413919660,5031413919646,B08PS16PNX,FACE FACTS HYALURONIC FACE SERUM 30ML PK12,Face Facts Hyaluronic Facial Serum | Sodium Hyaluronate + Glycerin + Betaine | Smooth + Plump + Hydrate | 30ml,https://www.efghousewares.co.uk/face-facts-hyaluronic-face-serum-30ml-pk12-109768,https://www.amazon.co.uk/dp/B08PS16PNX,200.0,Available (see Keepa data),Available (see Keepa data),12.0,14.772,12.31,1.79,0.43,2.42,0.55,0.29833333333333334,3.142,-13.668333333333333,-3.142,-14.218333333333334,-110.56246759979263,18.852,-953.1843575418994
05012251886710,5015833327946,B08W5B1WXX,BF VITAMIN C FACIAL SCRUB 150ML PK12,"Creightons Vitamin C Superfruits Glow Enzyme Scrub (150 ml) - An Energising and Exfoliating Scrub with Vitamin C, Natural Fruit Acids and Enzymes for Clearer, Radiant Skin",https://www.efghousewares.co.uk/bf-vitamin-c-facial-scrub-150ml-pk12-15-12-22,https://www.amazon.co.uk/dp/B08W5B1WXX,300.0,,,1.0,12.756,10.63,1.99,0.25,2.65,0.55,0.33166666666666655,2.8159999999999994,-11.871666666666668,-2.8159999999999994,-12.421666666666669,-111.1061419200954,16.896,-749.0452261306533
5031413914054,5031413913040,B07QT6RP88,FACE FACTS AGE DEFYING EYE CREAM 25ML PK12,Face Facts Hydrating Eye Cream | Aloe Vera Soothes + Calms | 25ml,https://www.efghousewares.co.uk/face-facts-age-defying-eye-cream-25ml-pk12-124677,https://www.amazon.co.uk/dp/B07QT6RP88,100.0,Available (see Keepa data),Available (see Keepa data),4.0,10.739999999999998,8.95,1.49,0.25,2.42,0.55,0.2483333333333333,2.4339999999999993,-10.378333333333332,-2.4339999999999993,-10.928333333333333,-115.03508771929825,14.604,-880.1342281879193
5012251011754,5012251011754,B00JUI85D2,BF FOAMING FACE WASH VITAMIN E 150ML PK12,Beauty Formulas Vitamin E Facial Wash,https://www.efghousewares.co.uk/bf-foaming-face-wash-vitamin-e-150ml-pk12-109628,https://www.amazon.co.uk/dp/B00JUI85D2,,,Available (see Keepa data),3.0,12.756,10.63,1.45,0.33,2.65,0.55,0.2416666666666667,2.8319999999999994,-12.401666666666667,-2.8319999999999994,-12.951666666666668,-115.84675014907573,16.992,-1071.8620689655174
5012251011761,5012251011761,B00JUI87GW,BF FACE SCRUB EXFOLIATING VITAMIN E 150ML PK12,Beauty Formulas Vitamin E Exfoliating Facial Scrub,https://www.efghousewares.co.uk/bf-face-scrub-exfoliating-vitamin-e-150ml-pk12-109629,https://www.amazon.co.uk/dp/B00JUI87GW,,,Available (see Keepa data),3.0,12.756,10.63,1.45,0.33,2.65,0.55,0.2416666666666667,2.8319999999999994,-12.401666666666667,-2.8319999999999994,-12.951666666666668,-115.84675014907573,16.992,-1071.8620689655174
05054805045150,5054805045143,B0CZRYXKXD,CIDAL PINK GRAPEFRUIT CLEANSING SOAP 2 x 100G PK8,"CIDAL Pink Grapefruit Cleansing Bar Soap, Antibacterial, With Grapefruit Extract, Twinpack (2 x 100g bars)",https://www.efghousewares.co.uk/cidal-pink-grapefruit-cleansing-soap-2-x-100g-pk8-123517,https://www.amazon.co.uk/dp/B0CZRYXKXD,600.0,,Available (see Keepa data),6.0,9.792,8.16,1.49,0.25,2.42,0.55,0.2483333333333333,2.276,-9.588333333333333,-2.276,-10.138333333333334,-116.39877535399923,13.656,-816.5100671140939
05054805039760,5054805045143,B0CZRYXKXD,CIDAL ORIGINAL CLEANSING SOAP 2 X 100G PK8,"CIDAL Pink Grapefruit Cleansing Bar Soap, Antibacterial, With Grapefruit Extract, Twinpack (2 x 100g bars)",https://www.efghousewares.co.uk/cidal-soap-2-x-125gm-pack-12,https://www.amazon.co.uk/dp/B0CZRYXKXD,600.0,,Available (see Keepa data),6.0,9.792,8.16,1.49,0.25,2.42,0.55,0.2483333333333333,2.276,-9.588333333333333,-2.276,-10.138333333333334,-116.39877535399923,13.656,-816.5100671140939
5012251009973,5012251009973,B00JUI73IK,BF FACIAL SCRUB CUCUMBER & AVOCADO 150ML PK12,BEAUTY FORMULAS FACE SCRUB CUCUMBER & AVOCADO,https://www.efghousewares.co.uk/bf-f-scrub-cucumber-avoco-150ml-pk12,https://www.amazon.co.uk/dp/B00JUI73IK,,Available (see Keepa data),Available (see Keepa data),12.0,12.756,10.63,1.37,0.33,2.65,0.55,0.22833333333333328,2.8319999999999994,-12.468333333333334,-2.8319999999999994,-13.018333333333334,-116.44305307096003,16.992,-1140.2919708029196
5012251009966,,B007U4HN5O,BF FACIAL SCRUB APRICOT 150ML PK12,BEAUTY FORMULAS FACE SCRUB APRICOT,https://www.efghousewares.co.uk/bf-f-scrub-apricot-150ml-pk12,https://www.amazon.co.uk/dp/B007U4HN5O,,Available (see Keepa data),Available (see Keepa data),8.0,12.756,10.63,1.35,0.32,2.65,0.55,0.22499999999999987,2.829999999999999,-12.475000000000001,-2.829999999999999,-13.025000000000002,-116.50268336314849,16.98,-1157.7777777777778
5012251009980,5012251009980,B007U45LVW,BF FACIAL SCRUB HONEY ALMOND 150ML PK12,BEAUTY FORMULAS FACE SCRUB HONEY & ALMOND,https://www.efghousewares.co.uk/bf-f-scrub-honey-almond-150ml-pk12,https://www.amazon.co.uk/dp/B007U45LVW,,Available (see Keepa data),Available (see Keepa data),10.0,12.756,10.63,1.25,0.32,2.65,0.55,0.20833333333333326,2.829999999999999,-12.558333333333334,-2.829999999999999,-13.108333333333334,-117.24806201550386,16.98,-1258.3999999999999
50314139130261,5031413913019,B07QT6PXDK,FACE FACTS HYDRATING NIGHT CREAM PK12,Face Facts Hydrating Night Cream | Soothes + Calms | 50ml,https://www.efghousewares.co.uk/quest-face-facts-hydrating-night-cream-pk12,https://www.amazon.co.uk/dp/B07QT6PXDK,100.0,Available (see Keepa data),Available (see Keepa data),5.0,10.464,8.72,1.49,0.25,2.65,0.55,0.2483333333333333,2.4339999999999997,-10.378333333333334,-2.4339999999999997,-10.928333333333335,-117.88924847177273,14.604000000000001,-880.1342281879196
5012251012294,5012251012294,B07GVTSTDY,BF WIPES ARGAN OIL 25S PK12,BEAUTY FORMULAS FACIAL WIPES ARGAN OIL,https://www.efghousewares.co.uk/bf-wipes-30s-argan-oil-pk12,https://www.amazon.co.uk/dp/B07GVTSTDY,,,,6.0,10.739999999999998,8.95,1.4,0.32,2.65,0.55,0.23333333333333317,2.493999999999999,-10.753333333333332,-2.493999999999999,-11.303333333333333,-118.98245614035088,14.964,-968.8571428571427
5031413914085,5031413914061,B0855TFTBV,FACE FACTS AGE DEFYING FACIAL SCRUB 75ML PK12,Face Facts Age Defying Facial Scrub | Acai Berry | 75ml,https://www.efghousewares.co.uk/face-facts-age-defying-facial-scrub-75ml-pk12-124678,https://www.amazon.co.uk/dp/B0855TFTBV,,,,1.0,10.739999999999998,8.95,1.25,0.32,2.65,0.55,0.20833333333333326,2.493999999999999,-10.878333333333332,-2.493999999999999,-11.428333333333333,-120.29824561403508,14.964,-1097.12
