EAN,EAN_OnPage,ASIN,SupplierTitle,AmazonTitle,SupplierURL,AmazonURL,bought_in_past_month,fba_seller_count,fbm_seller_count,total_offer_count,SupplierPrice_incVAT,SupplierPrice_exVAT,SellingPrice_incVAT,ReferralFee,FBAFee,PrepHouseFee,OutputVAT,InputVAT,NetProceeds,HMRC,NetProfit,ROI,Breakeven,ProfitMargin
5015934814314,5015934814314,B0DM277F9D,FUN BOX OF CRAFT BLUE,"Kids Fun Box of Craft with Glitter Glue, Pom Poms, Beads, Wobbly Eyes, Pipe Cleaners, Foam Shapes & More – Arts & Crafts Supplies for Ages 5+ – Ideal Rainy Day Activity, Craft Parties & Creative Play",https://www.efghousewares.co.uk/fun-box-of-craft-blue,https://www.amazon.co.uk/dp/B0DM277F9D,,,Available (see Keepa data),1.0,4.776,3.98,8.75,1.31,2.7,0.55,1.458333333333333,1.7079999999999997,-0.6983333333333328,-1.7079999999999997,-1.2483333333333329,-27.557027225901386,10.248000000000001,-17.119999999999994
8001841141374,3014260091323,B013DOE8MA,ORAL B TOOTHPASTE 123 EXTRA FRESH 100ML PK12,Oral-B Pro – Professional Protection Toothpaste Extra Fresh Mint 75 ml – Pack of 3,https://www.efghousewares.co.uk/oral-b-toothpaste-123-extra-fresh-100ml-pk12-109636,https://www.amazon.co.uk/dp/B013DOE8MA,300.0,Available (see Keepa data),,11.0,10.739999999999998,8.95,14.49,2.2,3.0,0.55,2.414999999999999,2.9399999999999995,-2.0749999999999993,-2.9399999999999995,-2.624999999999999,-27.631578947368414,17.639999999999997,-21.7391304347826
5012866020882,,B0CS6PJY1L,DIE CAST CONSTRUCTION TRUCK WITH 2 VEHICLES,"Atoz Diecast Construction Vehicle Set, Transporter Truck with Moving Parts, Includes Helicopter and Construction Vehicles",https://www.efghousewares.co.uk/die-cast-construction-truck-with-2-vehicles,https://www.amazon.co.uk/dp/B0CS6PJY1L,,,,,3.564,2.97,6.99,0.87375,2.41,0.55,1.165,1.36075,-0.4287500000000004,-1.36075,-0.9787500000000005,-27.805397727272734,8.1645,-16.802575107296143
05056267000845,,B0FHL2P8ZV,COLGATE TOOTHPASTE ADVANCED WHITE CHARCOAL 75ML PK6 (PM £2),"Colgate 3 x Advanced Charcoal Whitening Toothpaste 75ml | Deep Clean Whitening Paste with Activated Charcoal for Stain Removal, Fresh Breath, Enamel Protection and Healthy Gums | Fluoride Formula",https://www.efghousewares.co.uk/colgate-toothpaste-75ml-ad-charcoalpmp-2-pk6,https://www.amazon.co.uk/dp/B0FHL2P8ZV,50.0,Available (see Keepa data),,2.0,11.411999999999999,9.51,14.99,2.25,3.0,0.55,2.498333333333333,3.0619999999999994,-2.2683333333333326,-3.0619999999999994,-2.8183333333333325,-28.015241882041074,18.372,-22.56170780520346
5050868493112,5050868493112,B0CVLHRWB7,BLUEY SAVE WITH BLUEY,HTI Bluey Save With Bluey Toy | Money-Saving Toy for Kids | Interactive Piggy Bank Game | Educational Toddler Toy | Toy Money Coins | Electronic Musical Bluey Theme Tune Toy | 2+,https://www.efghousewares.co.uk/bluey-save-with-bluey-119417,https://www.amazon.co.uk/dp/B0CVLHRWB7,50.0,Available (see Keepa data),Available (see Keepa data),23.0,9.623999999999999,8.02,12.95,1.94,2.7,0.55,2.158333333333333,2.6419999999999995,-1.8683333333333332,-2.6419999999999995,-2.418333333333333,-28.218591987553477,15.852,-22.409266409266408
5050835101040,0019649518067,B0C6WZTWZ6,SPACE SQUISHIES 3 ASSORTED,"Schylling Teenie NeeDoh Cool Cats (3 Pack) - Mini Squishy Animals Fidget Toys, 8 Assorted Colours & Styles, Nee Doh Stress Balls For Anxiety Relief, Safe & Non-Toxic Dough; 3 Year Olds +",https://www.efghousewares.co.uk/space-squishies-3-assorted-117754,https://www.amazon.co.uk/dp/B0C6WZTWZ6,600.0,,,4.0,1.032,0.86,5.99,1.35,2.65,0.55,0.9983333333333331,1.082,0.13166666666666715,-1.082,-0.4183333333333329,-29.669030732860485,6.491999999999999,-8.380634390651077
5015934751060,5014631014492,B06XHQ7NY3,CARD GAMES HAPPY FAMILIES FISH A4,House of Marbles Go Fish Card Game,https://www.efghousewares.co.uk/card-games-happy-families-fish-a4-123439,https://www.amazon.co.uk/dp/B06XHQ7NY3,900.0,Available (see Keepa data),Available (see Keepa data),4.0,2.532,2.11,4.95,0.74,1.52,0.55,0.8250000000000002,0.9840000000000001,-0.2450000000000001,-0.9840000000000001,-0.7950000000000002,-29.887218045112785,5.903999999999999,-19.272727272727277
08710447353691,8711700634342,B01N38DNJ0,BRUT DEODORANT SPORT STYLE 200ML PK6,"6x BRUT Deodorant, Aerosol Sport Style 200 ml",https://www.efghousewares.co.uk/brut-deo-200ml-sport-style-pk6,https://www.amazon.co.uk/dp/B01N38DNJ0,50.0,,Available (see Keepa data),13.0,11.411999999999999,9.51,15.3,2.25,3.46,0.55,2.549999999999999,3.153999999999999,-2.469999999999998,-3.153999999999999,-3.019999999999998,-30.019880715705742,18.924,-23.6862745098039
5033849077426,,B005KJEZNE,M Y LARGE BINGO GAME,M.Y Traditional Bingo Game - Complete with Bingo Balls Dispenser and Bingo Cards,https://www.efghousewares.co.uk/m-y-large-bingo-game,https://www.amazon.co.uk/dp/B005KJEZNE,500.0,Available (see Keepa data),Available (see Keepa data),5.0,7.392,6.16,13.99,2.1,4.87,0.55,2.331666666666667,2.7360000000000007,-1.4716666666666667,-2.7360000000000007,-2.0216666666666665,-30.129160457029307,16.416,-17.3409578270193
5021813210054,,B0947BFPPJ,DINOSAUR SMALL HEAD TRICERATOPS TUB,HGL DINOSAUR TRICERATOPS HEAD Storage Tub,https://www.efghousewares.co.uk/dinosaur-small-head-triceratops-tub,https://www.amazon.co.uk/dp/B0947BFPPJ,,,,,6.048,5.04,8.91,1.11375,2.41,0.55,1.4849999999999994,1.82275,-1.138749999999999,-1.82275,-1.688749999999999,-30.210196779964203,10.9365,-22.74410774410773
5023765103767,,B0C5MY8HMY,FOOTBALL SPONGE BALL PK6,"HTI Fun Sport 20cm Yellow Foam Football | Soft Sponge Soccer Ball for Indoor & Outdoor Play | Perfect for Games & Fun | Safe for Adults, Boys & Girls of All Ages | Lightweight & Durable (19.4cm)",https://www.efghousewares.co.uk/football-sponge-ball-pk12,https://www.amazon.co.uk/dp/B0C5MY8HMY,800.0,,,,6.048,5.04,8.9,1.1125,2.41,0.55,1.4833333333333334,1.8225,-1.145833333333333,-1.8225,-1.695833333333333,-30.336911150864637,10.935,-22.86516853932584
5063327002947,5056161234957,B0FJSJWYC6,PEPPA PIG MY FIRST TABLET,Peppa My First Tablet - Electronic Playset Kids Toy Tablet - Interactive Sound Learning Role Play Set For Children - 9 Buttons 2 Slidey Features – Batteries Included,https://www.efghousewares.co.uk/peppa-pig-my-first-tablet-119425,https://www.amazon.co.uk/dp/B0FJSJWYC6,,,,3.0,8.652000000000001,7.21,11.95,1.79,2.77,0.55,1.9916666666666654,2.4640000000000013,-1.8116666666666665,-2.4640000000000013,-2.3616666666666664,-30.433848797250857,14.783999999999999,-23.715481171548113
5033849985738,5056358410829,B09BW1CZ9V,UNICORN MODELLING CLAY PULL ALONG CARRY CASE,Clay Pals Unicorn - Easy Sculpt Fun Fast Air Drying Non Toxic Quick Dry Ultra Light Creative Clay Art and Craft Modelling Set for Kids,https://www.efghousewares.co.uk/unicorn-modelling-clay-pull-along-carry-case-122559,https://www.amazon.co.uk/dp/B09BW1CZ9V,100.0,,,3.0,4.0200000000000005,3.35,7.49,1.12,2.42,0.55,1.248333333333333,1.4880000000000004,-0.648333333333333,-1.4880000000000004,-1.198333333333333,-30.726495726495717,8.928,-19.198931909212277
5050837543015,4006166413742,B01JFZST7G,AQUA HOOPS,"Rayher 66048000 DIY Dream Catcher Craft Kit with Three Metal Hoops, Wall Hanging in Aqua, Pink and Mint Pastel Colours, Length 41 cm",https://www.efghousewares.co.uk/aqua-hoops,https://www.amazon.co.uk/dp/B01JFZST7G,,,Available (see Keepa data),2.0,1.008,0.84,4.49,0.36,2.42,0.55,0.7483333333333331,0.8340000000000001,0.12166666666666737,-0.8340000000000001,-0.4283333333333327,-30.815347721822494,5.004,-11.447661469933164
5055566938682,,B004YJQG60,COWBOY GUN SET,Cowboy Gun Set With Holster Kids,https://www.efghousewares.co.uk/cowboy-gun-set,https://www.amazon.co.uk/dp/B004YJQG60,100.0,,,,1.008,0.84,4.76,0.595,2.41,0.55,0.793333333333333,0.879,0.12166666666666692,-0.879,-0.4283333333333331,-30.815347721822523,5.274,-10.798319327731088
5012866651055,5012866651055,B0F8R4198P,A-Z TRY ME MUSICAL GUITAR,"A to Z My First Musical Guitar for Babies, Light and Sound Effects, Educational Musical Toy, 0+ Months, White, Baby",https://www.efghousewares.co.uk/a-z-try-me-musical-guitar-120238,https://www.amazon.co.uk/dp/B0F8R4198P,,,,2.0,4.368,3.64,8.99,1.95,2.65,0.55,1.498333333333333,1.7580000000000002,-0.7483333333333331,-1.7580000000000002,-1.2983333333333331,-30.986475735879072,10.548,-17.33036707452725
5015934871218,5055949715374,B0CCMWS9M1,BARBIE MINITURES VENDING,"Fat-catz-copy-catz Doll's Sized Vending Soda Machine Toys For 11""-12"" Fashion Dolls House (Doll Not Included)",https://www.efghousewares.co.uk/barbie-minitures-vending-123372,https://www.amazon.co.uk/dp/B0CCMWS9M1,,,,1.0,4.632,3.86,6.95,1.06,1.69,0.55,1.1583333333333332,1.432,-0.8183333333333325,-1.432,-1.3683333333333325,-31.02796674225244,8.591999999999999,-23.625899280575524
5015934829530,4005556223138,B00WOFBCHO,MINI MEMORY GAME,Ravensburger Marvel Avengers Mini Memory Game - Matching Picture Snap Pairs Game For Kids Age 3 Years and Up,https://www.efghousewares.co.uk/mini-memory-game-118640,https://www.amazon.co.uk/dp/B00WOFBCHO,500.0,Available (see Keepa data),Available (see Keepa data),12.0,2.256,1.88,5.99,0.9,2.42,0.55,0.9983333333333331,1.15,-0.20833333333333304,-1.15,-0.7583333333333331,-31.207133058984905,6.899999999999999,-15.19198664440734
5033849384197,5033849384197,B07PXKZ169,UNICORNS,KandyToys TY9690 Unicorn with Accessories-2 Assorted Colours,https://www.efghousewares.co.uk/unicorns,https://www.amazon.co.uk/dp/B07PXKZ169,,,Available (see Keepa data),1.0,1.812,1.51,5.95,0.89,2.67,0.55,0.9916666666666663,1.124,-0.11166666666666569,-1.124,-0.6616666666666657,-32.11974110032358,6.744,-13.344537815126031
5012866061885,,B09PRR79CW,BASKETBALL SIZE,Lucas Regulation Size 7 Basketball Orange Orange,https://www.efghousewares.co.uk/basketball-size-108855,https://www.amazon.co.uk/dp/B09PRR79CW,50.0,,,,5.58,4.65,8.38,1.0475,2.41,0.55,1.3966666666666665,1.7314999999999998,-1.1241666666666665,-1.7314999999999998,-1.6741666666666666,-32.19551282051282,10.389000000000003,-23.97374701670644
5050837339113,,B0FMNVRVQ5,AMMO RELOAD 30 PIECES,"Benjia 30th Birthday Greeting Cards for Men Women, Born in 1996 UK Vintage Bday Card with Envelope, 30 Years Old Funny Birthdays Gift Card for Him Her Birthday Decoration Party Supply, 20x25 cm",https://www.efghousewares.co.uk/ammo-reload-30pce-116890,https://www.amazon.co.uk/dp/B0FMNVRVQ5,,,,,1.332,1.11,4.99,0.6237500000000001,2.41,0.55,0.8316666666666661,0.9387500000000001,0.014583333333333615,-0.9387500000000001,-0.5354166666666664,-32.254016064257016,5.6325,-12.875751503006002
5012866077282,,B08V6TFX8X,TRANSFORMER ROBOT ENGINEER 3PCE,"X-Force Twin Heroes Robot Car Transformer Toy Set, 2 Action Figures with Weapons, Ages 3+",https://www.efghousewares.co.uk/transformer-robot-engineer-3pce,https://www.amazon.co.uk/dp/B08V6TFX8X,,,,,4.5,3.75,7.51,0.93875,2.41,0.55,1.251666666666666,1.52975,-0.8404166666666661,-1.52975,-1.3904166666666662,-32.335271317829445,9.1785,-22.217043941411443
08720181072949,,B00GRSX7ZE,BRUT DEODORANT OUD 200ML PK6,Brut Deodorant Spray Original 6pk 200ML,https://www.efghousewares.co.uk/brut-deo-oud-200ml-pk6-109637,https://www.amazon.co.uk/dp/B00GRSX7ZE,600.0,,Available (see Keepa data),6.0,11.411999999999999,9.51,14.6,2.15,3.24,0.55,2.4333333333333336,3.0899999999999994,-2.7333333333333343,-3.0899999999999994,-3.283333333333334,-32.63750828363155,18.54,-26.98630136986302
6902088961430,,B0DLMBG4XN,CLOSE UP TOOTHPASTE EUCALYPTUS FREEZE 90G PK9,"2 x 90g Eucalyptus Closeup Toothpaste, Family Pack Toothpaste Cleans Protects and whitens Teeth",https://www.efghousewares.co.uk/close-up-toothpaste-eucalyptus-freeze-90g-pk9-109717,https://www.amazon.co.uk/dp/B0DLMBG4XN,,Available (see Keepa data),,1.0,5.76,4.8,7.99,0.64,2.42,0.55,1.331666666666666,1.682,-1.2016666666666653,-1.682,-1.7516666666666654,-32.741433021806834,10.092,-26.307884856070064
5033849070625,5033849070625,B0857C12ZT,MAGNETIC LETTERS AND NUMBERS 52PCE,KandyToys 52 Piece Magnetic Numbers & Letters - Perfect for Educational Toys Fridge Magnets Spelling and Maths,https://www.efghousewares.co.uk/magnetic-letters-and-numbers-52pce,https://www.amazon.co.uk/dp/B0857C12ZT,,Available (see Keepa data),Available (see Keepa data),9.0,2.148,1.79,6.2,0.93,2.67,0.55,1.0333333333333332,1.1880000000000002,-0.22333333333333272,-1.1880000000000002,-0.7733333333333328,-33.048433048433026,7.128,-14.967741935483858
5033849562281,5033849562281,B08FRL8BPP,CLEANING SET,Cleaning Set On Blistercard 5pc,https://www.efghousewares.co.uk/cleaning-set,https://www.amazon.co.uk/dp/B08FRL8BPP,,,Available (see Keepa data),5.0,3.96,3.3,9.47,1.42,3.9,0.55,1.5783333333333331,1.8340000000000003,-0.7283333333333322,-1.8340000000000003,-1.2783333333333322,-33.20346320346318,11.004,-16.19852164730727
5012866078814,,B0C5HNK75F,BIG WHEEL DINOSAUR TRANSPORTER 2 ASSORTED,"Toddler Truck Toys for 2 3 4 5 Year Old Boys Gifts, 5-Pieces Dinosaur Car Toys for Boys Age 2 3 4 5 6, Monster Truck Toy for Kids 2-4, Pull Back Cars for Toddlers Girls Age 2-5 Birthday Gifts",https://www.efghousewares.co.uk/big-wheel-dinosaur-transporter-2-assorted-122698,https://www.amazon.co.uk/dp/B0C5HNK75F,,Available (see Keepa data),,1.0,13.368,11.14,15.99,2.4,3.14,0.55,2.664999999999999,3.4459999999999997,-3.3550000000000004,-3.4459999999999997,-3.9050000000000002,-33.40461933276304,20.676,-29.305816135084427
5015934767849,,B0C1YSX2XH,CRYSTAL PAINTING SET,"Sheryl&Rain 23Pcs Diamond Painting Accessories,12 Grids Diamond Painting Storage Boxes, Diamonds Art Accessories 6Pcs Drill Pens,Trays,Spoon,Labels,Tweezers,Diamond Embroidery Tools for Adults",https://www.efghousewares.co.uk/crystal-painting-set-118439,https://www.amazon.co.uk/dp/B0C1YSX2XH,500.0,Available (see Keepa data),,1.0,2.616,2.18,5.09,0.76,1.67,0.55,0.8483333333333327,1.032,-0.36833333333333274,-1.032,-0.9183333333333328,-33.63858363858361,6.192,-21.65029469548132
5033849052287,5033849052287,B07Z5B81KG,SMART PHONE,Smart Phone,https://www.efghousewares.co.uk/smart-phone,https://www.amazon.co.uk/dp/B07Z5B81KG,,,Available (see Keepa data),4.0,4.236,3.53,7.49,1.12,2.42,0.55,1.248333333333333,1.524,-0.8283333333333327,-1.524,-1.3783333333333327,-33.782679738562074,9.144,-22.082777036048054
08717163545669,8720181335266,B0BWFRNPTJ,SURE APA COTTON DRY WOMEN 250ML PK6,Sure Cotton Dry Anti-Perspirant Aerosol Women's Deodorant Spray with a clean fragrance inspired by fresh cotton sheets for 48 hour protection against sweat and odour 6x 200 ml,https://www.efghousewares.co.uk/sure-apa-250ml-cotton-dry-women-pk6,https://www.amazon.co.uk/dp/B0BWFRNPTJ,100.0,,Available (see Keepa data),7.0,14.1,11.75,16.84,2.66,3.24,0.55,2.8066666666666666,3.6399999999999997,-3.616666666666667,-3.6399999999999997,-4.166666666666667,-33.87533875338754,21.84,-29.691211401425182
29319871000633,,B076PK3BZK,WHITE GLO T/P COFFEE & TEA FORMULA PK6,"White Glo Coffee Plus Tea Drinkers Formula Whitening Toothpaste, 100 ml, Pack of 4",https://www.efghousewares.co.uk/white-glo-t-p-coffee-tea-formula-pk6,https://www.amazon.co.uk/dp/B076PK3BZK,100.0,Available (see Keepa data),Available (see Keepa data),6.0,10.739999999999998,8.95,13.99,2.25,3.13,0.55,2.331666666666667,2.975999999999999,-2.671666666666666,-2.975999999999999,-3.221666666666666,-33.912280701754376,17.855999999999998,-27.634024303073616
5050837224112,,B099WTY9DQ,CREATIVE PLAY FACE PAINTS,"URAQT Face Paint Kit, 15 Color Face Painting Palette with 2 Brushes 32 Stencils, Washable Face Paints Safe Body Paint for Adults Kids Halloween Party Carnival, Makeup Paint Non-Toxic to Use",https://www.efghousewares.co.uk/creative-play-face-paints,https://www.amazon.co.uk/dp/B099WTY9DQ,,,,,2.616,2.18,5.94,0.7425,2.41,0.55,0.9900000000000002,1.1765,-0.38249999999999984,-1.1765,-0.9324999999999999,-34.157509157509146,7.059,-18.838383838383834
5033849041588,5033849041588,B076DJQ8TY,TRACTOR TRAILER SET 3PCE,KandyToys 3 Piece Plastic Tractor and Trailer Farm Vehicle Toy Play Set | Kids Toys,https://www.efghousewares.co.uk/tractor-trailer-set-3pce,https://www.amazon.co.uk/dp/B076DJQ8TY,,Available (see Keepa data),Available (see Keepa data),6.0,3.828,3.19,7.53,1.13,2.7,0.55,1.255,1.5139999999999998,-0.7449999999999997,-1.5139999999999998,-1.2949999999999997,-34.625668449197846,9.084,-20.63745019920318
6001067524304,6001067524304,B00F4LB1NA,COLGATE TOOTHBRUSH MAX FRESH MEDIUM PK12,"Colgate MaxFresh Medium Toothbrush, Mint, 0.3 kg",https://www.efghousewares.co.uk/colgate-t-brush-maxfresh-med-pk12,https://www.amazon.co.uk/dp/B00F4LB1NA,,,Available (see Keepa data),1.0,8.724,7.27,11.99,1.8,3.13,0.55,1.998333333333333,2.5500000000000007,-2.208333333333333,-2.5500000000000007,-2.758333333333333,-35.272804774083546,15.299999999999999,-27.60633861551292
5012866361114,,B09STG6BNT,AFTERNOON TEA PARTY,"45.9ft Fabric Bunting Flags, 46Pcs Vintage Garden Bunting + Drawstring Bag, Floral Bunting for Birthday, Party, Easter, Festival, Afternoon Tea Decorations",https://www.efghousewares.co.uk/afternoon-tea-party-113549,https://www.amazon.co.uk/dp/B09STG6BNT,,Available (see Keepa data),,1.0,8.844000000000001,7.37,9.99,0.8,2.42,0.55,1.6649999999999991,2.228000000000001,-2.264999999999999,-2.228000000000001,-2.8149999999999986,-35.54292929292927,13.368,-33.813813813813795
5033849006143,,B087V35YT4,FOOTBALL 32 PANEL BALL,M.Y 32 Panel Stitched 'Premier' Football - 1 of 4 Assorted Colours Sent At Random,https://www.efghousewares.co.uk/football-32-panel-ball-d000,https://www.amazon.co.uk/dp/B087V35YT4,,,,,3.36,2.8,6.45,0.80625,2.41,0.55,1.0750000000000002,1.31325,-0.6412500000000003,-1.31325,-1.1912500000000004,-35.55970149253733,7.879499999999998,-22.162790697674424
5015934773666,5070000198408,B08Z76J9YT,GRAFIX GL MAKE YOUR OWN  SCRAPBOOK,Bstorify Scrapbook Photo Albums 60 Pages (21 x 21 cm) Brown Thick Kraft Paper Scrap Book Ideal for Your Scrapbooking Albums Art & Craft Projects,https://www.efghousewares.co.uk/grafix-gl-make-your-own-scrapbook,https://www.amazon.co.uk/dp/B08Z76J9YT,,Available (see Keepa data),,1.0,5.640000000000001,4.7,6.97,0.56,1.87,0.55,1.1616666666666662,1.5360000000000005,-1.3216666666666672,-1.5360000000000005,-1.8716666666666673,-35.65079365079366,9.216,-32.22381635581063
5033849123833,5050203514922,B0CB8N8491,SQUEEZY BANANA PK12,"Henbrandt 12 x Squeeze Banana Toy with Water Beads Sticky Gel Sensory Stress Relief Toy for Kids and Adults Soft Squishy Sensory Fidget Ball for Autism, ADHD, Anxiety, Anti-Stress Squeeze Toy",https://www.efghousewares.co.uk/squeezy-banana-pk12-92369,https://www.amazon.co.uk/dp/B0CB8N8491,,Available (see Keepa data),,5.0,9.672,8.06,12.99,1.95,3.34,0.55,2.164999999999999,2.7800000000000002,-2.5249999999999986,-2.7800000000000002,-3.0749999999999984,-35.714285714285694,16.68,-28.40646651270206
05028763010536,5028763011618,B0764FMRTF,WISDOM TOOTHBRUSH ADVANCED INTERDENTAL FIRM PK10,"Wisdom Advanced Interdental Firm Brush, Pack of 5, Assorted Colors",https://www.efghousewares.co.uk/wisdom-t-brush-advan-interdental-firm-pk10n-a,https://www.amazon.co.uk/dp/B0764FMRTF,100.0,Available (see Keepa data),Available (see Keepa data),4.0,8.448,7.04,9.99,0.8,2.65,0.55,1.6649999999999991,2.208,-2.1649999999999983,-2.208,-2.714999999999998,-35.77075098814227,13.248000000000001,-32.61261261261259
5015934773550,,B0BSNT1ZK5,TRACTOR AND TRAILER SMALL,"Maisto Mini Working Machines MASSEY FERGUSSON 8S.265 TRACTOR WITH BALER TRAILER – 3” – Incredibly Detailed Die-Cast Replica Collectible Model, Assorted Models, Red",https://www.efghousewares.co.uk/tractor-and-trailer-small,https://www.amazon.co.uk/dp/B0BSNT1ZK5,50.0,,,,2.124,1.77,5.5,0.6875000000000001,2.41,0.55,0.9166666666666661,1.0835000000000001,-0.28416666666666623,-1.0835000000000001,-0.8341666666666663,-35.95545977011492,6.5009999999999994,-18.19999999999999
5015934857632,,B0D6K57679,MERMAID DOLL,"Mermaid Doll Toy for 3+ Girls Gifts, 3Packs",https://www.efghousewares.co.uk/mermaid-doll-120282,https://www.amazon.co.uk/dp/B0D6K57679,300.0,Available (see Keepa data),,1.0,4.596,3.83,7.64,1.15,2.42,0.55,1.2733333333333334,1.59,-1.0333333333333332,-1.59,-1.5833333333333333,-36.14916286149163,9.54,-24.86910994764398
5050837415411,5050837415411,B07G54ZGWP,ALIEN INVASION BOGGLE EYE BLINKERS,HTI Alien Boggle Blinker,https://www.efghousewares.co.uk/alien-invasion-boggle-eye-blinkers-112967,https://www.amazon.co.uk/dp/B07G54ZGWP,,,Available (see Keepa data),1.0,2.016,1.68,5.99,0.9,2.67,0.55,0.9983333333333331,1.1600000000000001,-0.2583333333333331,-1.1600000000000001,-0.8083333333333331,-36.24813153961135,6.96,-16.193656093489142
5050788094994,5060522532255,B09S3WFBL2,WHACK-A MOLE GAME MACHINE,"TEVO Whack Game With Hammer - A Mole Bashing Classic Arcade Game For Kids - Electronic Kids Board Games - Toys For 3,4,5,6 Year Old Boys & Girls - Boys Toys Age 3 Plus - Batteries Included",https://www.efghousewares.co.uk/whack-a-mole-game-machine-124912,https://www.amazon.co.uk/dp/B09S3WFBL2,,Available (see Keepa data),Available (see Keepa data),2.0,13.331999999999999,11.11,17.99,2.7,4.87,0.55,2.998333333333333,3.846,-3.6883333333333352,-3.846,-4.238333333333335,-36.34934248141797,23.076,-28.27126181211786
5014761300410,,B0018D97R0,HOT SHOTS YO YO,"HTI Hot Shot Light Up and Reverse Yo Yo's, 1 - Pack",https://www.efghousewares.co.uk/hot-shots-yo-yo,https://www.amazon.co.uk/dp/B0018D97R0,,,,,1.14,0.95,4.75,0.59375,2.41,0.55,0.7916666666666665,0.9007499999999999,0.004583333333333384,-0.9007499999999999,-0.5454166666666667,-36.361111111111114,5.4045,-13.778947368421052
08710447353509,8712561803274,B095CLFTSF,BRUT DEODORANT ATTRACTION TOTALE 200ML PK6,Brut Attraction Totale Mens Gents Deodorant Spray 200 ml 3 Pack,https://www.efghousewares.co.uk/brut-deo-200ml-attraction-totale-pk6,https://www.amazon.co.uk/dp/B095CLFTSF,100.0,Available (see Keepa data),Available (see Keepa data),3.0,11.411999999999999,9.51,13.75,1.98,3.1,0.55,2.291666666666666,3.0279999999999996,-3.131666666666666,-3.0279999999999996,-3.6816666666666658,-36.59708416169647,18.168,-32.130909090909086
5021813209638,,B09478GZ3R,DINOSAUR SMALL HEAD T REX TUB,HGL DINOSAUR SMALL HEAD T-REX TUB,https://www.efghousewares.co.uk/dinosaur-small-head-t-rex-tub,https://www.amazon.co.uk/dp/B09478GZ3R,,,,,6.648,5.54,8.85,1.10625,2.41,0.55,1.4749999999999996,1.9212499999999997,-1.6812500000000004,-1.9212499999999997,-2.23125,-36.63793103448276,11.527500000000002,-30.254237288135595
5033849045890,,B000H5V4N0,SKIPPING ROPE 2.1M,Jumbo Skipping Rope,https://www.efghousewares.co.uk/skipping-rope-2-1m-111953,https://www.amazon.co.uk/dp/B000H5V4N0,,,,,1.476,1.23,4.99,0.6237500000000001,2.41,0.55,0.8316666666666661,0.9627500000000001,-0.10541666666666627,-0.9627500000000001,-0.6554166666666663,-36.82116104868911,5.7764999999999995,-15.761523046092174
5026619052976,5026619052976,B00X9ZIDZM,TROPHY MINI 10CM PK12,Mini Plastic Trophy 10cm 12/Box Gold/Silver,https://www.efghousewares.co.uk/trophy-mini-10cm-pk12,https://www.amazon.co.uk/dp/B00X9ZIDZM,,,,3.0,3.024,2.52,6.79,1.02,2.7,0.55,1.1316666666666668,1.358,-0.5816666666666666,-1.358,-1.1316666666666666,-36.86210640608034,8.148,-20.0
028503059141,0028503059141,B076NVHQ1X,FUNTIME RAINBOW RAINMAKER  6 PLUS  MONTHS,"Funtime 55914 Rainbow Rainmaker Toy,for 6 months to 3 years, 23cm",https://www.efghousewares.co.uk/funtime-rainbow-rainmaker-6-plus-months-123830,https://www.amazon.co.uk/dp/B076NVHQ1X,800.0,,Available (see Keepa data),8.0,4.368,3.64,7.89,1.23,2.7,0.55,1.3149999999999995,1.6240000000000003,-0.9949999999999997,-1.6240000000000003,-1.5449999999999997,-36.87350835322194,9.744000000000002,-23.498098859315583
03094904043192,,B07BNQ32VZ,AQUAFRESH TOOTHPASTE 100ML TRIP PROT PK12,Aquafresh Triple Protection Fluoride Toothpaste Family Size 100ml X 12,https://www.efghousewares.co.uk/aquafresh-toothpaste-100ml-trip-prot-pk12-108498,https://www.amazon.co.uk/dp/B07BNQ32VZ,,Available (see Keepa data),Available (see Keepa data),22.0,12.084,10.07,15.05,2.26,3.58,0.55,2.508333333333333,3.2919999999999994,-3.3683333333333323,-3.2919999999999994,-3.918333333333332,-36.89579409918392,19.752,-31.24252491694351
08710447214404,8710908050794,B071Y76Y3G,REXONA APA STRESS CONTROL WOMEN 200ML PK6,"3X Rexona MotionSense ""stress control"" women's 48h deodorant spray, 150 ml",https://www.efghousewares.co.uk/rexona-apa-200ml-stress-control-women-pk6,https://www.amazon.co.uk/dp/B071Y76Y3G,,Available (see Keepa data),,1.0,12.084,10.07,14.29,2.14,3.1,0.55,2.381666666666666,3.1719999999999997,-3.4016666666666673,-3.1719999999999997,-3.951666666666667,-37.20966729441306,19.032,-33.18404478656404
8718951033542,8718951033542,B07D1J8N7H,COLGATE T/BRUSH 360 CHARCOAL PK12,"Colgate Toothbrush 360 Charcoal Black Medium Cdu 12, pack of 6",https://www.efghousewares.co.uk/colgate-t-brush-360-charcoal-pk12,https://www.amazon.co.uk/dp/B07D1J8N7H,,Available (see Keepa data),Available (see Keepa data),4.0,10.739999999999998,8.95,13.0,1.95,3.0,0.55,2.166666666666666,2.8899999999999992,-3.0666666666666647,-2.8899999999999992,-3.6166666666666645,-38.07017543859647,17.34,-33.384615384615365
5050203143061,5056747390527,B0DC15GPDH,SLIME BARREL SMALL PK24,"Non-Sticky Mini Barrel Slime Kit, 6 Random Goody Bag Fillers for Kids, Soft Stretchy Stress Toys, Easter Party Favor Supplies, Classroom Prizes for Boys and Girls - 210g",https://www.efghousewares.co.uk/slime-barrel-small-pk24,https://www.amazon.co.uk/dp/B0DC15GPDH,,,Available (see Keepa data),1.0,8.4,7.0,9.99,1.24875,2.41,0.55,1.6649999999999991,2.2417500000000006,-2.3337499999999993,-2.2417500000000006,-2.883749999999999,-38.19536423841058,13.4505,-34.639639639639626
5033849394493,5033849394493,B013Q3UNTA,DOLLS HEAD STYLING MODEL,KandyToys Doll Styling Head Playset with Accessories | 3 Designs to Collect,https://www.efghousewares.co.uk/dolls-head-styling-model-91347,https://www.amazon.co.uk/dp/B013Q3UNTA,,,Available (see Keepa data),6.0,8.4,7.0,13.94,2.09,4.87,0.55,2.3233333333333324,2.902,-2.343333333333333,-2.902,-2.8933333333333326,-38.3222958057395,17.412000000000003,-24.906743185078902
