EAN,EAN_OnPage,ASIN,SupplierTitle,AmazonTitle,SupplierURL,AmazonURL,bought_in_past_month,fba_seller_count,fbm_seller_count,total_offer_count,SupplierPrice_incVAT,SupplierPrice_exVAT,SellingPrice_incVAT,ReferralFee,FBAFee,PrepHouseFee,OutputVAT,InputVAT,NetProceeds,HMRC,NetProfit,ROI,Breakeven,ProfitMargin
5015934851456,0789481654291,B09Q7XTSDM,CRYSTAL HEALING STARTER CASE,"Healing Crystal for Beginners 7 Chakra Crystal Set,23 Pcs Healing Crystal Wiccan Reiki Gift,3 Types of Gemstones,Natural Gemstones,Raw Stones,Crystal Gravel with Instruction",https://www.efghousewares.co.uk/crystal-healing-starter-case-123450,https://www.amazon.co.uk/dp/B09Q7XTSDM,700.0,Available (see Keepa data),,1.0,4.596,3.83,10.99,2.2,3.0,0.55,1.831666666666667,1.9160000000000001,0.12833333333333297,-1.9160000000000001,-0.4216666666666671,-9.627092846270937,11.496000000000002,-4.604185623293908
05060087367736,,B01KYS6FCY,DERMA V10 24/7 DRY SKIN CREAM 100ML PK6,SIX PACKS of Derma V10 24/7 Dry Skin Cream 100ml,https://www.efghousewares.co.uk/derma-v10-24-7-dry-skin-cream-100ml-pk6,https://www.amazon.co.uk/dp/B01KYS6FCY,,,Available (see Keepa data),3.0,5.640000000000001,4.7,9.99,1.24875,2.41,0.55,1.6649999999999991,1.7817500000000006,-0.0337499999999995,-1.7817500000000006,-0.5837499999999995,-11.11904761904761,10.690500000000002,-7.012012012012006
08717644332559,8720181311376,B0BXF6G9H6,SURE APA SENSITIVE MENS 250ML PK6,"Sure Men Nonstop Protection Sensitive Deodorant Body Spray Antiperspirant with a clean fragrance & body heat activated technology for 72 hour odour and sweat protection 250 ml, Pack of 6",https://www.efghousewares.co.uk/sure-apa-250ml-sensitive-mens-pk6,https://www.amazon.co.uk/dp/B0BXF6G9H6,,,Available (see Keepa data),9.0,14.1,11.75,20.89,3.26,3.24,0.55,3.4816666666666656,3.76,-0.841666666666665,-3.76,-1.391666666666665,-11.314363143631423,22.56,-7.994255624700804
08717644345849,8720181197369,B0B34Y5XLQ,SURE APA INVISIBLE B&W CLOTHES WOMEN 250ML PK6,"Sure Women Nonstop Protection Invisible Aqua Deodorant Body Spray Antiperspirant with body heat activated technology & white mark protection for 72 hour odour and sweat protection 250 ml, Pack of 6",https://www.efghousewares.co.uk/sure-apa-250ml-invisible-b-w-clothe-women-pk6,https://www.amazon.co.uk/dp/B0B34Y5XLQ,200.0,,Available (see Keepa data),5.0,14.1,11.75,20.89,3.3,3.24,0.55,3.4816666666666656,3.768,-0.8816666666666659,-3.768,-1.431666666666666,-11.63956639566395,22.608,-8.224030636668257
08717163627129,8717163627129,B08ZFLHBSW,DOVE APA SPORT ACTIVE & FRESH MENS 250ML PK6,"Dove Men+Care DMC Deodorant Spray for Men Sport Active+Fresh, 6 x 250 ml",https://www.efghousewares.co.uk/dove-apa-sport-active-fresh-mens-250ml-pk6-114319,https://www.amazon.co.uk/dp/B08ZFLHBSW,50.0,,Available (see Keepa data),7.0,14.1,11.75,20.69,3.15,3.24,0.55,3.448333333333334,3.7379999999999995,-0.8983333333333334,-3.7379999999999995,-1.4483333333333335,-11.775067750677508,22.428,-8.400193330111165
5015934799369,9781802498332,1802498338,ACTIVITY CASE UNICORN,Bookoli - Unicorn Tin Activity case - Crafts Kits for Kids - Unicorn Gifts for Girls - Arts and Crafts,https://www.efghousewares.co.uk/activity-case-unicorn-117856,https://www.amazon.co.uk/dp/1802498338,50.0,Available (see Keepa data),,1.0,4.368,3.64,9.99,1.5,3.13,0.55,1.6649999999999991,1.7640000000000002,0.05500000000000105,-1.7640000000000002,-0.494999999999999,-11.813842482100213,10.584,-5.945945945945933
5033849059941,,B00FF5PJ06,LARGE DINOSAUR FIGURES,KandyToys Jurassic Era Large Soft Rubber Foam Dinosaur Figure 36cm Dinosaur Toys For Boys,https://www.efghousewares.co.uk/large-dinosaurs,https://www.amazon.co.uk/dp/B00FF5PJ06,,,,,8.736,7.28,12.99,1.62375,2.41,0.55,2.164999999999999,2.3727500000000004,-0.4887499999999987,-2.3727500000000004,-1.0387499999999987,-13.2662835249042,14.236500000000001,-9.595842956120078
5050788014459,,B093TB97QZ,FOOTBALL RETRO SIZE 5 MATT,Mitre Impel L30P Unisex Football,https://www.efghousewares.co.uk/football-retro-size-5-matt-110754,https://www.amazon.co.uk/dp/B093TB97QZ,,,,,3.36,2.8,7.49,0.93625,2.41,0.55,1.248333333333333,1.3392500000000003,0.09541666666666693,-1.3392500000000003,-0.4545833333333331,-13.569651741293528,8.035499999999999,-7.283044058744989
18717278898145,8906128100320,B096PJMGPL,DENIM FACE WASH ACNE PRONE SKIN 100ML PK6,"Minimalist 2% Salicylic Acid Face Wash for Oily Skin | Sulphate free, Anti Acne Face Cleanser With LHA & Zinc For Acne or Pimples | Men & Women, 100 ml (Pack of 1)",https://www.efghousewares.co.uk/denim-face-wash-100ml-anti-acne-pk6,https://www.amazon.co.uk/dp/B096PJMGPL,400.0,Available (see Keepa data),Available (see Keepa data),6.0,4.0200000000000005,3.35,7.99,0.64,2.65,0.55,1.331666666666666,1.4380000000000004,0.018333333333334423,-1.4380000000000004,-0.5316666666666656,-13.632478632478604,8.628,-7.98498122653315
08717644309001,8711600786271,B071GR43BG,DOVE APA 250ML GRAPEFRUIT WOMEN PK6,6 x Dove Women Deodorant Spray Go Fresh - Pomegranate and Lemon Verbena - 250 ml,https://www.efghousewares.co.uk/dove-apa-250ml-grapefruit-women-pk6,https://www.amazon.co.uk/dp/B071GR43BG,50.0,Available (see Keepa data),Available (see Keepa data),16.0,14.1,11.75,20.2,3.03,3.24,0.55,3.366666666666667,3.7139999999999995,-1.1866666666666674,-3.7139999999999995,-1.7366666666666675,-14.11924119241193,22.284,-10.316831683168322
8710447492154,8710522338728,B07BJGL1G6,REXONA APA 200ML ACTIVE PRO FRESH WOMEN PK6,Rexona deodorant Active Pro + Invisible Woman Savings – 3 Packs of 2 x 200 ml: Total – 1200 ml,https://www.efghousewares.co.uk/rexona-apa-200ml-active-pro-fresh-women-pk6-108504,https://www.amazon.co.uk/dp/B07BJGL1G6,,,Available (see Keepa data),1.0,12.084,10.07,22.44,6.36,3.24,0.55,3.7399999999999984,4.0440000000000005,-0.9699999999999971,-4.0440000000000005,-1.5199999999999971,-14.312617702448183,24.264000000000003,-8.128342245989288
5050835005546,5050835005546,B0DPJ2MQ7W,STRETCHERZ STRETCH MINIS,Stretcherz Stretch Squad Minis 5 Pack Assortment,https://www.efghousewares.co.uk/stretcherz-stretch-minis-112973,https://www.amazon.co.uk/dp/B0DPJ2MQ7W,,Available (see Keepa data),Available (see Keepa data),5.0,4.236,3.53,8.99,1.35,2.65,0.55,1.498333333333333,1.616,-0.03833333333333222,-1.616,-0.5883333333333323,-14.41993464052285,9.696,-7.853170189098985
08710447484685,8712561614153,B06Y4TQL8N,AXE BODY SPRAY BLACK 150ML PK6,"Axe Men Deodorant / Body Spray ""Black"" - Pack of 6 x 150 ml",https://www.efghousewares.co.uk/axe-b-spray-150ml-black-pk6,https://www.amazon.co.uk/dp/B06Y4TQL8N,,,Available (see Keepa data),4.0,12.084,10.07,17.99,2.7,3.23,0.55,2.998333333333333,3.3099999999999996,-1.0083333333333364,-3.3099999999999996,-1.5583333333333365,-14.673571876961736,19.86,-10.39466370205672
08710447484647,8712561218146,B07D19VTFW,AXE BODY SPRAY APOLLO 150ML PK6,"Axe Apollo Men's Deodorant / Body Spray, 0% Aluminium, Pack of 6 x 150 ml",https://www.efghousewares.co.uk/axe-b-spray-150ml-apollo-pk6,https://www.amazon.co.uk/dp/B07D19VTFW,,Available (see Keepa data),Available (see Keepa data),5.0,12.084,10.07,17.99,2.7,3.23,0.55,2.998333333333333,3.3099999999999996,-1.0083333333333364,-3.3099999999999996,-1.5583333333333365,-14.673571876961736,19.86,-10.39466370205672
08717644086612,8717644086612,B07MTVN891,REXONA APA INVISIBLE PURE WOMEN 200ML PK6,Rexona Women's Deodorant Spray 200 ml - Pack of 6,https://www.efghousewares.co.uk/rexona-apa-200ml-invis-pure-women-pk6,https://www.amazon.co.uk/dp/B07MTVN891,,Available (see Keepa data),Available (see Keepa data),3.0,12.084,10.07,17.93,2.69,3.23,0.55,2.9883333333333333,3.3079999999999994,-1.0483333333333338,-3.3079999999999994,-1.5983333333333338,-15.050219711236664,19.848,-10.69715560513107
08710847904974,8717644086612,B07MTVN891,REXONA APA BIORHYTHM WOMEN 200ML PK6,Rexona Women's Deodorant Spray 200 ml - Pack of 6,https://www.efghousewares.co.uk/rexona-apa-200ml-biorhythm-women-pk6,https://www.amazon.co.uk/dp/B07MTVN891,,Available (see Keepa data),Available (see Keepa data),3.0,12.084,10.07,17.93,2.69,3.23,0.55,2.9883333333333333,3.3079999999999994,-1.0483333333333338,-3.3079999999999994,-1.5983333333333338,-15.050219711236664,19.848,-10.69715560513107
08712561843362,8717644086612,B07MTVN891,REXONA APA 200ML BOUQUET WOMEN PK6,Rexona Women's Deodorant Spray 200 ml - Pack of 6,https://www.efghousewares.co.uk/rexona-apa-200ml-bouquet-women-pk6-108515,https://www.amazon.co.uk/dp/B07MTVN891,,Available (see Keepa data),Available (see Keepa data),3.0,12.084,10.07,17.93,2.69,3.23,0.55,2.9883333333333333,3.3079999999999994,-1.0483333333333338,-3.3079999999999994,-1.5983333333333338,-15.050219711236664,19.848,-10.69715560513107
08711600995888,8717644086612,B07MTVN891,REXONA APA TROPICAL WOMEN 200ML PK6,Rexona Women's Deodorant Spray 200 ml - Pack of 6,https://www.efghousewares.co.uk/rexona-apa-200ml-tropical-women-pk6,https://www.amazon.co.uk/dp/B07MTVN891,,Available (see Keepa data),Available (see Keepa data),3.0,12.084,10.07,17.93,2.69,3.23,0.55,2.9883333333333333,3.3079999999999994,-1.0483333333333338,-3.3079999999999994,-1.5983333333333338,-15.050219711236664,19.848,-10.69715560513107
08717163641316,8717644256176,B06XHNL4G3,AXE BODY SPRAY DARK TEMPTATION 150ML PK6,Axe Dark Temptation Men's Deodorant / Body Spray Pack of 6 x 150 ml,https://www.efghousewares.co.uk/axe-b-spray-150ml-dark-temptation-pk6,https://www.amazon.co.uk/dp/B06XHNL4G3,,Available (see Keepa data),Available (see Keepa data),4.0,12.084,10.07,17.9,2.69,3.23,0.55,2.9833333333333325,3.3079999999999994,-1.0733333333333341,-3.3079999999999994,-1.6233333333333342,-15.285624607658512,19.848,-10.882681564245816
08717163641859,,B00XEC25RC,AXE BODY SPRAY MUSK 150ML PK6,"Axe Deodorant Body Spray, Musk, 150 ml (Pack of 6)",https://www.efghousewares.co.uk/axe-b-spray-150ml-musk-pk6,https://www.amazon.co.uk/dp/B00XEC25RC,,,Available (see Keepa data),2.0,12.084,10.07,17.85,2.68,3.23,0.55,2.9749999999999996,3.305999999999999,-1.1049999999999986,-3.305999999999999,-1.6549999999999987,-15.583804143126162,19.836000000000002,-11.126050420168058
5050835015149,5050835042848,B0FNX2QV2Y,COSY CUDDLES PLUSH,"HTI Cosy Cuddles Animal Plush Cushion | Soft Weighted Plush Toy Pillow for Kids & Adults | Cute Stuffed Animal Cushion for Anxiety ADHD Autism Stress Relief | Crocodile, Pug, Unicorn | 18M+ (Unicorn)",https://www.efghousewares.co.uk/cosy-cuddles-plush-124885,https://www.amazon.co.uk/dp/B0FNX2QV2Y,,Available (see Keepa data),,1.0,6.9239999999999995,5.77,13.99,2.1,4.3,0.55,2.331666666666667,2.544,-0.5116666666666658,-2.544,-1.0616666666666659,-16.798523206751042,15.263999999999998,-9.106504646175834
5050837599913,,B0C5MY8HMY,FOOTBALL SPONGE 20cm,"HTI Fun Sport 20cm Yellow Foam Football | Soft Sponge Soccer Ball for Indoor & Outdoor Play | Perfect for Games & Fun | Safe for Adults, Boys & Girls of All Ages | Lightweight & Durable (19.4cm)",https://www.efghousewares.co.uk/football-sponge-20cm-119379,https://www.amazon.co.uk/dp/B0C5MY8HMY,800.0,,,,4.968,4.14,8.9,1.1125,2.41,0.55,1.4833333333333334,1.6425000000000003,-0.24583333333333268,-1.6425000000000003,-0.7958333333333327,-16.9687277896233,9.855,-10.730337078651676
08710447497487,8712561249089,B06Y4TP1B4,AXE BODY SPRAY AFRICA 150ML PK6,'6x Axe deodorant/body spray africa – 150 ml,https://www.efghousewares.co.uk/axe-b-spray-150ml-africa-pk6,https://www.amazon.co.uk/dp/B06Y4TP1B4,,,Available (see Keepa data),4.0,12.084,10.07,17.6,2.64,3.23,0.55,2.9333333333333336,3.297999999999999,-1.2733333333333334,-3.297999999999999,-1.8233333333333335,-17.16886377903327,19.788,-12.431818181818182
5015934751985,5015934457832,B081QG68NN,MAKE YOUR OWN BLING SOAP,Grafix Groovy Labz Make your own Bling Soap Age 12 +,https://www.efghousewares.co.uk/make-your-own-bling-soap,https://www.amazon.co.uk/dp/B081QG68NN,,,Available (see Keepa data),1.0,4.368,3.64,8.29,1.03625,2.41,0.55,1.381666666666666,1.5272500000000002,-0.17791666666666694,-1.5272500000000002,-0.727916666666667,-17.372712808273675,9.163499999999999,-10.536791314837158
08717644071342,4000388170117,B00BPUPWUW,DOVE BODY CREAM SILK 300ML PK4,Dove Body Silk Body Cream for Dry Skin 300 ml Pack of 4,https://www.efghousewares.co.uk/dove-body-cream-300ml-silk-pk4,https://www.amazon.co.uk/dp/B00BPUPWUW,50.0,,Available (see Keepa data),1.0,14.772,12.31,19.99,3.0,3.14,0.55,3.331666666666667,3.8,-1.7916666666666696,-3.8,-2.3416666666666694,-18.208916537065857,22.8,-14.057028514257148
6001067521631,6001067007289,B01EO0Q7BW,COLGATE TOOTHBRUSH DOUBLE ACTION MEDIUM PK12,"Pack of 12.Toothbrush, Colgate Double Action, medium, 18 cm.",https://www.efghousewares.co.uk/colgate-t-brush-double-action-med-pk12,https://www.amazon.co.uk/dp/B01EO0Q7BW,,,,7.0,5.364,4.47,8.99,0.72,2.7,0.55,1.498333333333333,1.6880000000000002,-0.39833333333333254,-1.6880000000000002,-0.9483333333333326,-18.89110225763611,10.127999999999998,-12.658509454949934
5012251013765,,B0FFG72GY2,BF NIACINAMIDE EXFOLIATING TONER PADS 30 PADS PACK OF 12,"Centella Korean Toner Pads, Centella Face Exfoliator Pads for Dark Spots Remover, Wrinkles & Dull Skin, Soothing & Exfoliating Face Padswith Snail Mucin, Niacinamide, Peptides, 100 Count",https://www.efghousewares.co.uk/bf-niacinamide-exfoliating-toner-pads-30-pads-pack-of-12-118898,https://www.amazon.co.uk/dp/B0FFG72GY2,400.0,Available (see Keepa data),,1.0,12.084,10.07,16.99,2.55,3.09,0.55,2.831666666666665,3.2519999999999993,-1.5516666666666659,-3.2519999999999993,-2.1016666666666657,-19.789704959196474,19.512,-14.84402589758681
08710447497586,8710447497401,B07RFN17GW,AXE BODY SPRAY ICE CHILL 150ML PK6,"Axe deodorant/body spray for men ""Ice Chill"" - 48H fresh - 150 ml",https://www.efghousewares.co.uk/axe-b-spray-150ml-ice-chill-pk6,https://www.amazon.co.uk/dp/B07RFN17GW,,,,6.0,12.084,10.07,17.18,2.57,3.23,0.55,2.8633333333333333,3.2839999999999994,-1.5533333333333346,-3.2839999999999994,-2.1033333333333344,-19.80539861895795,19.704,-14.69150174621654
08710447484869,,B005LPZZSG,AXE BODY SPRAY EXCITE 150ML PK6,AXE Body Spray Deodorant Excite 150 Ml / 5.07 Oz (Pack of 6) by AXE,https://www.efghousewares.co.uk/axe-b-spray-150ml-excite-pk6,https://www.amazon.co.uk/dp/B005LPZZSG,,,,6.0,12.084,10.07,16.49,2.06125,3.23,0.55,2.748333333333333,3.1822499999999994,-1.6195833333333347,-3.1822499999999994,-2.1695833333333345,-20.42922159447584,19.0935,-15.788356579745312
8006540387436,8700216788922,B0FVWDTNJ7,ORAL B TOOTHPASTE 123 EXTRA FRESH 75ML (PMP £1) PK12,"Oral-B 1•2•3 Extra Fresh Toothpaste 75ml, Pack of 6 | with Active Fluoride for Anti-Cavity Protection, Whitening & Long-Lasting Fresh Breath",https://www.efghousewares.co.uk/oral-b-toothpaste-123-75ml-pk12-109311,https://www.amazon.co.uk/dp/B0FVWDTNJ7,,,Available (see Keepa data),1.0,10.068000000000001,8.39,14.99,2.25,3.13,0.55,2.498333333333333,2.8640000000000008,-1.2783333333333333,-2.8640000000000008,-1.8283333333333334,-20.451155853840415,17.184,-14.636424282855238
5012251013741,,B0BPLYHDPG,BF VITAMIN C EXFOLIATING TONER PADS 30 PADS PACK OF 12,"Medicube Deep Vita C Facial Pads, Vitamin C Toner Pads for Uneven Skin Tone, 500,000PPM of Vitamin Water & 3 Types of Vitamin, Hydrating & Resurfacing (70 Sheets)",https://www.efghousewares.co.uk/bf-vitamin-c-exfoliating-toner-pads-30-pads-pack-of-12-118894,https://www.amazon.co.uk/dp/B0BPLYHDPG,,,,,12.084,10.07,15.3,1.9125,2.41,0.55,2.549999999999999,2.9884999999999993,-1.6424999999999983,-2.9884999999999993,-2.192499999999998,-20.645009416195837,17.931,-17.196078431372534
05028763009462,,B06XYG3KNS,WISDOM TOOTHPASTE WHITENING 100ML PK12,"Wisdom Fresh Effect Whitening Toothpaste, 100 ml, Pack of 12",https://www.efghousewares.co.uk/wisdom-toothpaste-whitening-100ml-pk12-109134,https://www.amazon.co.uk/dp/B06XYG3KNS,,,Available (see Keepa data),5.0,12.084,10.07,16.85,2.53,3.09,0.55,2.8083333333333336,3.2479999999999993,-1.6483333333333317,-3.2479999999999993,-2.1983333333333315,-20.699937225360934,19.487999999999996,-15.655786350148354
08717163648032,8712561466271,B00LMBPSEY,AXE BODY SPRAY GOLD TEMPTATION 150ML PK6,Axe Gold Temptation Deodorant Spray without Aluminium Pack of 6 x 150 ml,https://www.efghousewares.co.uk/axe-b-spray-150ml-gold-temptation-pk6,https://www.amazon.co.uk/dp/B00LMBPSEY,,,Available (see Keepa data),4.0,12.084,10.07,17.02,2.55,3.23,0.55,2.836666666666666,3.2799999999999994,-1.6666666666666679,-3.2799999999999994,-2.2166666666666677,-20.872567482736983,19.680000000000003,-15.628672150411289
08710447249246,8712561466271,B00LMBPSEY,AXE BODY SPRAY GOLD 150ML PK6,Axe Gold Temptation Deodorant Spray without Aluminium Pack of 6 x 150 ml,https://www.efghousewares.co.uk/axe-b-spray-150ml-gold-pk6,https://www.amazon.co.uk/dp/B00LMBPSEY,,,Available (see Keepa data),4.0,12.084,10.07,17.02,2.55,3.23,0.55,2.836666666666666,3.2799999999999994,-1.6666666666666679,-3.2799999999999994,-2.2166666666666677,-20.872567482736983,19.680000000000003,-15.628672150411289
5050565748140,,B0D3XP5Q6P,EXPANDING BALL 32CM,Expanding Ball DNA Toy - Breathing Ball Toy for Sensory Stimulation - Ideal for ADHD & Autism - Adult Novelty Stress Relief Toy (Large),https://www.efghousewares.co.uk/expanding-ball-32cm-108218,https://www.amazon.co.uk/dp/B0D3XP5Q6P,100.0,,,,2.124,1.77,5.99,0.74875,2.41,0.55,0.9983333333333331,1.0957500000000002,0.06291666666666673,-1.0957500000000002,-0.4870833333333333,-20.994971264367813,6.5745,-9.757929883138564
08717644316856,8720181269684,B0BQRT39FJ,DOVE ROLL ON INVISIBLE DRY WOMEN 50ML PK6,Dove Advanced Care Invisible Dry Anti-perspirant Deodorant pack of 6 with Triple Moisturising technology roll-on for 48 hours of protection 50 ml,https://www.efghousewares.co.uk/dove-roll-on-50ml-invisible-dry-women-pk6,https://www.amazon.co.uk/dp/B0BQRT39FJ,300.0,,Available (see Keepa data),8.0,8.052,6.71,13.06,2.06,3.13,0.55,2.176666666666666,2.4899999999999993,-1.0166666666666657,-2.4899999999999993,-1.5666666666666658,-21.57943067033975,14.939999999999998,-14.395099540581919
16920354824859,8714789324418,B07B3Z1H6Z,COLGATE TOOTHPASTE MAX WHITE 100ML PK12,Colgate Max Fresh Toothpaste with Cooling Crystals 6 x 100ml - Fresh Breath Toothpaste - Fresh FX Technology for 10X Longer Lasting Cooling* - Helps to Fight Cavities - Keeps Teeth White,https://www.efghousewares.co.uk/colgate-toothpaste-100ml-max-white-pk12,https://www.amazon.co.uk/dp/B07B3Z1H6Z,700.0,,Available (see Keepa data),3.0,13.824,11.52,18.9,3.15,3.14,0.55,3.1499999999999986,3.6720000000000006,-2.0600000000000005,-3.6720000000000006,-2.6100000000000003,-21.62386081193041,22.032,-16.571428571428573
5050835006444,,B0DM1X2392,PLUSH ASSORTED 10INCH,"6Pcs Precut Faux Fur Square, 25x25cm Assorted Colours Fluffy Fur Patches, Decorative Sewing Craft Fur Cuts, Shaggy Fake Plush Fabric, Artificial Fur Fabric for Christmas Gnome Costume",https://www.efghousewares.co.uk/plush-assorted-10inch-124884,https://www.amazon.co.uk/dp/B0DM1X2392,50.0,Available (see Keepa data),,1.0,5.172,4.31,7.99,1.2,1.73,0.55,1.331666666666666,1.558,-0.5816666666666657,-1.558,-1.1316666666666657,-23.285322359396414,9.347999999999999,-16.996245306633277
5015934814314,5015934814314,B0DM277F9D,FUN BOX OF CRAFT BLUE,"Kids Fun Box of Craft with Glitter Glue, Pom Poms, Beads, Wobbly Eyes, Pipe Cleaners, Foam Shapes & More – Arts & Crafts Supplies for Ages 5+ – Ideal Rainy Day Activity, Craft Parties & Creative Play",https://www.efghousewares.co.uk/fun-box-of-craft-blue,https://www.amazon.co.uk/dp/B0DM277F9D,,,Available (see Keepa data),1.0,4.776,3.98,8.75,1.31,2.7,0.55,1.458333333333333,1.7079999999999997,-0.6983333333333328,-1.7079999999999997,-1.2483333333333329,-27.557027225901386,10.248000000000001,-17.119999999999994
8001841141374,3014260091323,B013DOE8MA,ORAL B TOOTHPASTE 123 EXTRA FRESH 100ML PK12,Oral-B Pro – Professional Protection Toothpaste Extra Fresh Mint 75 ml – Pack of 3,https://www.efghousewares.co.uk/oral-b-toothpaste-123-extra-fresh-100ml-pk12-109636,https://www.amazon.co.uk/dp/B013DOE8MA,300.0,Available (see Keepa data),,11.0,10.739999999999998,8.95,14.49,2.2,3.0,0.55,2.414999999999999,2.9399999999999995,-2.0749999999999993,-2.9399999999999995,-2.624999999999999,-27.631578947368414,17.639999999999997,-21.7391304347826
05056267000845,,B0FHL2P8ZV,COLGATE TOOTHPASTE ADVANCED WHITE CHARCOAL 75ML PK6 (PM £2),"Colgate 3 x Advanced Charcoal Whitening Toothpaste 75ml | Deep Clean Whitening Paste with Activated Charcoal for Stain Removal, Fresh Breath, Enamel Protection and Healthy Gums | Fluoride Formula",https://www.efghousewares.co.uk/colgate-toothpaste-75ml-ad-charcoalpmp-2-pk6,https://www.amazon.co.uk/dp/B0FHL2P8ZV,50.0,Available (see Keepa data),,2.0,11.411999999999999,9.51,14.99,2.25,3.0,0.55,2.498333333333333,3.0619999999999994,-2.2683333333333326,-3.0619999999999994,-2.8183333333333325,-28.015241882041074,18.372,-22.56170780520346
08710447353691,8711700634342,B01N38DNJ0,BRUT DEODORANT SPORT STYLE 200ML PK6,"6x BRUT Deodorant, Aerosol Sport Style 200 ml",https://www.efghousewares.co.uk/brut-deo-200ml-sport-style-pk6,https://www.amazon.co.uk/dp/B01N38DNJ0,50.0,,Available (see Keepa data),13.0,11.411999999999999,9.51,15.3,2.25,3.46,0.55,2.549999999999999,3.153999999999999,-2.469999999999998,-3.153999999999999,-3.019999999999998,-30.019880715705742,18.924,-23.6862745098039
5023765103767,,B0C5MY8HMY,FOOTBALL SPONGE BALL PK6,"HTI Fun Sport 20cm Yellow Foam Football | Soft Sponge Soccer Ball for Indoor & Outdoor Play | Perfect for Games & Fun | Safe for Adults, Boys & Girls of All Ages | Lightweight & Durable (19.4cm)",https://www.efghousewares.co.uk/football-sponge-ball-pk12,https://www.amazon.co.uk/dp/B0C5MY8HMY,800.0,,,,6.048,5.04,8.9,1.1125,2.41,0.55,1.4833333333333334,1.8225,-1.145833333333333,-1.8225,-1.695833333333333,-30.336911150864637,10.935,-22.86516853932584
5033849016845,5033849016845,B072VDF9VX,TOOL SET IN CARRY CASE,Kids Children Tool Kit Set Kit Works Case Box Carry Case Role Play Activity Set,https://www.efghousewares.co.uk/tool-set-in-carry-case,https://www.amazon.co.uk/dp/B072VDF9VX,,Available (see Keepa data),Available (see Keepa data),16.0,7.056,5.88,11.3,1.7,3.26,0.55,1.8833333333333329,2.2780000000000005,-1.423333333333332,-2.2780000000000005,-1.973333333333332,-30.689476412649025,13.668000000000001,-20.955752212389363
5055566938682,,B004YJQG60,COWBOY GUN SET,Cowboy Gun Set With Holster Kids,https://www.efghousewares.co.uk/cowboy-gun-set,https://www.amazon.co.uk/dp/B004YJQG60,100.0,,,,1.008,0.84,4.76,0.595,2.41,0.55,0.793333333333333,0.879,0.12166666666666692,-0.879,-0.4283333333333331,-30.815347721822523,5.274,-10.798319327731088
5012866061885,,B09PRR79CW,BASKETBALL SIZE,Lucas Regulation Size 7 Basketball Orange Orange,https://www.efghousewares.co.uk/basketball-size-108855,https://www.amazon.co.uk/dp/B09PRR79CW,50.0,,,,5.58,4.65,8.38,1.0475,2.41,0.55,1.3966666666666665,1.7314999999999998,-1.1241666666666665,-1.7314999999999998,-1.6741666666666666,-32.19551282051282,10.389000000000003,-23.97374701670644
08720181072949,,B00GRSX7ZE,BRUT DEODORANT OUD 200ML PK6,Brut Deodorant Spray Original 6pk 200ML,https://www.efghousewares.co.uk/brut-deo-oud-200ml-pk6-109637,https://www.amazon.co.uk/dp/B00GRSX7ZE,600.0,,Available (see Keepa data),6.0,11.411999999999999,9.51,14.6,2.15,3.24,0.55,2.4333333333333336,3.0899999999999994,-2.7333333333333343,-3.0899999999999994,-3.283333333333334,-32.63750828363155,18.54,-26.98630136986302
6902088961430,,B0DLMBG4XN,CLOSE UP TOOTHPASTE EUCALYPTUS FREEZE 90G PK9,"2 x 90g Eucalyptus Closeup Toothpaste, Family Pack Toothpaste Cleans Protects and whitens Teeth",https://www.efghousewares.co.uk/close-up-toothpaste-eucalyptus-freeze-90g-pk9-109717,https://www.amazon.co.uk/dp/B0DLMBG4XN,,Available (see Keepa data),,1.0,5.76,4.8,7.99,0.64,2.42,0.55,1.331666666666666,1.682,-1.2016666666666653,-1.682,-1.7516666666666654,-32.741433021806834,10.092,-26.307884856070064
5015934767849,,B0C1YSX2XH,CRYSTAL PAINTING SET,"Sheryl&Rain 23Pcs Diamond Painting Accessories,12 Grids Diamond Painting Storage Boxes, Diamonds Art Accessories 6Pcs Drill Pens,Trays,Spoon,Labels,Tweezers,Diamond Embroidery Tools for Adults",https://www.efghousewares.co.uk/crystal-painting-set-118439,https://www.amazon.co.uk/dp/B0C1YSX2XH,500.0,Available (see Keepa data),,1.0,2.616,2.18,5.09,0.76,1.67,0.55,0.8483333333333327,1.032,-0.36833333333333274,-1.032,-0.9183333333333328,-33.63858363858361,6.192,-21.65029469548132
08717163545669,8720181335266,B0BWFRNPTJ,SURE APA COTTON DRY WOMEN 250ML PK6,Sure Cotton Dry Anti-Perspirant Aerosol Women's Deodorant Spray with a clean fragrance inspired by fresh cotton sheets for 48 hour protection against sweat and odour 6x 200 ml,https://www.efghousewares.co.uk/sure-apa-250ml-cotton-dry-women-pk6,https://www.amazon.co.uk/dp/B0BWFRNPTJ,100.0,,Available (see Keepa data),7.0,14.1,11.75,16.84,2.66,3.24,0.55,2.8066666666666666,3.6399999999999997,-3.616666666666667,-3.6399999999999997,-4.166666666666667,-33.87533875338754,21.84,-29.691211401425182
29319871000633,,B076PK3BZK,WHITE GLO T/P COFFEE & TEA FORMULA PK6,"White Glo Coffee Plus Tea Drinkers Formula Whitening Toothpaste, 100 ml, Pack of 4",https://www.efghousewares.co.uk/white-glo-t-p-coffee-tea-formula-pk6,https://www.amazon.co.uk/dp/B076PK3BZK,100.0,Available (see Keepa data),Available (see Keepa data),6.0,10.739999999999998,8.95,13.99,2.25,3.13,0.55,2.331666666666667,2.975999999999999,-2.671666666666666,-2.975999999999999,-3.221666666666666,-33.912280701754376,17.855999999999998,-27.634024303073616
6001067524304,6001067524304,B00F4LB1NA,COLGATE TOOTHBRUSH MAX FRESH MEDIUM PK12,"Colgate MaxFresh Medium Toothbrush, Mint, 0.3 kg",https://www.efghousewares.co.uk/colgate-t-brush-maxfresh-med-pk12,https://www.amazon.co.uk/dp/B00F4LB1NA,,,Available (see Keepa data),1.0,8.724,7.27,11.99,1.8,3.13,0.55,1.998333333333333,2.5500000000000007,-2.208333333333333,-2.5500000000000007,-2.758333333333333,-35.272804774083546,15.299999999999999,-27.60633861551292
