EAN,EAN_OnPage,ASIN,SupplierTitle,AmazonTitle,SupplierURL,AmazonURL,bought_in_past_month,fba_seller_count,fbm_seller_count,total_offer_count,SupplierPrice_incVAT,SupplierPrice_exVAT,SellingPrice_incVAT,ReferralFee,FBAFee,PrepHouseFee,OutputVAT,InputVAT,NetProceeds,HMRC,NetProfit,ROI,Breakeven,ProfitMargin
5031413929409,5031413929409,B0BH54R8B9,FACE FACTS LIP BALM JOY PIXELS FEELING PEACHY PACK OF 12,Face Facts Joy Pixels Peach Scented Lip Balms | Feeling Peachy | 2 x 4.25g Lip Balms | Vegan,https://www.efghousewares.co.uk/face-facts-lip-balm-joy-pixels-feeling-peachy-pack-of-12-125158,https://www.amazon.co.uk/dp/B0BH54R8B9,,Available (see Keepa data),Available (see Keepa data),8.0,9.396,7.83,2.98,0.25,1.46,0.55,0.4966666666666666,2.0180000000000007,-7.056666666666667,-2.0180000000000007,-7.6066666666666665,-90.77167859984088,12.107999999999999,-306.30872483221475
5031413919721,5031413919707,B08RD6753S,FACE FACTS COLLAGEN & Q10 DAY CREAM 50ML PK12,Face Facts Collagen & Q10 Day Cream | Collagen + Ubiquinone (Q10) |Soften + Smooth | Temporarily reduce the appearance of fine lines | 50ml,https://www.efghousewares.co.uk/face-facts-collagen-q10-day-cream-50ml-pk12-124687,https://www.amazon.co.uk/dp/B08RD6753S,,Available (see Keepa data),Available (see Keepa data),8.0,15.168000000000001,12.64,4.79,0.38,2.42,0.55,0.7983333333333333,3.1980000000000004,-11.448333333333334,-3.1980000000000004,-11.998333333333335,-90.96537781147333,19.188000000000002,-300.5845511482255
5012251010429,5012251010429,B00JUI6J6W,BF FACE MASK TEA TREE 100ML PK12,Beauty Formulas Australian Tea Tree Deep Cleansing Facial Mask,https://www.efghousewares.co.uk/bf-tea-tree-face-mask-100ml-pk12,https://www.amazon.co.uk/dp/B00JUI6J6W,,Available (see Keepa data),Available (see Keepa data),5.0,10.739999999999998,8.95,4.31,0.34,2.42,0.55,0.7183333333333333,2.451999999999999,-8.118333333333332,-2.451999999999999,-8.668333333333333,-91.24561403508771,14.712,-241.34570765661257
05025416031429,0701698161393,B075GY1H99,BMB BEARD SHAMPOO 300ML PK12,Be My Beard Conditioner and Shampoo Set 300ml,https://www.efghousewares.co.uk/bmb-beard-shampoo-300ml-pk12,https://www.amazon.co.uk/dp/B075GY1H99,100.0,,Available (see Keepa data),2.0,13.427999999999999,11.19,5.5,0.44,3.13,0.55,0.9166666666666661,3.0619999999999994,-10.176666666666666,-3.0619999999999994,-10.726666666666667,-91.36854060193072,18.371999999999996,-234.0363636363636
5031413930252,5031413928631,B0BH5528DX,FACE FACTS FACIAL SERUM CERAMIDE 30ML PK12,Face Facts Ceramide Repairing Serum | Repairs + Hydrates Skin | 30ml,https://www.efghousewares.co.uk/face-facts-facial-serum-ceramide-pk12-109752,https://www.amazon.co.uk/dp/B0BH5528DX,300.0,Available (see Keepa data),Available (see Keepa data),12.0,14.772,12.31,4.65,0.37,2.42,0.55,0.7749999999999999,3.13,-11.225,-3.13,-11.775,-91.56298600311041,18.78,-303.8709677419355
5031413928648,5031413928631,B0BH5528DX,FACE FACTS CERAMIDE REPAIRING SERUM CREAM 30ML PK12,Face Facts Ceramide Repairing Serum | Repairs + Hydrates Skin | 30ml,https://www.efghousewares.co.uk/face-facts-ceramide-repairing-serum-cream-30ml-pk12-109734,https://www.amazon.co.uk/dp/B0BH5528DX,300.0,Available (see Keepa data),Available (see Keepa data),12.0,14.772,12.31,4.65,0.37,2.42,0.55,0.7749999999999999,3.13,-11.225,-3.13,-11.775,-91.56298600311041,18.78,-303.8709677419355
8710447275306,8710447275306,B079KDMW6H,DOVE HAND CREAM 75ML INVIGORATE PK6,Dove - Hand and Nail Cream - 75 ml,https://www.efghousewares.co.uk/dove-hand-cream-75ml-invigorate-pk6,https://www.amazon.co.uk/dp/B079KDMW6H,,Available (see Keepa data),Available (see Keepa data),10.0,10.739999999999998,8.95,4.25,0.34,2.42,0.55,0.708333333333333,2.451999999999999,-8.168333333333333,-2.451999999999999,-8.718333333333334,-91.77192982456141,14.712,-246.16470588235293
05012251886789,5012251013444,B09M3YXYV2,BF RETINOL ANTI AGEING GEL CLEANSER 150ML PK12,Beauty Formulas RETINOL 150ML CLEANSER,https://www.efghousewares.co.uk/bf-retinol-anti-ageing-gel-cleanser-150ml-pk12-109630,https://www.amazon.co.uk/dp/B09M3YXYV2,,Available (see Keepa data),Available (see Keepa data),9.0,13.427999999999999,11.19,4.74,0.34,2.65,0.55,0.79,2.9459999999999997,-10.229999999999999,-2.9459999999999997,-10.78,-91.8228279386712,17.676,-272.9113924050633
05025416031436,,B01E91BJVE,BMB BEARD CONDITIONER 300ML PK12,By My Beard Conditioner Face Moisturiser 300ml,https://www.efghousewares.co.uk/bmb-beard-conditioner-300ml-pk12,https://www.amazon.co.uk/dp/B01E91BJVE,400.0,,Available (see Keepa data),3.0,13.427999999999999,11.19,4.75,0.38,2.65,0.55,0.7916666666666665,2.9539999999999997,-10.261666666666667,-2.9539999999999997,-10.811666666666667,-92.09256104486087,17.724,-273.13684210526316
5012251013451,5012251013451,B09M3X6KXR,BF RETINOL ANTI AGAING SERUM 30ML PK12,BEAUTY FORMULAS RETINOL 30ML SERUM,https://www.efghousewares.co.uk/bf-retinol-anti-againg-serum-30ml-pk12-109641,https://www.amazon.co.uk/dp/B09M3X6KXR,,Available (see Keepa data),Available (see Keepa data),3.0,16.116,13.43,4.68,0.42,2.42,0.55,0.7799999999999998,3.364,-12.37,-3.364,-12.92,-92.41773962804005,20.184,-331.2820512820513
5060087367774,,B007447XLO,DERMA V10 BODY BUTTER VANILLA 220ML PK12,"Derma V10 Vanilla Body Butter, 220 g",https://www.efghousewares.co.uk/derma-v10-body-butter-vanilla-220ml-pk12-109948,https://www.amazon.co.uk/dp/B007447XLO,100.0,Available (see Keepa data),,9.0,12.756,10.63,4.64,0.38,2.65,0.55,0.773333333333333,2.8419999999999996,-9.793333333333333,-2.8419999999999996,-10.343333333333334,-92.51639833035182,17.052000000000003,-267.5
5012251012409,5012251012409,B01N7KS9N8,BF MICELLAR CLEANSING WATER 200ML PK12,Beauty Formulas Micellar Water,https://www.efghousewares.co.uk/bf-micellar-cleansing-water-200ml-pk12-12-12,https://www.amazon.co.uk/dp/B01N7KS9N8,,,Available (see Keepa data),2.0,12.756,10.63,4.51,0.36,2.65,0.55,0.7516666666666665,2.837999999999999,-9.881666666666668,-2.837999999999999,-10.431666666666668,-93.30649970184854,17.028000000000002,-277.56097560975616
5031413919448,5031413919424,B08WJL4TQB,FACE FACTS FACIAL VITAMIN C FACE CREAM  50ML PK12,Face Facts Vitamin C Face Cream | Antioxidant-rich Vitamin C + Glycerin | Hydrate + Brighten skin | Vegan | 50ml,https://www.efghousewares.co.uk/face-facts-vitamin-c-face-cream-50ml-pk12-109744,https://www.amazon.co.uk/dp/B08WJL4TQB,50.0,Available (see Keepa data),,15.0,14.772,12.31,4.34,0.34,2.42,0.55,0.7233333333333332,3.1239999999999997,-11.453333333333333,-3.1239999999999997,-12.003333333333334,-93.33851736651114,18.744,-331.889400921659
05012251886567,5012251013222,B08CBLDQBW,BF FACIAL SCRUB GINGER & TURMERIC 150ML PK12,Beauty Formulas Ginger And Turmeric Superfood Facial Scrub,https://www.efghousewares.co.uk/bf-f-scrub-ginger-turmeric-150ml-pk12-24-11,https://www.amazon.co.uk/dp/B08CBLDQBW,,Available (see Keepa data),Available (see Keepa data),13.0,12.756,10.63,4.18,0.34,2.42,0.55,0.6966666666666663,2.7879999999999994,-9.906666666666666,-2.7879999999999994,-10.456666666666667,-93.53011329755515,16.728,-300.1913875598086
5012251013499,5012251013499,B09KRXL689,BF DAILY FACIAL WASH BRIGHTENING VITAMIN C 150ML PK12,Beauty Formulas BRIGHTENING VITAMIN C 150ML FACIAL WASH,https://www.efghousewares.co.uk/bf-vitamin-c-daily-facial-wash-150ml-pk12-18-,https://www.amazon.co.uk/dp/B09KRXL689,,Available (see Keepa data),Available (see Keepa data),15.0,12.756,10.63,4.46,0.36,2.65,0.55,0.7433333333333332,2.837999999999999,-9.923333333333334,-2.837999999999999,-10.473333333333334,-93.67918902802623,17.028000000000002,-281.7937219730942
5000158100664,5000158100664,B001AUJEZG,CLEARASIL TONER RAPID ACTION 200ML PK6,"Clearasil Ultra Rapid Action Deep Pore Salicylic Acid Treatment Toner, Unclog Pores For A Visibly Clearer Skin, Removes Dirt & Spots, 200ml",https://www.efghousewares.co.uk/clearasil-toner-rapid-action-200ml-pk6-108945,https://www.amazon.co.uk/dp/B001AUJEZG,500.0,,Available (see Keepa data),3.0,23.232,19.36,4.92,0.39,2.52,0.55,0.8199999999999994,4.564,-18.169999999999998,-4.564,-18.72,-94.02310396785535,27.384,-456.5853658536584
5031413953923,5031413929409,B0BH54R8B9,FACE FACTS CERAMIDE REPAIRING LIP BALM 10ML PK12,Face Facts Joy Pixels Peach Scented Lip Balms | Feeling Peachy | 2 x 4.25g Lip Balms | Vegan,https://www.efghousewares.co.uk/face-facts-ceramide-repairing-lip-balm-10ml-pk12-125175,https://www.amazon.co.uk/dp/B0BH54R8B9,,Available (see Keepa data),Available (see Keepa data),8.0,15.168000000000001,12.64,2.98,0.24,1.46,0.55,0.4966666666666666,2.9780000000000006,-11.856666666666667,-2.9780000000000006,-12.406666666666668,-94.06115744250695,17.868,-499.5973154362416
5031413960983,5031413929409,B0BH54R8B9,FACE FACTS CIRCA SOOTHING LIP BALM 10ML PK12,Face Facts Joy Pixels Peach Scented Lip Balms | Feeling Peachy | 2 x 4.25g Lip Balms | Vegan,https://www.efghousewares.co.uk/face-facts-circa-soothing-lip-balm-10ml-pk12-124717,https://www.amazon.co.uk/dp/B0BH54R8B9,,Available (see Keepa data),Available (see Keepa data),8.0,15.168000000000001,12.64,2.98,0.24,1.46,0.55,0.4966666666666666,2.9780000000000006,-11.856666666666667,-2.9780000000000006,-12.406666666666668,-94.06115744250695,17.868,-499.5973154362416
5031413946390,5031413935844,B0D4VXM9RF,FACE FACTS SPA BODY CLEANSER LACTIC ACID PACK OF 12,Face Facts Ceramide Hydrating Body Wash | Cleanses + Refreshes | 400ml,https://www.efghousewares.co.uk/face-facts-spa-body-cleanser-lactic-acid-pack-of-12-116255,https://www.amazon.co.uk/dp/B0D4VXM9RF,,,,5.0,22.560000000000002,18.8,4.99,0.4,2.65,0.55,0.8316666666666661,4.480000000000001,-17.691666666666666,-4.480000000000001,-18.241666666666667,-94.27217915590008,26.88,-438.67735470941875
5031413946437,5031413935844,B0D4VXM9RF,FACE FACTS SPA BODY CLEANSER GLYCOLIC ACID PACK OF 12,Face Facts Ceramide Hydrating Body Wash | Cleanses + Refreshes | 400ml,https://www.efghousewares.co.uk/face-facts-spa-body-cleanser-glycolic-acid-pack-of-12-116257,https://www.amazon.co.uk/dp/B0D4VXM9RF,,,,5.0,22.560000000000002,18.8,4.99,0.4,2.65,0.55,0.8316666666666661,4.480000000000001,-17.691666666666666,-4.480000000000001,-18.241666666666667,-94.27217915590008,26.88,-438.67735470941875
5031413935707,5031413935691,B0CLB6PMHT,FACE FACTS CERAMIDE BLEMISH GEL MOISTURISER 50ML PK12,Face Facts Ceramide Blemish Gel Moisturiser | Soothes + Strengthens | | 50ml,https://www.efghousewares.co.uk/face-facts-ceramide-blemish-gel-moisturiser-50ml-pk12-109770,https://www.amazon.co.uk/dp/B0CLB6PMHT,50.0,Available (see Keepa data),Available (see Keepa data),13.0,14.772,12.31,4.49,0.36,2.65,0.55,0.7483333333333331,3.1739999999999995,-11.578333333333333,-3.1739999999999995,-12.128333333333334,-94.31052358735096,19.044,-324.1425389755011
5031413956429,5031413929430,B0BH559VH6,FACE FACTS LIP BALM COLLAGEN PACK OF 24,Face Facts Joy Pixels Strawberry Scented Lip Balms | Kiss Me Quick | 2 x 4.25g Lip Balms | Vegan,https://www.efghousewares.co.uk/face-facts-lip-balm-collagen-pack-of-24-121545,https://www.amazon.co.uk/dp/B0BH559VH6,,Available (see Keepa data),Available (see Keepa data),6.0,16.788,13.99,2.99,0.25,1.46,0.55,0.4983333333333331,3.25,-13.208333333333332,-3.25,-13.758333333333333,-94.62402567629526,19.5,-552.1739130434781
5031413956436,5031413929409,B0BH54R8B9,FACE FACTS LIP BALM HYALURONIC ACID PACK OF 24,Face Facts Joy Pixels Peach Scented Lip Balms | Feeling Peachy | 2 x 4.25g Lip Balms | Vegan,https://www.efghousewares.co.uk/face-facts-lip-balm-hyaluronic-acid-pack-of-24-121546,https://www.amazon.co.uk/dp/B0BH54R8B9,,Available (see Keepa data),Available (see Keepa data),8.0,16.788,13.99,2.98,0.25,1.46,0.55,0.4966666666666666,3.25,-13.216666666666667,-3.25,-13.766666666666667,-94.68133883539662,19.5,-554.3624161073826
15050375107646,5050375107632,B00BSD64Q2,COTTON TREE PETROLEUM JELLY COCOA BUTTER 226G PK6,Cotton Tree Jumbo Petroleum Jelly 226G Cocoa Butter Daily Skin Body Care,https://www.efghousewares.co.uk/cotton-tree-petroleum-jelly-226g-c-butpk6,https://www.amazon.co.uk/dp/B00BSD64Q2,200.0,,Available (see Keepa data),13.0,6.0360000000000005,5.03,3.9,0.31,2.65,0.55,0.6499999999999999,1.7080000000000002,-4.74,-1.7080000000000002,-5.29,-94.80286738351255,10.248000000000001,-162.76923076923077
5050375107601,5050375107632,B00BSD64Q2,COTTON TREE PETROLEUM JELLY 226G PK6,Cotton Tree Jumbo Petroleum Jelly 226G Cocoa Butter Daily Skin Body Care,https://www.efghousewares.co.uk/cotton-tree-petroleum-jelly-226g-pk6,https://www.amazon.co.uk/dp/B00BSD64Q2,200.0,,Available (see Keepa data),13.0,6.048,5.04,3.9,0.31,2.65,0.55,0.6499999999999999,1.71,-4.75,-1.71,-5.3,-94.81216457960645,10.26,-163.07692307692307
5000158100633,,B001RYUB2A,CLEARASIL GEL WASH RAPID ACTION 150ML PK6,"Clearasil Exfoliating Face Wash, 150ml, Salicylic Acid Gel, Acne Wash, Blemish Treatment, Face Wash for Sensitive Skin, Oil Control, Works Fast, Reduces Redness, Spot Treatments, Skin Care",https://www.efghousewares.co.uk/clearasil-gel-wash-rapid-action-150ml-pk6-108946,https://www.amazon.co.uk/dp/B001RYUB2A,,,Available (see Keepa data),8.0,23.232,19.36,4.5,0.36,2.42,0.55,0.75,4.538,-18.39,-4.538,-18.94,-95.12807634354597,27.228,-505.0666666666667
5031413938548,5031413929843,B0C1GM28R6,FACE FACTS BODY SCRUB LEMON SWIRL PK6,"Face Facts Body Scrub | Mango Butter | Exfoliates + Smooths, Orange, 400 g (Pack of 1), Pack of 1",https://www.efghousewares.co.uk/face-facts-body-scrub-lemon-swirl-pk6-109755,https://www.amazon.co.uk/dp/B0C1GM28R6,200.0,Available (see Keepa data),Available (see Keepa data),8.0,15.443999999999999,12.87,4.99,0.4,3.13,0.55,0.8316666666666661,3.3899999999999997,-12.241666666666665,-3.3899999999999997,-12.791666666666666,-95.31793343268752,20.34,-307.6152304609218
5031413929867,5031413929843,B0C1GM28R6,FACE FACTS BODY SCRUB MANGO BUTTER 400G PK6,"Face Facts Body Scrub | Mango Butter | Exfoliates + Smooths, Orange, 400 g (Pack of 1), Pack of 1",https://www.efghousewares.co.uk/face-facts-body-scrub-mango-butter-400g-pk6-109759,https://www.amazon.co.uk/dp/B0C1GM28R6,200.0,Available (see Keepa data),Available (see Keepa data),8.0,15.443999999999999,12.87,4.99,0.4,3.13,0.55,0.8316666666666661,3.3899999999999997,-12.241666666666665,-3.3899999999999997,-12.791666666666666,-95.31793343268752,20.34,-307.6152304609218
5031413941135,5031413929843,B0C1GM28R6,FACE FACTS BODY SCRUB ALMOND MILK PK6,"Face Facts Body Scrub | Mango Butter | Exfoliates + Smooths, Orange, 400 g (Pack of 1), Pack of 1",https://www.efghousewares.co.uk/face-facts-body-scrub-almond-milk-pk6-116240,https://www.amazon.co.uk/dp/B0C1GM28R6,200.0,Available (see Keepa data),Available (see Keepa data),8.0,15.443999999999999,12.87,4.99,0.4,3.13,0.55,0.8316666666666661,3.3899999999999997,-12.241666666666665,-3.3899999999999997,-12.791666666666666,-95.31793343268752,20.34,-307.6152304609218
5031413938517,5031413929843,B0C1GM28R6,FACE FACTS BODY SCRUB ACAI BERRY PK6,"Face Facts Body Scrub | Mango Butter | Exfoliates + Smooths, Orange, 400 g (Pack of 1), Pack of 1",https://www.efghousewares.co.uk/face-facts-body-scrub-acai-berry-pk6-109754,https://www.amazon.co.uk/dp/B0C1GM28R6,200.0,Available (see Keepa data),Available (see Keepa data),8.0,15.443999999999999,12.87,4.99,0.4,3.13,0.55,0.8316666666666661,3.3899999999999997,-12.241666666666665,-3.3899999999999997,-12.791666666666666,-95.31793343268752,20.34,-307.6152304609218
5031413927429,5031413927412,B0BH55TXMP,FACE FACTS FACIAL SERUM MOISTURISING LACTIC ACID PK12,Face Facts Moisturising Facial Serum | Glowing and Even Skin | Lactic Acid | 30ml,https://www.efghousewares.co.uk/face-facts-facial-serum-moisturising-lactic-acid-pk12-109749,https://www.amazon.co.uk/dp/B0BH55TXMP,50.0,Available (see Keepa data),,11.0,14.772,12.31,3.99,0.32,2.42,0.55,0.665,3.1199999999999997,-11.725,-3.1199999999999997,-12.275,-95.45101088646966,18.720000000000002,-369.17293233082705
5031413927450,5031413927443,B0BH55ZGDF,FACE FACTS FACIAL SERUM RENEWING PK12,"Face Facts Renewing Facial Night Serum; Gentle level retinol (vitamin A), hydrating rice protein and brightening Vitamin C, renews and illuminates; Targets fine lines and uneven skin tone 30ml",https://www.efghousewares.co.uk/face-facts-facial-serum-renewing-pk12-109751,https://www.amazon.co.uk/dp/B0BH55ZGDF,100.0,Available (see Keepa data),Available (see Keepa data),9.0,14.772,12.31,3.95,0.32,2.42,0.55,0.6583333333333332,3.1199999999999997,-11.758333333333333,-3.1199999999999997,-12.308333333333334,-95.71021254536028,18.720000000000002,-373.92405063291136
17350087736607,,B00127X15G,E45 MOISTURISING LOTION 200ML PK6 MLR,"E45 Moisturising Lotion 200 ml, Daily Body Moisturiser for Dry & Sensitive Skin, Long-Lasting Hydration to Soothe, Protect & Restore Softness",https://www.efghousewares.co.uk/e45-moist-lotion-200ml-pk6-mlr,https://www.amazon.co.uk/dp/B00127X15G,,,Available (see Keepa data),11.0,16.512,13.76,3.15,0.25,1.87,0.55,0.5249999999999999,3.2860000000000005,-13.254999999999999,-3.2860000000000005,-13.805,-96.47099930118797,19.715999999999998,-525.9047619047619
5031413938500,5031413929843,B0C1GM28R6,FACE FACTS BODY SCRUB KIWI PARADISE PK6,"Face Facts Body Scrub | Mango Butter | Exfoliates + Smooths, Orange, 400 g (Pack of 1), Pack of 1",https://www.efghousewares.co.uk/face-facts-body-scrub-kiwi-paradise-pk6-109756,https://www.amazon.co.uk/dp/B0C1GM28R6,200.0,Available (see Keepa data),Available (see Keepa data),8.0,15.443999999999999,12.87,4.99,0.57,3.13,0.55,0.8316666666666661,3.424,-12.411666666666665,-3.424,-12.961666666666666,-96.5846994535519,20.544,-311.70340681362717
5031413968880,5031413929843,B0C1GM28R6,FACE FACTS BODY SCRUB PEAR & BASIL PK6,"Face Facts Body Scrub | Mango Butter | Exfoliates + Smooths, Orange, 400 g (Pack of 1), Pack of 1",https://www.efghousewares.co.uk/face-facts-body-scrub-pear-basil-pk6-116247,https://www.amazon.co.uk/dp/B0C1GM28R6,200.0,Available (see Keepa data),Available (see Keepa data),8.0,15.443999999999999,12.87,4.99,0.57,3.13,0.55,0.8316666666666661,3.424,-12.411666666666665,-3.424,-12.961666666666666,-96.5846994535519,20.544,-311.70340681362717
5031413927399,5031413927382,B0BH568LLY,FACE FACTS FACIAL SERUM CAFFEINE PK12,Face Facts Energising Facial Serum | Hydrates & awakens tired skin | 30ml,https://www.efghousewares.co.uk/face-facts-facial-serum-caffeine-pk12-109769,https://www.amazon.co.uk/dp/B0BH568LLY,,Available (see Keepa data),Available (see Keepa data),9.0,14.772,12.31,3.79,0.3,2.42,0.55,0.6316666666666664,3.1159999999999997,-11.871666666666666,-3.1159999999999997,-12.421666666666667,-96.59149818558838,18.696,-393.29815303430075
5012251012249,5012251012249,B01C7A6C5C,BF FACIAL SCRUB CHARCOAL PK12 150ML,Beauty Formulas Charcoal Facial Scrub,https://www.efghousewares.co.uk/bf-f-scrub-charcoal-pk12-150ml,https://www.amazon.co.uk/dp/B01C7A6C5C,,Available (see Keepa data),Available (see Keepa data),10.0,12.756,10.63,3.99,0.31,2.65,0.55,0.665,2.8279999999999994,-10.265,-2.8279999999999994,-10.815000000000001,-96.73524150268337,16.968000000000004,-325.2631578947369
5012251012393,5012251012393,B01N6JEIOP,BF WIPES MICELLAR 25S PK12,Beauty Formulas Micellar Cleaning Facial 25 Wipes,https://www.efghousewares.co.uk/bf-wipes-25s-micellar-face-pk12,https://www.amazon.co.uk/dp/B01N6JEIOP,,,Available (see Keepa data),3.0,10.739999999999998,8.95,3.59,0.29,2.42,0.55,0.5983333333333332,2.4419999999999993,-8.668333333333333,-2.4419999999999993,-9.218333333333334,-97.03508771929825,14.651999999999997,-308.13370473537606
05028763008489,5028763006508,B001E97DB0,WISDOM TOOTHBRUSH CLEAN BETWEEN  PK12,Wisdom Clean Between Toothbrush: Sensitive,https://www.efghousewares.co.uk/wisdom-t-brush-clean-between-pk12,https://www.amazon.co.uk/dp/B001E97DB0,50.0,Available (see Keepa data),Available (see Keepa data),5.0,9.396,7.83,2.39,0.25,1.5,0.55,0.3983333333333332,2.0260000000000007,-7.588333333333333,-2.0260000000000007,-8.138333333333334,-97.11614956245027,12.156,-408.61924686192464
55056235400153,5060337729802,B08WLQVFBN,DERMA V10 ANTI AGEING DAY CREAM WITH SPF25 50ML PK6,Derma V10 Innovations Anti-Ageing Day & Night Cream Collagen 50ml,https://www.efghousewares.co.uk/derma-v10-anti-ageing-day-cream-with-spf25-50ml-pk6-113314,https://www.amazon.co.uk/dp/B08WLQVFBN,,Available (see Keepa data),Available (see Keepa data),14.0,16.116,13.43,4.0,0.32,2.65,0.55,0.6666666666666665,3.3899999999999997,-13.066666666666666,-3.3899999999999997,-13.616666666666667,-97.40104911778732,20.34,-408.5
5031413919813,,B09BK4QXNC,FACE FACTS COLLAGEN & Q10 FACE SERUM PK12,"Face Facts Collagen Q10 Facial Serum with Ubiquinone (Q10), Collagen and Betaine; Softens and smooths; Helps to temporarily reduce the appearance of fine lines; 30ml",https://www.efghousewares.co.uk/face-facts-collagen-q10-face-serum-pk12-109767,https://www.amazon.co.uk/dp/B09BK4QXNC,100.0,Available (see Keepa data),Available (see Keepa data),19.0,14.772,12.31,3.58,0.29,2.42,0.55,0.5966666666666667,3.114,-12.036666666666667,-3.114,-12.586666666666668,-97.87454639709694,18.684,-421.8994413407821
5031413919752,,B0DDKW9TDN,FACE FACTS COLLAGEN & Q10 NIGHT CREAM 50ML PK12,Face Facts Collagen & Q10 Night Cream | Ubiquinone (Q10) + Vitamin E + Collagen | Smooth + skin elasticity | 50ml (Pack of 2),https://www.efghousewares.co.uk/face-facts-collagen-q10-night-cream-50ml-pk12-124688,https://www.amazon.co.uk/dp/B0DDKW9TDN,,,,1.0,15.168000000000001,12.64,3.58,0.29,2.42,0.55,0.5966666666666667,3.1800000000000006,-12.366666666666667,-3.1800000000000006,-12.916666666666668,-97.92772302249179,19.08,-432.96089385474863
8886467064388,8886467064388,B0BTDMX9TP,LUX SOAP BRIGHT IMPRESS 80G 3S PK16,Lux Bright Impress Camellia & Citrus Oil Soap x 3 Bars,https://www.efghousewares.co.uk/lux-soap-bright-impress-80g-3s-pk16-115137,https://www.amazon.co.uk/dp/B0BTDMX9TP,,Available (see Keepa data),Available (see Keepa data),9.0,17.184,14.32,3.92,0.31,2.65,0.55,0.6533333333333333,3.5660000000000007,-14.013333333333334,-3.5660000000000007,-14.563333333333334,-97.93768213405066,21.396,-445.8163265306123
5031413956412,5031413919851,B0BH552JFB,FACE FACTS LIP BALM VITAMIN C PACK OF 24,Face Facts Vitamin C Lip Mask 2 Pack,https://www.efghousewares.co.uk/face-facts-lip-balm-vitamin-c-pack-of-24-123519,https://www.amazon.co.uk/dp/B0BH552JFB,,,Available (see Keepa data),2.0,16.788,13.99,2.3,0.25,1.46,0.55,0.3833333333333333,3.25,-13.783333333333333,-3.25,-14.333333333333334,-98.57863365428702,19.5,-747.8260869565219
5012251013352,5012251013352,B09M3PBR4Q,BF FACIAL SHEET MASK BRIGHTENING VITAMIN C PK18,"BEAUTY FORMULAS BRIGHTENING VITAMIN C FACIAL MASK, Orange",https://www.efghousewares.co.uk/bf-facial-sheet-mask-brightening-vitamin-c-pk18-117219,https://www.amazon.co.uk/dp/B09M3PBR4Q,,Available (see Keepa data),Available (see Keepa data),6.0,16.116,13.43,2.29,0.25,1.5,0.55,0.3816666666666666,3.146,-13.271666666666667,-3.146,-13.821666666666667,-98.86742966142108,18.876,-724.2794759825327
5010605142642,,B0037SEU7Q,BEPANTHEN OINTMENT 30G PK5,"Bepanthen Nappy Care Ointment, 30g",https://www.efghousewares.co.uk/bepanthen-ointment-30g-pk5-122237,https://www.amazon.co.uk/dp/B0037SEU7Q,50.0,,Available (see Keepa data),16.0,17.856,14.88,3.75,0.6,2.42,0.55,0.625,3.690000000000001,-14.775,-3.690000000000001,-15.325000000000001,-99.31950745301361,22.139999999999997,-490.4
5012251011860,5012251011860,B00JUI7Z0G,BF WIPES TEA TREE 25S PK12,Beauty Formulas Australian Tea Tree Cleansing Wipes 30,https://www.efghousewares.co.uk/bf-wipes-30s-tea-tree-pk12-23-11,https://www.amazon.co.uk/dp/B00JUI7Z0G,,,Available (see Keepa data),5.0,10.739999999999998,8.95,3.59,0.29,2.65,0.55,0.5983333333333332,2.487999999999999,-8.898333333333333,-2.487999999999999,-9.448333333333334,-99.45614035087719,14.927999999999999,-315.82172701949867
5031413940596,,B0DDKXQ111,FACE FACTS FACIAL COLLAGEN SERUM PK12,Face Facts Collagen & Q10 Facial Serum | Ubiquinone (Q10) + Collagen + Betaine | Soften + Smooth | Temporarily reduce the appearance of fine lines | 30ml (Pack of 2),https://www.efghousewares.co.uk/face-facts-facial-collagen-serum-pk12-116245,https://www.amazon.co.uk/dp/B0DDKXQ111,,,,1.0,14.772,12.31,3.58,0.29,2.65,0.55,0.5966666666666667,3.1599999999999997,-12.266666666666667,-3.1599999999999997,-12.816666666666668,-99.6630378434422,18.96,-429.6089385474861
5031413937312,5031413937312,B0D3LQCK5Y,FACE FACTS BLEMISH PATCHES CLEAR & ROUND PACK OF 24,Face Facts Blemish Patches | Clear + Round | Salicylic Acid + Niacinamide | 36 Patches,https://www.efghousewares.co.uk/face-facts-blemish-patches-clear-round-pack-of-24-125201,https://www.amazon.co.uk/dp/B0D3LQCK5Y,,Available (see Keepa data),Available (see Keepa data),2.0,20.148,16.79,4.16,0.33,3.13,0.55,0.6933333333333334,4.16,-16.78333333333333,-4.16,-17.333333333333332,-99.96155324875048,24.959999999999997,-499.9999999999999
5060087361000,5060087361000,B002HXY31K,DERMA V10 BODY BUTTER COCONUT 220ML PK12,Derma V10 COCONUT Body Butter 220ml,https://www.efghousewares.co.uk/derma-v10-body-butter-coconut-220ml-pk12-109949,https://www.amazon.co.uk/dp/B002HXY31K,,,Available (see Keepa data),10.0,12.756,10.63,3.69,0.46,2.65,0.55,0.6149999999999998,2.8579999999999997,-10.665000000000001,-2.8579999999999997,-11.215000000000002,-100.31305903398926,17.148000000000003,-364.7154471544716
5031413930214,5031413930214,B0D45V7N8K,FACE FACTS FACIAL SERUM POLYPEPTIDE  PK12,Face Facts Polypeptide Facial Serum | Firm + Renew | 30ml,https://www.efghousewares.co.uk/face-facts-facial-serum-polypeptide-pk12-109750,https://www.amazon.co.uk/dp/B0D45V7N8K,,,Available (see Keepa data),3.0,14.772,12.31,6.95,0.55,5.32,0.55,1.1583333333333332,3.7459999999999996,-12.388333333333334,-3.7459999999999996,-12.938333333333334,-100.60912389839294,22.476,-223.39568345323744
