RowID,EAN,EAN_OnPage,SupplierTitle,AmazonTitle,NetProfit,bought_in_past_month
1202,5050565706331,,SQUARE STORAGE CONTAINERS 900ML 3PC,Sistema Ultra Airtight Pantry Storage Container | 920 ml Square Food Storage Container | Stackable | with Locking Clips | BPA-Free | Clear with Black Accents,2.53208333333333,100
1714,5053521105001,,"CORAL EASY COATER 4"" & FREE BRUSH",Coral 10501 Easy Coater Paint Kit with Headlock and Mini Roller Frame and Hybrid Brush 12 Piece Pack Set,2.06666666666666,500
444,742288768097,5060630696542.0,ELEGANCE SIDE PLATE GOLD LINE 19CM,"MATANA 40 Premium White Plastic Plates with Gold Lace Rim - 20x 26cm Dinner Plates, 20x 19cm Side Plates - Elegant & Reusable Dinnerware for Weddings, Birthdays, Catering, Parties",7.72499999999999,100
472,5053249253183,5053249253183.0,ELBOW GREASE TOILET CLEANER FOAM LEMON FRESH 500G,"3 x Elbow Grease Foaming Toilet Cleaner, Deep Cleaning Action, Lemon Fresh Fragrance 500g",2.09333333333333,200
1068,6260348201185,,SHAKILA CERIEL BOWL,6 Sets 6 Inch Cereal Bowls - 26 Oz Unbreakable Lightweight White Soup Bowls Set Dishwasher Safe For Fruit Salad Kitchen Ramen Mixing Scratch Resistant Reusable Gift For Wedding Home Everyday Use,2.98333333333333,100
2496,5056295709451,5065013587509.0,BLUE CANYON DIATOMITE BATHROOM MAT GREY WAVES 40X60CM,"Diatomite Stone Bath Mat Super Absorbent Quick Dry Easy to Clean Non Slip Versatile Mat for Bathroom, Kitchen, and More - 40x60 cm (Diatomite, Grey)",1.16666666666666,100
1108,5060082728365,,DLUX TELESCOPIC DUSTER ASSORTED COLOURS,Benjia 18th Birthday Banner Decorations for Boys Girls Born in 2007 UK Background Happy 18 Years Old Birthday Backdrop Cheers to 18 Years Banners Black Gold Poster Bday Gift Home Decor Party Supplies,2.27833333333333,50
427,5017403155331,5060630693961.0,ASHLEY HEX JAR WITH LID 110ML ASSORTED,"Oak & Steel - 12 Mini Clip Top Glass Spice Storage Jars - 100 ml Glass Canister Containers with Lids, 24 Labels and Chalk Pen (8 x 5cm) - Perfect for Spice Storage, Jam, Honey, Gifting",5.58333333333333,200
136,6923456822498,762765667798.0,COLOUR GLASS SOAP DISPENSER WITH PUMP 400ML ASSORTED COLOURS,"PH4 Wireless Gaming Headset with Microphone, Game/Music Mode, 2.4GHz Bluetooth Gaming Headphones for PS5, PS4, PC, Switch, Low Latency Lossless Sound Foldable Noise Cancelling Black Green",15.7216666666666,100
2044,8906106597708,5060875603527.0,TRIPLY CASSEROLE STAINLESS STEEL 24CM,INTIGNIS 24 cm Tri-Ply Stainless Steel Casserole 5 L – Honeycomb Hybrid Non-Stick – Induction & All-Hob Safe – Oven Safe with Glass Lid – PFOA-Free Thick Base – Premium Polished Steel Cookware,8.74833333333334,50
2277,5056175988792,5025364007330.0,KEEP IT HANDY ZIP SEAL FOOD & FREEZER 8 LARGE BAGS,"100 TidyZ Large Slide Zip Freezer Bags. Resealable. Zip Lock Food Bags. BPA Free. For Freezing Fruit, Vegetables, Meat. Keeps food Fresh. In a Dispenser Box",0.398333333333334,900
284,5012128193460,,HOME COLLECTION BLACK FRAME 8X10INCH,"Black 8X10 Inch wooden Photo Frame Set of 4 with Mount for 6X8, Boxed Gallery Picture Frames 10X8'' 4Pack,6X8 inch Oxford Modern Thin Picture Frame With Glass Window for Tabletop or Wallmounted",9.37125,50
2184,5055706641458,5060716230929.0,DLUX PRO KLEEN MICROFIBRE BATHROOM & KITCHEN MOP REFILL,DLUX PRO-KLEEN Super Absorbent Chenille Flat Floor Mop with Extendable Handle Hardwood Laminate Tile Cleaner Sweeper Microfibre Duster,0.381666666666667,50
1742,5055441431215,,DEKTON CUTTING DISC METAL 115MM,(10PK) 115mm Metal Cutting Discs - Stainless Steel Mild Steel Iron Ultra Thin Profile Slitting Discs Fast and Clean Cutting,0.781666666666666,100
1276,5024418247340,,SIL CRAFT STENCILS ASS,"Tree of Life Stencils - 12 Pcs Reusable Stencils for Painting, Crafts, DIY Art & Wall Décor",1.85166666666666,100
1129,5035288173387,,OCIO TOUCH LAMP RECHARGABLE GOLD 2 ASSORTED DESIGNS,"Aooshine Gold Cordless Table Lamps Set of 2, Touch Lamp with 3-Color Modes Rechargeable Night Light, Wireless Touch Control Bedside Lamps for Bedroom(Gold)",9.86166666666666,50
2135,5050565849120,,BEAU MERMAID 4PK PEARL WAVE  HAIR CLIPS 2 ASSTD COL,"Pearl Hair Clip - ShiningUU 2-Pack 3.3cm Large Snap Barrettes for Women, Girls & Children | Elegant Hair Accessories for Daily Styling, Parties & Weddings",0.531666666666667,50
1448,8414926397021,7427318221805.0,PLASTIC FORTE UNDER BED WHEELED STORAGE BOX 31LTR,"Muddy Hands Pack of 2-47 Litre Under Bed Plastic Storage Boxes with Lids – Clear Wheeled Storage Containers for Bedroom, Home & Office – Stackable & Space Saving",9.16041666666666,50
881,5024418596776,,SIL SHOE BRUSHES ASSORTED,"Shoe Brush Set, Horsehair Brushes, polish brush, 3 Pcs Shoe Polish Brushes + 1 PCS Plush Polishing Glove, Ideal for Boots, Car Seats, Bags, Sofas",3.16625,300
1747,5052516213509,,SMART CHOICE PUPPY/SMALL DOG ROPE TOY 5PK,"XL Dog Rope Toys for Aggressive Chewers - Set of 2 Heavy Duty Indestructible Dog Rope Toy for Large Breed Puppy- 100% Cotton Strong, Sturdy Rope - Medium and Large Dogs for Chewing, Teeth, Tug of War",1.605,50
23,5030017011138,,PANASONIC UPRIGHT   SDB113,"ElecKeys Cordless Vacuum Cleaner,65 Mins 580W 48KPa 1.8L Vacuum Cleaners for Home,Self-Standing Anti-Tangle Vacuum,Handheld Vacuum Cleaner Rechargeable Wall-Mounted for Carpets Floors Pet Hair",90.505,300
178,5056683919721,,"JAUNTY PARTYWARE CONFETTI PARTY BOWLS 6"" 12PK","Jaunty 24pk Bulk Party Flashing Glasses - Neon Rave Accessories - Light Up Glasses for Adults - Multicolour LED Glow for Birthdays, Festivals, Dance Events, Fancy Dress, and Celebration Parties",10.4195833333333,300
752,6923456821194,,DEEP PLATE 8 INCH,"Wrova Unbreakable Plastic Plates Set of 8-8 Inch Reusable Deep Plates for Kitchen, Dishwasher & Microwave Safe, Kitchen Set for Snacks & Desserts (Vivid Mix)",3.61166666666666,50
890,5055706699022,,SOZALI ROUND CONTAINER 450ML,"HOMESHOPA Round Food Storage Containers with Lids, 3 Pack 450ml Plastic Airtight & Watertight Leakproof Mason Jars for Overnight Oats with Locking Lid, BPA Free Microwave & Dishwasher Safe",2.67791666666666,100
466,6923456821293,727380548068.0,ADORN MUG MARBLE SMALL 7.3X8CM ASSORTED,"Dirt Bike Gifts, Motocross 3D Night Light for Kids for Xmas Holiday Birthday Gifts for KidsMotorcycle Fan with Remote Control 16 Colors Changing + 4 Changing Mode + Dim Function",5.33333333333333,100
1605,5024418437710,761644597485.0,SIL RAINBOW CRAFT STICKS 60PC,"OWLKELA 300PCS Mini Coloured Lollipop Sticks 2.5 inch, Wood Lolly Craft Sticks, Lolly Sticks for Home and School Crafts, Popsicle Sticks, Ideal for Arts and Handwork",1.24166666666666,500
911,5056295705569,607607527949.0,CASA & CASA PEBBLE SINK MAT CLEAR,"Sink Protector Mat, 2 Pack Kitchen Sink Mat Draining Board Cuttable Clear PVC Sink Dish Drying Mat Pebble Pattern Water Tank Filter for Ceramic Stainless Steel Sinks, Fast Draining Cut-to-Fit (30x40)",3.305,50
901,8720573955355,,STORAGE JAR GLASS 50ML,"50ml Amber Glass Jars 6Pcs, GAUATO Cosmetic Jars with Lids Lotion Container, Empty Glass Pots Face Cream Lotion Storage Jar for Make Up, Sample, Travel Use",2.25833333333333,100
1996,5009459070300,,WATCH DIGITAL BLACK ASSORTED CW0031,"SOCICO Men Digital Watch 3ATM Waterproof Sport with LED Back Light/Alarm/Date/Stopwatch, Outdoor Multifunctional Digital Wrist Watches",2.21166666666666,400
1539,5026180024242,,APOLLO JULIENNE PEELER,"Marshland Premium Y-Shape Julienne Vegetable Peeler - Non-Slippery Stainless Steel - Durable & Dishwasher Safe Julienne Peeler for Kitchen, Strong Grip & Rustproof (Y-Shape Julienne)",1.23291666666666,200
1713,5017403136309,,BLACKSPUR CHIPBOARD SCREWS 125G 16MM,"130 Pcs Self Tapping Wood Screws, M3.5 Black Flat Cross Head, Assorted Sizes (16mm/20mm/25mm/30mm/40mm/50mm), Drywall, Furniture, Wood Screws",1.07499999999999,200
2183,3830060640086,,PREMIUM SPAGETTI SPOON,"KitchenCraft Oval Handled Stainless Steel Spaghetti Server, Pasta Serving Spoon, Cooking Kitchen Utensil, Serving Spoon and Scoop, Dishwasher Safe, 31cm",0.478333333333333,100
683,5015934793282,5017741011849.0,POSTER PAINT 6,"Scola Readymix Water Based Tempera Paint, 6 Assorted Bright Colours, 600ml Bottles, Safe Non-Toxic Poster Paints, Craft Projects, Suitable for 3+",3.53333333333333,500
157,5038673190006,5055512090501.0,PRIMA SALAD BOWL FLOWER DESIGN 15CM,Argon Tableware 12x Classic White 18cm Cereal Bowls - Porcelain Ice Cream Ramen Oatmeal Dishes - Microwave and Dishwasher Safe,11.8062499999999,100
896,5056295709543,717932298961.0,CASA & CASA GRATER WITH STORAGE BOX BLACK,Cheese Grater with Container and Lid & Peeler Set - Vegetable Fruit Multi-Function Stainless Steel Kitchen Utensil Kit with Black Food Plastic Storage Stable Box - Hand Chopper Graters & Peelers,4.77666666666666,100
2311,6294016436517,685450202350.0,"ROYALFORD MORTAR AND PESTLE STAINLESS STEEL 2.6""x2.25""",Bekith Mortar and Pestle Sets 18/8 Brushed Stainless Steel Spice Grinder Pill Crusher Molcajete Herb Bowl,1.215,200
1851,5023674234712,,COUNTRY CLUB 3M KNITTED GLOVES BLACK,GM Apparel Ladies 3M Thinsulate Gloves | Thermal Knitted Gloves | Extra Warm & Lightweight Outdoor Winter Ski for Women,1.80833333333333,100
2409,5056295707938,,CASA & CASA WIRE COATED DISH RACK LARGE ALMOND,simplywire - Dish Drainer - Anti Rust Drying Rack – Cutlery Basket - White Plastic Coated Steel,1.77291666666666,50
2225,5038673180243,,PRIMA STAINLESS STEEL FOOD TONG 9INCH,"9 Inch Stainless Steel Food Serving Tongs Buffet Tongs Cooking Tong for Cooking, Salad, Meat, BBQ, Frying, Serving （3pcs）",0.442916666666666,100
1318,5063436122420,,CHRISTMAS WINE BOTTLE HOLDER ASSORTED,"KAV 12 Pcs Pack Assorted Wine Bottle Holographic Bags with Rope Holder for Christmas Gifts, Xmas Wrap, Wedding, Anniversary and Birthday Presents",2.57791666666666,100
867,5050796012744,5060659231229.0,BRIGHT & HOMELY FOIL ROASTING TRAY SQUARE 205MM X 205MM X 48MM 3 PIECES,"Caterserve 10 Aluminium Foil Trays with Lids - Large Tin Foil Containers with Paper Lids for Roasting, Baking, Broiling, Cooking, Food Storage and Freezing | 9 x 9 inch Square",2.50833333333333,400
1981,5015302428259,5065013103204.0,GLASS ASHTRAY 10.5CM,"Set of 2 Round Glass Ashtrays for Inside or Outside | 2 x 10.5 cm Ash Trays Indoors | Ash trays Outdoors for Home, Garden, Bar or Pub",0.735,400
922,5060577579977,,EXTRASTAR LED FLASHLIGHT TORCH,"EXTRASTAR Head Torch Rechargeable, Headlight with 3 Lights 4 Modes, LED Head Torch Headlamp for Camping, Fishing, Hiking, Jogging, Running, Cycling",4.50125,100
2442,6901750163653,,TRICIRCLE PADLOCK SOLID IRON 50MM,Yale - Y112/50/165/1 Iron Disc Padlock 50mm - Nickel Plated - Hardened Steel Long Shackle - Extreme Corrosion Resistance for Outdoor use,0.519583333333333,200
1059,5055257883222,,EVERLIGHTS ELECTRONIC BENDY BBQ LIGHTER,"Flexible Refillable Candle Lighter – Long Bendy Nozzle Butane Gas Lighter for Candles, BBQ, Grill, Fireplace & Kitchen – Adjustable Windproof Flame, Safety Lock, Ergonomic Handle, Reusable (GREY)",2.33166666666666,50
1102,8414926576341,3253928125011.0,RATTAN BASKET 5L 28X17CM ASSORTED,"Curver My Style Rattan Effect Set of 2 Kitchen, Living room, Bathroom, Bedroom, Utility X-Large Rectangular Storage Baskets 28 Litres - Off White",4.08,50
821,5061031651604,5061016731420.0,FLORAL FABRIC REFRESHER 500ML MAGNOLIA,"2 x 10 Litres AdBlue with Pour Spout | Premium Diesel Exhaust Fluid (DEF) | Reduces Emissions, Improves Engine Efficiency & Protects SCR Systems | ISO 22241 Certified (2 x 10 Litres)",3.635,50
216,8699303352828,5011423004662.0,WENKEN FOOD PROCESSOR & BLENDER 2 IN 1,"Kenwood FDP65.180SI 2 in 1 Food Processor Multipro Express, Silver",33.4383333333333,300
1021,8692952067501,8692952079030.0,LAV GLASS WHISKEY TUMBLER 345ML 3PCE,Lav Coral Tumbler Glasses. Coloured Base (Pack of 6) Whisky Juice Drinking Glasses Set. 345ml,4.23,200
256,8696287140151,,THL SPOON REST ASSORTED,"Spoon Rest for Kitchen, Ceramic Spoon Rest for Stove Top, Spoon Holder Set of 4 Kitchen Counter Coffee 4.8 Inches Heat Resistant Utensil Rest for Countertop, Tea Bag Holder Dish, Dishwasher Safe",6.695,100
